reviewId,userName,userImage,content,score,thumbsUp,appVersion,at,replyContent,repliedAt,scam_related
24ddc578-65fa-46be-ac81-7ec3931ded39,PENK1234,https://play-lh.googleusercontent.com/a-/ALV-UjVUEQneCdOMyyh9O1aRRApL1uh0vq9yBgiIJ-M-p8uTDDSAKobg,0 dating chance 100% snap nude sellers,1,0,,2023-05-31 18:08:27,"Hi there, where are you connecting from? Could you give us more details? You can write us at contact@feels-app.com
Thanks in advance, Feels team",2023-06-02 15:33:00,False
5bdf9752-6564-4e2c-af4d-bf6623e9c755,salaheddine Faddol,https://play-lh.googleusercontent.com/a-/ALV-UjVM7G4_7bB-_1jxTmekGNJqk5RwgJUrIpP02n6c0mbBEPUEmZI,"I got like 24 feels in the first days but I get NONE of the girls who feel me on my feed, it's extremely frustrating",1,0,,2023-05-11 21:18:14,,,False
f3ce002d-a68a-4748-8531-a5a028e7a4b9,Angelic Wars23,https://play-lh.googleusercontent.com/a-/ALV-UjWm748QeEqzLs9Q6Y_Oq2xpZv_lkaCrQB2CxIIyBu7yCTUcJGY6,love the app,5,0,4.5.2,2023-04-08 22:24:09,,,False
a3914207-9e9c-4d6d-9429-be1203ac009d,Stefan Bjørndal,https://play-lh.googleusercontent.com/a/ACg8ocKJ0H28enqw-XBxvTXk654g5LjSh9Pt97nACpwEAt_Z_8BKLw=mo,The idea behind the app is really cool. And i would honestly love to use it. I made a user and just a day in i had a ton of interests and likes. Wich is awesome. But to see them i have to pay a monthly price of minimum 349NOK. Wich for me is way to much. It is way to much for the state of the app. I can view 3 profiles before it stops loading in the next profile. To fix this i have to restart the application. If i could actually scroll and look at profiles i would be more interested in trying it,2,6,4.5.2,2023-03-26 10:25:08,"Hello Stefan, thank you to take the time to write to us. We launched the app recently and we are still improving the app and the performances little by little. The Discovery will be very smooth in a few weeks. Thanks in advance for your patience.",2023-03-27 10:43:39,False
ed16b1bf-f59d-4822-8f7f-aad95fe66a5c,Gia Quarles,https://play-lh.googleusercontent.com/a/ACg8ocKlhRSfDRRGN7Q1tfACoghCxebEaBBsW5G_JuCkDxI_5tmnDg=mo,Why do you have to load alot of photos just to continue the account makes zero sense,1,0,,2023-03-20 15:19:20,"Hello Gia, sur Feels, tous les profils sont construits de la même manière pour vous permettre de rapidement vous y retrouver et d'en découvrir un maximum sur la personnalité des autres.
Ainsi, tous les utilisateurs.rices partagent 9 séquences sur eux.elles avec des photos, des vidéos, des questions/réponses. Tout le monde joue au même jeu.",2023-03-27 11:40:52,False
6dc45215-8923-4384-9403-8b35197bb8f3,Rigo Ramirez,https://play-lh.googleusercontent.com/a-/ALV-UjUB4nGx5rLzyHFV_tz--31t0jzKkV1HbBfqVNNeiPmougjWikcq,you have to pay for a monthly subscription,1,0,4.5.1,2023-03-15 09:38:42,,,False
c9da602b-7a43-4fb3-9252-22b70404b06d,Louis Elioff,https://play-lh.googleusercontent.com/a/ACg8ocJW_gUlDPm1fMzKa-uml2Ct_KM6Cfr-UR6dEij3TFyRv9v6kA=mo,"Good UI, easy to use",5,0,4.4.2,2023-02-09 22:45:09,,,False
8a883f63-a6f8-4798-8f88-6a6416083adf,Parsa partovi,https://play-lh.googleusercontent.com/a-/ALV-UjVqINKlrdY-QGRUWCMm0HbayITQ5pVE5mjV6nQ2g8YIHJHfOiga,that app surprised me . i didn't see fake users,5,0,4.4.2,2023-01-31 13:38:13,,,False
2c8cc888-8149-4803-95dc-26c5698d4f3c,Adinidiin Owens,https://play-lh.googleusercontent.com/a/ACg8ocJnFmKgfCnVizpeXcjlZ7U1fDqirZ3--gDeXxc4ujvMnJgzBA=mo,Hardly anyone actually talks back. This is just used to share social media accounts not at all a dating site!!!!!,1,1,4.4.2,2023-01-27 20:09:47,"Hey there, sorry for the inconvenience, can you tell us from where you are connecting ? The app might not be launched in your area yet. At your disposal at contact@feels-app.com",2023-01-28 09:30:09,False
eb5ccd81-c59f-4f0c-a88f-e9c881d29f87,Christopher,https://play-lh.googleusercontent.com/a-/ALV-UjXHt-NKkeQgB4XIZsnOgc3FtfXKYs74-0Qo3-jmpkPCZWL0Kkp1,Fun concept at first but absolute garbage algorithm you can't talk with anyone without paying it doesn't show you people interested in your profil,1,1,4.3.1,2023-01-17 13:49:45,,,False
e6456db9-d31a-4737-a645-b9548f39ab08,Menine Langbraaten,https://play-lh.googleusercontent.com/a-/ALV-UjW-5j13ACz2l_LjBq4NQ3YlR55XU36m-pE7J78OlqftmSFC7M8L2w,"I like the idea, but having to pay to even use the app is super annoying, and the subscription it self is super expensive. I would be happy to pay maybe half the price, but 200 NOK for a subscription, that is beyond Netflix failure. Good idea, but greedy developers.",2,17,4.3.1,2023-01-09 06:59:39,,,False
85dda27a-b9d7-47e5-851d-aba475a3871d,Dale Martin,https://play-lh.googleusercontent.com/a/ACg8ocIqnYpMXBFKhhKSdlKs70Uq72ARTIkXTjQKUM5vM0VZeBzhIg=mo,no real basic options,1,0,4.3.1,2023-01-06 10:07:40,,,False
46ef0c60-3993-472a-b12c-c6c7b818ff2c,Rémi D,https://play-lh.googleusercontent.com/a-/ALV-UjWwjs827Ev3ml4Cuq45AWNyio3TOw6hQAk84Db9f_m_R8ZMwK82,L'application était originale avec les messages à envoyer obligatoirement. Maintenant c'est une application lambda sans intérêt,1,23,4.3.1,2023-01-03 14:34:55,,,False
2f0d4909-36c1-4a27-9fa7-3ac3a26ae76e,OMAR,https://play-lh.googleusercontent.com/a-/ALV-UjVDpr2JO3KQhlz4cfv-5IHG35J-7mXpXGF5FTvyyXGbFItHqzIt,"The app seems to be.. okay-ish.. but it i can't see the difference between ""interests"" and ""feels"" ? Does interest means the people i like? Or the people who like me ? And if it's the people who like me, why the hell don't i have access to the list? I'm sure i have matched with some of the people in there yet it still doesn't show in ""feels"" ? Keep up the good work tho, the app has potential 👍🏼",3,2,4.3.1,2023-01-02 14:46:30,,,False
99f3ea35-08f3-4fb2-b43f-46bd478a98aa,richard klegin,https://play-lh.googleusercontent.com/a-/ALV-UjWjHkDAFgAs2MiKksQybO43jk4aTGn5f6y7m588EM-K18lOlUtj,Garbage app . Doesn't even work,1,0,,2022-12-31 17:56:33,,,False
64931fd1-9435-4b1e-adee-4586516fc931,Sergey Lyov,https://play-lh.googleusercontent.com/a-/ALV-UjXqzuvUPxnbtl-Wz5KlhuLJTBxPaZvFkpyEHdDDg0jxjNeIXZY,"The algorithm is creepy, it doesn't show people who liked u for discovery, even if I'm sure that I matched with someone it doesn't show it in ""feels""",2,3,4.3.1,2022-12-28 02:30:25,,,False
61087434-199d-458b-b39a-caa0eb7590ad,Colin Price,https://play-lh.googleusercontent.com/a-/ALV-UjVeeZqzQ1cD_TBmydil6YRBSEAwpMkq8bLQv0-S_AWKYf0FOFl7,"Failure in the making. After a lengthy profile build, which you cannot bypass, you finally hit a subscription pay wall. You cannot view anything prior to this and have no way to know if there are any actual people in your area. I figured I'd give it a go, but there isn't a single profile within a 200 mile radius of me. I don't live in the middle of nowhere, but I wouldn't liked some way to test out the app before wasting $8 and a half an hour of my time.",1,1,,2022-12-11 02:39:41,"Hey Colin, truly sorry about that experience. You can indeed bypass the paywall. We will work on that to avoid these kinds of suprises. Very sorry about that and dont hesitate to request a reimbursement from the Play Store, we would rather not take that money. Write us to contact@feels-app.com so we can help you find a solution.",2022-12-12 09:02:32,False
15921035-3eea-42e6-8310-0fdd09883038,Andrew Thomas,https://play-lh.googleusercontent.com/a/ACg8ocLiaDjW2vBHH-BI625usWCoi228bO0DPqz_IfMs0rIuBhMejA=mo,Just a scam.just want your money for a Subscription,1,1,4.0.1,2022-11-11 17:50:29,,,True
88d1f779-edba-46fc-a3ad-e57b766e3533,Sébastien,https://play-lh.googleusercontent.com/a/ACg8ocJcLXRpmPwoUbFZrXOYN6iZ8TqFTVFiftBLIgn5Vp7lB-CzJw=mo,Sign-in with phone number from France don't works,1,0,3.23.0,2022-10-13 21:28:35,N'hésitez pas à nous écrire à contact@feels-app.com pour nous en dire plus sur le bug rencontré ! On vous aidera au plus vite et au mieux.,2022-10-25 09:13:47,False
f5b8afd7-7f9c-44ce-85ee-786a32c21917,Mark,https://play-lh.googleusercontent.com/a/ACg8ocJ91Qp1eBz9FnMB0COU0fN1yAK4Y7RpxwcVmyvwbu9rZ23t0g=mo,I could not verify my phone number as no text was sent out,1,0,,2022-10-02 13:55:41,"Nous avons quelques cas de personnes qui rencontrent le même bug que vous. Il semblerait que ce soit dû à un nombre important de demandes pour recevoir le code par SMS.
En général, ces personnes parviennent à passer cette étape quelques heures plus tard ou le lendemain. Merci pour votre patience.",2022-10-05 10:29:07,False
f834f834-5c59-45cd-bd36-fa161f8f2e2a,Ambre Aberkane,https://play-lh.googleusercontent.com/a-/ALV-UjWNrA0zBHVrOGSz-Vdv_Gj_h3xfoaiiVZ6EoyHIML1mrVwh4ZYw,"ReBonjour, après plusieurs tentatives espacées de quelques heures la vérification ne fonctionne toujours pas, voici le message d'erreur: Unable to process request due to missing initial state. This may happen if browser sessionStorage is inaccessible or accidentally cleared. Que dois je faire ?",1,0,3.19.0,2022-08-19 13:20:48,"Bonjour Ambre, désolé pour la gêne occasionnée 😬 Nous avons quelques utilisateurs qui rencontrent ce problème lorsque trop d'essais de connexion sont faits en un court laps de temps. Ils arrivent à se débloquer en réessayant quelques heures plus tard. Merci pour votre patience.",2022-08-19 10:33:49,False
15d9f948-def5-4b16-914f-7e5676ce723a,Elijah Gerhard,https://play-lh.googleusercontent.com/a-/ALV-UjXURqjz3dIQSXpU-SPr6mcK5qSTLep2RWMMmbbRp3XYUYygutSf,"so far, luv this app!!",5,0,3.18.0,2022-07-27 17:48:11,,,False
22d0185c-6b40-4716-975f-d14433671381,Adrienne James,https://play-lh.googleusercontent.com/a/ACg8ocJHyPBpp6mbVBXqrXXK8KTb6m9lmCmKKBfUZCwmcnoSEayOfA=mo,"It's okay so far... a little hard to set up and use for us non-tech people, but not bad.",3,0,3.18.0,2022-07-18 01:49:05,,,False
c1cc8491-402f-462d-a42b-38add0ee7542,Gray Garling,https://play-lh.googleusercontent.com/a/ACg8ocJTKtqif3xd6dumXrcJ9beaU029klAsmSmN4FK8u_vBGngZ4g=mo,"Needs some sort of age verification, too many minors asking for not creepy people and I'm not looking to catch a charge by accident. Update: still mainly minors. I can't use this app.",1,3,3.17.2,2022-07-11 10:18:42,"Hello Gray, if you see some underage users you can report same - it will help us to improve the experience. We are also moderating this issue to make sure that no minors manage to be on the app.",2022-07-11 10:17:38,False
0590c168-bdcb-40c5-a704-8b61345992fb,Amirouche Haddad,https://play-lh.googleusercontent.com/a-/ALV-UjWCRVW_waSWn9-BYSF7FFHWgXsjc4AwivtbdIjpUMH4ksI6Knui,I can't sign-up it doesn't show my country,1,0,,2022-07-08 01:54:43,"Hey sorry for that
Can you let us know where you are? The reason might be there are no enough profiles around",2022-07-08 07:56:55,False
2146ea56-50d9-49d8-8b3d-1d8029c120df,J Gaming,https://play-lh.googleusercontent.com/a-/ALV-UjXLj5BafyHo6l7zcDVNIZJpis4-ZUZHmmTYQUR_NDQUFeqjjYo,won't let me make an account won't take my phone number,1,0,3.17.2,2022-07-04 02:17:07,"Hello, can you please share your issue at contact@feels-app.com? We'll try to help you! Thx",2022-07-11 10:12:26,False
3f5342af-396b-4829-acd5-1e15392c6b6e,Mateo Ham,https://play-lh.googleusercontent.com/a-/ALV-UjX402O8RPhupl7zKKhD7cEcfZoCplrs3_2Lo2gM52En6UenkKQAVw,"Simply crashes when adding a video from Google photos. Video length adjustment bars at edge of screen so any attempt to move them results in android thinking I'm swiping from the edge of the screen to go back. The animal categories aren't clear and actually more annoying than helpful (I get they're supposed to be be cute, but that's all they are)",1,9,3.17.2,2022-07-02 20:27:02,,,False
9a074fcf-6797-4f2e-91e1-5f1ca43bd76c,Sarah Merabet,https://play-lh.googleusercontent.com/a/ACg8ocJ3v8w4oqPrwMebpVaaQqsT1Txe7MdmbI_B9mj2aVy2LUg63A=mo,The app is quite clunky and very slow. No verification so lots of fake profiles. Not enough people near me. No way to report fake profiles. The design and main idea are cool though.,2,0,,2022-06-26 09:30:40,"Hey Sarah
Indeed the report is not intuitive (long press on profile) - we are changing this soon.
We run very thorough verification of profiles, could you tell us at contact@feels-app.com where you are located ?
Thanks a lot in advance",2022-06-26 10:08:29,True
08667a06-61a9-408d-a7ba-2725631ef8c7,B_Ordonez,https://play-lh.googleusercontent.com/a-/ALV-UjVOv5vsfe7-jlq5tB2gFrkT3Zx6rlRG1tgrfQ-FYavtO2TBq4Cz,"Je ne peux pas mettre de photo sur le profil, il me rejette toute les photos que je veux mettre. Très dommage",1,0,3.13.0,2022-04-30 16:16:45,,,False
ba99106d-2209-49f1-be3b-75d6eec58ecc,ClaraBot,https://play-lh.googleusercontent.com/a/ACg8ocJss_47FXQTZRnyF7CuIOWndw-r7xuHrHnUtto_uEWiBi27iyc8=mo,"it seems like a great concept, but there's a bug that doesn't let me add questions to my profile so unfortunately i can't even get started",3,1,3.9.0,2022-04-28 16:58:42,,,False
61fc50e0-e2db-4368-a88e-9bd1d2f6e296,mousse,https://play-lh.googleusercontent.com/a-/ALV-UjWwLYGSuqaUv1g43p-kWnh8GcGahS80DYHx4oRqV9BA8YX1Rz7Q7A,If I wanna have the app in french do I have to pay ???,1,0,3.9.1,2022-04-11 04:40:33,"Hey Moustave, no - you just need to switch your phone to French direclty in the settings of your phone.",2022-04-11 23:23:04,False
de23fe8c-1f17-4f0c-9e9a-1c1d9e495c6a,Lara Viana,https://play-lh.googleusercontent.com/a-/ALV-UjUDZJmudhoA3XqSUntoibYRlX3gNJpGYQvsO59pAa-WtepfA5ywWg,"love the idea! but sadly it doesn't work for me. i have to upload a video, but no matter how long/short the video won't load. next i have to add a question + answer, which it won't let me save. i had no problem whatsoever uploading photo's tho!",2,2,3.9.1,2022-04-09 02:40:39,"Hello Lara, pourriez vous mettre une photo au lieu de la vidéo? La vidéo n'est pas obligatoire. Désolé pour la gêne occasionnée.",2022-04-11 23:28:16,False
171dfa55-00b0-469f-853c-72a3b946b2a4,Maxime,https://play-lh.googleusercontent.com/a/ACg8ocLX_oGTH6u9xazhf6FJGLkDTK-IJwjB6cj2jQmcj0kQyg7kSoE=mo,Very slow,1,0,,2022-03-16 06:50:09,,,False
