reviewId,userName,userImage,content,score,thumbsUp,appVersion,at,replyContent,repliedAt,scam_related
b2ec02e3-c8b0-444e-acf6-c91182a15a42,Triark,https://play-lh.googleusercontent.com/a-/ALV-UjVldTPlKoVd0JK0FGS7CogO9wO2iloIpE5eFZPbJB5sVa_Nlz1J,My account is blocked by rules that I have exceeded on my profile they give 4 reasons but I change my profile and nothing happens fix u app,1,0,,2024-05-11 11:37:39,,,False
b933a0b4-def2-4ef0-907d-4e69ff858298,Garrett Wright,https://play-lh.googleusercontent.com/a-/ALV-UjVifojHh4yQ4Hj3ksm1Zjj_LQwHirmANkmeeDceO3RFlfdqiKwl,I ran out of people to see in my area in 10 mins... maybe 15 total. I haven't gotten new matchs in weeks and 95% of the people I've matched with have turned out to be prostitutes or scammers. Stay away from this app!!,1,3,4.23.1,2024-05-09 01:34:33,,,True
9e2ac472-bfd6-4b3e-98f6-f25e2034ca1f,Alexandra Reinhart,https://play-lh.googleusercontent.com/a/ACg8ocLKAK2q2mLe5UGdZI2LDtxhO3zHV6nx3gNZ6WC4n4AStW7ZVA=mo,I'm doing good now.,5,0,4.23.1,2024-05-05 21:29:40,,,False
6fe81dac-dee0-44c4-a1fd-6a8cd62b3006,Melanie Tretter,https://play-lh.googleusercontent.com/a-/ALV-UjW-JGlkl9Obn2PHcsG74pJGr22AZHq6O9KxErqp0_fy0tFUXPoA,🤙🏼🤙🏼🤙🏼,5,0,4.23.1,2024-05-03 23:06:27,,,False
69f32469-58b4-4211-9347-e4d7d2f11f1f,Christian Vermeulen,https://play-lh.googleusercontent.com/a-/ALV-UjWlkYboK53n45QSO83lXA_grV1g0TsDdJcqu-ip-EQamka6dB9e,it makes me rate to unlock a feature. shame on you.,1,0,4.23.1,2024-04-29 21:28:47,,,False
067a6f23-e4ff-486a-98c3-c1d73914ae89,Kiro Angelov,https://play-lh.googleusercontent.com/a-/ALV-UjXAmMUc-xmP0CdQNGvnCZQEa44Dy4seIpUMzdVDXfG-GlQlYlh5,"Im a bit confused how to get a real match...in my inbox i have several interested people and we hearted eachother...yet not being able to text them...it just says ""Feels sent!""",3,14,4.23.1,2024-04-24 20:41:19,,,False
d0b05ee4-8e50-4c1f-8bbf-bedc02645170,Nathan Stoltenberg,https://play-lh.googleusercontent.com/a-/ALV-UjVQ78jZruoYbGswLybTAokp_157Rl_tRQRYOjAFPJ89PsKU8V5z,asked me to rate the app to unlock features.,1,1,4.23.1,2024-04-24 00:07:10,,,False
b9c55473-93ee-4793-a95f-0ba242c087b8,Anton Ivanov,https://play-lh.googleusercontent.com/a-/ALV-UjU8N1vWbeUm1IjS4p6wly0r2qN9YnNJHZDnR0zIt7cD-ETM40pD,"Unusable if you aren't willing to pay minimum 14€ for the ""one week premium"". So basically you can swipe left and right all day like an idiot, just to find out that your matches are locked and you CAN'T get in contact with them.",1,4,4.23.1,2024-04-23 21:26:02,,,False
0eb6736a-1802-49ab-bed2-2ad4dc762432,Luke “Elfman” Abercrombie,https://play-lh.googleusercontent.com/a-/ALV-UjVxD4E7cLDcXNZ6Fl6Mb8MHDL5rg3LeEHoONbQdFkp6LMvu0HvX,"Only been on for a short time, but so far so good!",5,10,4.22.0,2024-04-19 21:12:45,,,False
fca7c399-5faf-4691-a9b8-f62314c492b1,Romeñ Ar Bloaz,https://play-lh.googleusercontent.com/a-/ALV-UjXRff6HsM4vB268i-QkU8Hq3jXxT4KVGM52YCnD5DKMvSTk8fw,"Nobody on the app. So after a month trial, there is no point continuing. Some nice ideas, the app looks good at first but the higher image quality makes every loading time extremely long, and there is more pain than pleasure in swimming as you wait for loading... Some videos come with horrible heavy sounds and it is faster to close the app than wait for the loading of the next profile... A few matches at the start (with bots...) and then nothing. Useless app in the end.",2,4,4.22.0,2024-04-18 16:13:11,,,False
3be7b7f1-988c-488d-a696-fadbe1846a32,Mark Hitchcock,https://play-lh.googleusercontent.com/a-/ALV-UjXBPiEgn5E7xg86Nt3RuHVO6EN-9Wu9ZBi4yQB8y2rKGHCjIVY5xQ,There isn't anyone local.,1,0,4.22.0,2024-04-16 20:42:09,,,False
951f37f1-d0b9-43a7-8557-8e735261fd6d,David Tidwell,https://play-lh.googleusercontent.com/a-/ALV-UjUGf3umFbbkkBGa4gGP0c24_ucp4SOZI08EsCFBaEmN4-68htkY,Why do apps like these force you to pay to see who likes you? That's so ridiculous.,1,0,4.21.0,2024-04-07 05:12:41,,,False
f343efd7-d9de-4652-bf45-f02c34d6770a,Francesco Tedesco,https://play-lh.googleusercontent.com/a/ACg8ocIgROI4JWm16yKtNjfoLKqz5LExwyxk2p3rXbcfD_e2BlPiLA=mo,wow,5,0,4.21.0,2024-04-05 11:49:01,,,False
41ec1639-4094-481b-9abe-3fbca32a14b1,Jonathan Mcgregor,https://play-lh.googleusercontent.com/a-/ALV-UjVb6UD5qP3l9C56zR48ZCy8me1hq3grTxhKsasPDcxtZEYToXLt,New to the app but for the most part it seems promising,4,0,4.20.1,2024-04-03 11:28:03,,,False
3ed4278d-bc78-4f63-86db-ba086bd12fd9,rob coates,https://play-lh.googleusercontent.com/a/ACg8ocImiQqueuQNPbX6nv6Ye5I0FaBv2D_B9PIgr4qYO69s7NYsgw=mo,Feels like could turn out to be a very good app.... i have noticed that i allowed notifications but the app still does not notify me on messages or likes. Also i think there should be a search menu added & can see who is online,4,10,4.20.1,2024-04-03 02:31:52,,,False
3dc8cb76-fe0c-4dce-995d-ebf395fa6223,Gerry Vallejo,https://play-lh.googleusercontent.com/a-/ALV-UjWfaTepF8-P_WOQDKKANX6Ama4qNTd8SlLJzjfQIKKUKr0GR5N6,This app won't let me create a new account I try registering with my phone number and it won't let me in fix it now,1,0,,2024-04-02 00:20:49,"Hi there, sorry for the inconvenience, can you write us on contact@feels-app.com so we can investigate the reason why you can't get a verification code? Thank you in advance, Daniel",2024-04-05 21:41:39,False
e3b87ef5-d6cd-4758-b5fd-f5e074cef412,Super Marketing,https://play-lh.googleusercontent.com/a/ACg8ocKQqUFYsQY_fIbyVA0WF_xDJ5_EDvrMpa61dw6mtr5uXnt-KA=mo,التسجيل عن طريق الرقم وليبيا مش في الدول المتاحة للتسجيل,1,0,4.20.1,2024-03-30 02:44:34,,,False
35bf5eac-19d5-46e6-9626-93f1d1bc57aa,Ram,https://play-lh.googleusercontent.com/a-/ALV-UjWMPL-0UwBZaiEdRW1PzPw6lsopRIV97XemhhwCIg_hLLDyaYE,"You are forced to submit all the pictures spots, which isn't bad, but I had to search for A WHILE 😅",4,0,4.20.1,2024-03-28 20:42:53,,,False
9e934553-227b-4b4a-b7f5-8d2aa70e1bcf,DIAZO DRAGON,https://play-lh.googleusercontent.com/a-/ALV-UjXfeshcNlHHnNeraOerUDZ1vqjgwDGDP1rqbldf5B8DDuNtPe_v,Only 1 person in my area but he didn't meet my criteria I don't like beardy scraggly guys,2,0,4.20.1,2024-03-26 16:43:50,,,False
24cfdcd1-eb5f-4caf-9e4e-ca0119e62542,LORD _stark,https://play-lh.googleusercontent.com/a-/ALV-UjX0N5LGYKGiowLq_XF21M40sha4s5zGPuZApIQAqdE0re7TvRKs,I live in Algeria i can't Sign in due to unavailability in my region,1,0,,2024-03-24 00:08:24,,,False
75c0157a-f0b9-41da-a28e-8a89ff657660,Charlie Jenkins,https://play-lh.googleusercontent.com/a-/ALV-UjXDYz9z0F-94TrnN0J027WhQykzrWyDw83RLxW9z6SxoH9bxKSo,Its ight,3,0,4.20.1,2024-03-23 06:53:29,,,False
0e5bb49e-c4d1-4817-8c86-62f95e388455,Jan Huesmann,https://play-lh.googleusercontent.com/a/ACg8ocJDugr1E0Az2GM4UdYQ2Bhe4Brczr2alMGJ7tEsf93OvIAd6yY=mo,keine Ahnung,3,0,4.20.1,2024-03-20 23:30:40,,,False
90917927-7d35-4893-9524-9410eb48e2b2,miguelchaan,https://play-lh.googleusercontent.com/a-/ALV-UjX1os0IeN7jLOMhbW7OIL4aTp2ApeuYWWT5oGMhxb_ULw396a4,"it isn't bad or full with bots, kind of asks you for a lot but thats all",4,0,4.19.0,2024-03-17 00:48:24,,,False
41f25f4b-a8b9-45ab-bdd7-3f99f0b7a939,Katherine Micheal,https://play-lh.googleusercontent.com/a-/ALV-UjXsFlYqqzkytBsH5GLXuIsEm94x_vWI7G1SjZKtaUfTGCD786M7,not bad,3,0,4.18.0,2024-03-08 00:27:52,,,False
dafce4f2-7bcd-4991-8659-71261094bd24,Robert Elmes,https://play-lh.googleusercontent.com/a-/ALV-UjV2w7WUyMcLUVytXpv8se8fd1wKdMXREqiWs93OHPPC3yICWLGa,Not free,1,0,4.18.0,2024-03-07 14:41:31,,,False
02828293-f595-4903-8f0d-aa8ea6ea2b9f,Christian M,https://play-lh.googleusercontent.com/a-/ALV-UjWI3OY80HPrzPlxQPrpw5tyghe9nHS_QUCcjASK5FD3T_EpTVc,"This app lies and tells you profiles have liked you. But when you try to see who, it won't show you unless you pay. But again...these profiles aren't real. They do this to get money out of you so you can pay to see the bots (not people) that liked you. That's low.",1,6,4.18.0,2024-03-06 01:05:31,,,True
a1ad8a25-3e61-4731-8f2f-43e4abc84122,Madison Franks,https://play-lh.googleusercontent.com/a-/ALV-UjXXAfY3xPZxYi1UtKdhYuWuCtAD6aUJdUs1Vsm9ubfVty4WUsdIyQ,"Signing up is time consuming basic ""dating friend"" app",3,0,4.18.0,2024-03-03 08:02:17,,,False
5c5670fc-f7b9-4785-a2dc-f315d45b6989,JonR,https://play-lh.googleusercontent.com/a/ACg8ocIHwesGWAku6FrdCsOKQn9vRA80qGV49xrVdBErlRkzjKFhAg=mo,"Dead in the UK. Might be 50 profiles I'm guessing. And that's tested on an age range from minimum to maximum, searching for my age range, there were 10 profiles, then I was being shown profiles abroad. No point, moving on.",1,4,4.17.0,2024-02-26 01:11:46,,,False
12c98344-59fc-4def-967f-4351367630aa,Dominic Williams,https://play-lh.googleusercontent.com/a-/ALV-UjW9MnKgKy35uR_Js4htosWyPxPdwi-J8MLXcsJvYhpQePVv_Dw,Horrible I expect more first of all dont block me for not adding pictures some people aren't comfortable with adding a selfie online also you shouldnt force us to add so many pictures.,1,1,4.17.0,2024-02-25 07:05:28,,,False
65d83690-17a1-4924-8923-7f9050cbfaa1,Xenos One,https://play-lh.googleusercontent.com/a/ACg8ocKqNO9OfW6aW5UjIawDA96wvpM0P6jtxJa83hrrINSWhLYMaA=mo,"Terrible app. Good news is, the devs haven't stoopped to chat bots. Bad news, unless you want to meet guys, there's no women on the app. Also, it's unresponsive as hell. Just like app women.",1,0,,2024-02-23 14:23:20,,,False
439bbc2a-a9e0-481f-b8b6-daefd9a5179a,Serkan Arsuzoglu,https://play-lh.googleusercontent.com/a-/ALV-UjU3VHfUH_oFtALHH69oG4t2bhxFaw60iCGhNbW1zmtYp7Bf73Sy,App ask to upload more than 1 photo. If you do not upload them it won't create your profile and don't progress the registration. I have uninstalled the App.,1,2,4.17.0,2024-02-19 09:47:26,,,False
35b3f7a2-d737-47d1-a255-6c4b3bb27367,Monky Man,https://play-lh.googleusercontent.com/a-/ALV-UjXd1iRwapgjz_nGvMvoeEJT-nH5aIVRR4bygu2QyExecCZBIU0x,"This app gives you fake likes or withholds matches. I got 30+ likes in the last week. I haven't matched with a single person. I doubt that the blurred profiles are real. Or if they are, they deliberately remove them from your view in order to coax payments for their ""premium"" plan. Underhanded af",1,8,4.16.1,2024-02-13 23:44:22,,,False
53c42117-893e-40d9-b980-2c9ea6e06c99,Christian Bayas,https://play-lh.googleusercontent.com/a-/ALV-UjXrgKeNicF248i9cLN18SEDbJNdynQvevpw9tgQJeUpKUB5HMWu4w,"Good concept but it's a real downturn that you match with someone and can't chat unless you buy ""feels infinity"" or have sent a ""super message"" or ,as it's called in the app, ""superfeel"" before. Oh and you only get 1 of those free... can't even access their profile or see who you matched with...",3,19,4.16.1,2024-02-08 13:18:37,,,False
7c5f93c7-01c0-4050-85d1-24fdf8817322,Mauricio Xhaferaj,https://play-lh.googleusercontent.com/a-/ALV-UjXY1xh-ZFb8OBUtsfXnhi80X7fWUmB9PKHxNfYOjNV2evaXRYV3,"I don't recommend this app , it's useless",1,0,4.16.0,2024-01-31 12:14:00,,,False
7d6adf8b-2f5f-49e5-8335-dc9d85b07546,April Draugh,https://play-lh.googleusercontent.com/a/ACg8ocLCTd0vd79E583TlvfHuKegDUXMIKXijkFuLYC6D6fBs1J_Ew=mo,very nice app👍🔥🥳🤪✍️🥰❤️‍🔥💯🤝🤞🇱🇷🇱🇷✔️🥳,5,0,4.16.0,2024-01-25 22:09:50,,,False
e124eb40-dba6-4938-b666-eb1ba429e9b0,Abraham Chinye,https://play-lh.googleusercontent.com/a-/ALV-UjU5b8_9HrEXgio2Lk49vOD1tL4yykvjLaeWcs3gGR73N8f-66ua,Decent concept but the app is so buggy. Crashes every 5 seconds. I'm not even exaggerating,1,0,4.16.0,2024-01-25 09:51:57,,,False
29aec916-c77a-4625-a8ef-9e96dd4a2b14,Toto Drum,https://play-lh.googleusercontent.com/a-/ALV-UjWWBhi7WtEIHiLvPMb9buFA6FSt7eSEyEFoxT55_N5_LS7YSUbt,slow and disorganized,1,0,4.16.0,2024-01-24 01:49:31,,,False
80969a8f-82f0-424e-9c14-0acb75db2b96,Luis Ramirez,https://play-lh.googleusercontent.com/a/ACg8ocJ8ol6YaqN_gpPA6mVt2LgZq3oF87VgNE6Kilivi68hGjYKnA=mo,still working on it. pay wall doesn't limit the freemium,4,0,4.15.0,2024-01-16 07:38:10,,,False
c4af95cc-fe66-4006-8848-ef7f02bac58a,German Ortiz,https://play-lh.googleusercontent.com/a/ACg8ocLR7GfvyFpq18WoIa8FByCuPGsWOBiO2ReCm1MRXIiWXXkdBg=mo,The app is promising to be really cool but it keeps asking for new videos on the spot. And it's showing me pictures of tall men or Asian teenage girls. Bad app,4,0,,2024-01-15 13:36:51,,,False
0ae5e82e-50fc-44ee-aaeb-8e0eb2e8c1e7,Rudy,https://play-lh.googleusercontent.com/a-/ALV-UjWas7s-x_4FkIk-Y-KU3KvJMHczXnyJbHFvGNyM3P6gX94oDky4gw,eh it's ok,3,0,4.15.0,2024-01-09 15:33:39,,,False
4263ba17-6943-4a86-a34e-4503b73c8ba6,Okan,https://play-lh.googleusercontent.com/a-/ALV-UjXF1WwNAcDqhO7tLS3o7zcdfJf4Zno76IRJfFOXfHbr-L-88CnW,"I really cant do anything without paying. Not even writing a Message works, if the Person I liked, likes me back.",1,0,4.15.0,2024-01-08 13:05:34,,,False
e4cc99d3-38e2-4e14-ae0f-b2ece43c4342,Onur B,https://play-lh.googleusercontent.com/a/ACg8ocI2Bull9NY_jG5dDFPu6YXIHwFJY90CmicfYJCtWGrpYAOVT-w=mo,"almost 2 of 5 stars. good app but couldn't see even one match, but I have several likes",3,0,4.15.0,2024-01-02 22:58:05,,,False
feccb0af-716a-4a7a-beb3-f299b71dc852,Entei Flame 2,https://play-lh.googleusercontent.com/a-/ALV-UjVIj-OYf_CchQR2VQ_jJk9QWjI26ShzPtFFfmihFfIznIxX6ahw,It would not let me put in the code that was sent to my phone number,1,0,,2023-12-31 19:58:38,,,False
b2b6064c-337a-4751-94b3-0fa0b9754f31,Harieth Mmanga,https://play-lh.googleusercontent.com/a-/ALV-UjU0fQ21gdLFwsDg1vZNhN9d91W8mEE8qJw_5kNXGIuIXNU0Nhl7,why does it glitch this much weirdly slow.,2,0,4.15.0,2023-12-26 21:09:37,,,False
703f7d70-07ee-4651-83f8-414e36ebc282,Matt Eckhardt,https://play-lh.googleusercontent.com/a/ACg8ocJb7SppXlmWeaqJgLS_k0wfWUEJYySvSBzWrNOUIY_P3MgMAw=mo,no options to add religious values or other deal breakers for you,3,0,4.14.0,2023-12-15 07:54:26,,,False
7eed55fe-820b-4054-9413-d65ce71f0e5b,_,https://play-lh.googleusercontent.com/a-/ALV-UjXsll_HytWM3r5TuJ0DyZ9FVXUu7Lg0Npz3dmlDR5D41aCsNqJk,how can an app be that slow seriously,1,1,4.14.0,2023-12-10 18:45:18,,,False
085ca50d-4388-4e17-a602-24a4778ba643,Cai Engelbrecht-Bogdanov,https://play-lh.googleusercontent.com/a/ACg8ocIvPTT-6X4bGCRZvyjNUpfZtWeKVufDNm4E5q8xyLo7JDyy=mo,I've liked someone back who liked me and it didn't match with them?,2,0,4.14.0,2023-12-04 22:49:09,,,False
16e97756-6d0c-48d7-90df-6f336cd3eaff,Kristaps,https://play-lh.googleusercontent.com/a-/ALV-UjWdsRUcwzQ3oUkyprzETQCWY3nEbjp62M-bDW6KmujrT1lb27U,"I got 30 likes in a few days, so I just like every girl I see on my discovery to get those matches, but it just doesn't work. I have liked more than 50, and apparently, none of them are those who liked me. Also, it is very laggy and slow.",1,7,4.13.3,2023-11-25 10:06:07,,,False
e84e7b87-616a-40e8-b9c5-8a9205573342,Abduljamil Ghani,https://play-lh.googleusercontent.com/a/ACg8ocJvgjWefsZLWz_14Ux81CTqlVLpjILoDIqFvCjqY_M3cw9X4w=mo,صفت الله,5,0,,2023-11-22 07:30:22,,,False
80ee82dc-7007-427e-a2a3-38f66286c0f4,Pascal Cambel,https://play-lh.googleusercontent.com/a/ACg8ocLlb-pZ1J7lEx4guFTSfrHycN_CyRyBelXNRWs4nXcZ5f3LVw=mo,Where can I find details about the developer of this app?,1,0,4.13.2,2023-11-22 07:24:49,,,False
80a98285-10cc-4f6d-8343-998003ce288b,Kwon -,https://play-lh.googleusercontent.com/a-/ALV-UjWr4SaW51FH_WG7k2gvU0VjJd50sHOcBYA1uK3Jma2JhxKFpnB9,Super slow and money hungry. The prices are super high as well. Didn't know I had to pay to have social interaction,3,1,4.13.0,2023-11-15 21:39:42,,,True
830f10f2-8fe0-483e-83a9-466c48537698,Brian Coff,https://play-lh.googleusercontent.com/a-/ALV-UjVTF__D4wXNShJ1l0vepjlSOSnJOrV4kZLiIVKStJ9jMMVaQOFC,slow slow slow,2,1,4.13.0,2023-11-12 11:28:23,,,False
cc63e9d7-ea22-48ed-b678-5254c6a2a4af,CandyCornLord86,https://play-lh.googleusercontent.com/a-/ALV-UjU1xUMKUw3VHdrL62bH8FVjYS4j4uMzJSsawXrGFCudTZz8nWkV,damn I gotta pay for everything? nahh,2,1,4.12.6,2023-11-06 02:16:12,,,False
c0d91a9e-2c4a-4869-96f7-4dcb49064b09,Mario R,https://play-lh.googleusercontent.com/a-/ALV-UjW0T5jvxbGZ05IkkVB5Chx_AJZfusauqHyUcrVSDW6-JR5ahcyY,Good idea but the app got way too many bugs. Feels like a beta version but def not ready for release. Not sure whether any ux tests were done but you really need to improve. It's a pain navigating through the profiles!,2,7,4.12.6,2023-11-04 23:25:38,,,False
8b203815-f86d-4d59-b602-ea02700cc956,Jim Erickson,https://play-lh.googleusercontent.com/a-/ALV-UjV4OhVg0YejKyuTWaLJ2lOabajQndcGFrabq8zBjlqv_4ukQdUwIA,"Cool concept, doesn't show you people in the radius you select (set to WORLD by default) , lots of fake profiles",2,1,4.12.6,2023-11-01 10:15:56,,,True
c76fdad6-3878-49de-9f07-35a7f6a28d37,Ilan Dayet,https://play-lh.googleusercontent.com/a-/ALV-UjVr2kZFzYaWENcRbLD9wn9cOnwegKnIWnJ-9hUajvyx34nmoEIB,J'ai beaucoup de like mais jamais de match. Cette application veut notre argent sérieux.,2,0,4.12.6,2023-11-01 08:37:41,,,False
3c8780ee-b5c7-4e53-aad6-82cad2ded044,malo RACT MADOUX,https://play-lh.googleusercontent.com/a/ACg8ocL6IJ8aKDIL26iCj38w7eTpWG1QNXrg1CISWUKKwiZARtKI7g=mo,look nice,5,0,4.12.6,2023-10-24 16:47:08,,,False
8ea2aa01-535b-41fe-a225-55a06a3fb714,Kelvin Olivo,https://play-lh.googleusercontent.com/a-/ALV-UjWDTiwCPs-6Tmtm0W3-AmeJDQYr2N1J_DtUZjVbcWe1KsfxnU5C,been using the app for less than an hour and it's crashed 4 times,2,0,4.12.6,2023-10-21 10:34:25,,,False
254f92f9-0f18-46ee-a820-55611f1dce1f,Leslie Lomack,https://play-lh.googleusercontent.com/a-/ALV-UjVtP6ean685oy91ZNAwrZhydxsVSgctfBOZdhozyc80fHsOujPuxQ,Fun app.,5,0,,2023-10-02 10:52:42,,,False
963e51c2-f2b1-41ef-8648-9b84e39dbb9f,Marcus,https://play-lh.googleusercontent.com/a-/ALV-UjVIlviecz1OmXN6XCp4fOcxBGgbYclm4rWtdH-sctBDKmloZpV5zg,Two people? I create an account and only see two profiles for the whole of Phoenix AZ? Really? Well... time to uninstall.,1,1,4.12.3,2023-09-21 12:41:29,"Hello Marcus, sorry to hear you didn't have many profiles in your area. We're continuously expanding, and the availability of profiles may vary by location. We appreciate your feedback and hope you might give Feels another try in the future as we grow. Thanks for giving us a shot!

The Feels Team. 🧡",2023-09-25 15:16:10,False
fa458a86-7e00-4fc9-852a-042d8500a9e7,Jessica Worden (jessisceltic),https://play-lh.googleusercontent.com/a-/ALV-UjWVX4OaekpMp8P4wJQ1v6VYwBcCsEXyOIhNdFz1XMduKjySt9OD,My profile was immediately restricted because I accidentally uploaded the same selfie twice even though I immediately switched it to a different pic when I realized I had already used that one. Was unaware of the problem until the very end after I finished filling everything out 😑 uninstalled,1,0,,2023-09-11 14:25:52,"Hi there,

We're sorry to hear about your experience. Profile restrictions can happen due to our policies, but we appreciate your feedback. If you decide to give it another try, please feel free to reach out to us if you have any questions or encounter any issues. We're here to assist! 😊

Best regards,
The Feels Team.💜",2023-09-16 03:43:45,False
bcca9f0d-f5e0-4fbc-95b4-d85799f3b8c3,Bjarne,https://play-lh.googleusercontent.com/a-/ALV-UjUeW2oHOMqOCegWZMPI9FJyJDr3KHU-dO9hkEgXJzEiJDkQfVE3,"Useless even with premium, getting notifications each day of people wanting to chat or liking my profile, then when opening the app no new messages or feels have been given.",1,2,4.12.1,2023-09-10 14:40:35,"Hey Bjarne, thanks for the feedback ! We're sorry you did not appreciate the Feels experience, we hope you will try soon. Take care, the feels team. 💚",2023-09-16 03:47:50,False
d710728a-f340-46b9-9177-087d57f905c7,El Isa Beth,https://play-lh.googleusercontent.com/a-/ALV-UjUMTI84qezJOb4o9JKPGg4sUJ5uQI8rD5eMdD8bz0IX9F5AOwo,decent so far but a little buggy. needs more profiles,4,0,4.12.1,2023-09-06 18:28:31,,,False
4ee67dd6-9c62-41bf-acc5-f7f68f2fe8ee,Remey Osu,https://play-lh.googleusercontent.com/a-/ALV-UjV0-AC310Jg1vBthknw9LVC6AhmGNK8DnoR0QDfOuiULjVAKvm8,"Does not even send the code when it asks for the phone number, i tried like 5 times",1,0,4.11.0,2023-08-26 17:18:09,"Hello Remey, sorry for the trouble with the verification code, it can happen sometime, email us at contact@feels-app.com for help. Thanks for your patience. Feels Team. ^_^",2023-09-19 19:17:27,False
28fa5ac8-bb0c-4f0d-ba7d-9bd272fcfa09,Mathew Brown,https://play-lh.googleusercontent.com/a/ACg8ocK9zchEYoJVk56fNj6_ZznLUuzsHRvpdrKPfhXW4KtDBLEFZQ=mo,"No URGENT help from socials account. Received tons of Two Factor authentication texts from this app, when I didn't even sign up with you!!! 2FA texts every few minutes, stopped, when the 2FA code was a guessable repeated digit number (with several retries, would get someone in) I believe BOTS/scammers are trying to brute force their way in, with innocent victims mobile numbers (possibly dark web list) I want to lock down any account using my info. This is a Subject Access Request",1,0,4.11.0,2023-08-25 13:09:28,"Hi Mathew
We are indeed victim of a very large scammers attack using random (?) phone numbers to generate sms and charge us back. We are sorry for the inconvenience and we are doing our best to solve it asap.
Sorry again. The Feels team",2023-08-25 20:12:51,True
bda7d834-908d-4c38-aeaf-b24e51de3091,SOL Armor,https://play-lh.googleusercontent.com/a-/ALV-UjXigOFu-OaHuf321e8hKYVfD01gCQ1td1BjoTAGsU8etdg992Q,"they make you do this just to see someone's ""vibe""",1,0,4.11.0,2023-08-25 03:45:36,"Hey, thanks for your message. please tell us what you think of the app. At your disposal to make it always better. The Feels team",2023-08-25 20:13:50,False
10965dc1-d6b4-4431-86cb-1e0774cb0045,Angel Sanchez,https://play-lh.googleusercontent.com/a-/ALV-UjVLNpCQoKmT7jN_S92dEEC5rI8BNrkHrp7tis6MIDGdw4IFiNw,"Definitely not enough people to warrant use when you live in an island state/country Not enough people in my selected age range (20-26, as I'm 23) use the app to make it worthwhile. I also keep getting notification to ""like this profile"", just to open the app and still be told that I've seen everybody.",2,2,4.11.0,2023-08-22 07:52:37,"Hello Angel, we're sorry you did not find what you wanted, we are still launching the app on your country, so that's why, the app is lacking a bit of new profiles. We hope the problem will be fixed in 2 or 3 weeks. I advise you to try another time, take care, the Feels team. 🧡",2023-09-16 04:25:44,False
2b341945-79bd-4b1e-bf76-0f4a2f52ffee,José teixeira,https://play-lh.googleusercontent.com/a-/ALV-UjVIWTyGLaQ46f6IZCsn-R-ELKABCSzXLqWIztkR4hx7WgZQYzxc,bugs,3,0,4.11.0,2023-08-21 00:13:01,"Holà José ! Désolé pour les problèmes que tu rencontres. Notre équipe travaille sur les bugs. N'oublie pas de mettre à jour l'app régulièrement pour les derniers correctifs. On espère que tu nous donneras une autre chance.

Cordialement,
L'équipe Feels. 💛",2023-09-16 04:19:48,False
01039d09-3f41-43d4-bc39-c42041d1cedc,Rami Abu Shakra,https://play-lh.googleusercontent.com/a-/ALV-UjW5kLI5Y6kWl4xUMvC19K6_Xhg6VADUzaWybNCOvOm5-srAaEA,"The app is really cool but it's got a lot of problems. I like how the profiles are set up and the prompts and the design style, it's all really nice and ambitious but it just isn't built well I think. Idk what it is it's just veeeeeerrrry buggy, scrolling through profiles is jittery, sometimes I'll rewind and see the old profile before the app corrects me, I see the same profile many times. One thing I hate is every time I login they increase my distance filters. I don't want that lol",3,8,4.10.0,2023-08-15 21:08:49,"Hello Rami, thanks for the review ! Don't forget to download the update as soon as available. For the distance problem, I contacted the devs, they will check the problem. Take care, the Feels team. 💛",2023-08-16 12:10:40,False
349ed141-7303-43b4-a29f-95b28f560af1,Mederick Maurice,https://play-lh.googleusercontent.com/a-/ALV-UjW4Dc5QjjRK59DHOsNwQ85SDe2LGLWnxfSkFi3ikYSL-mZQTac,Très lent et en plus on peut pas like comme on le désire. Bah du coup pourquoi cette appli comparer a d'autre comme tinder ? Ou bumble ?,1,0,4.10.0,2023-08-10 09:33:54,"Hello Mederick, n'oublie pas de mettre l'app à jour dès que possible, ça te permettra de profiter d'une meilleure expérience. Feels est l'application de dating la plus utilisée chez les 18-25 ans, ce qui te permet de rencontrer un public adapté à ton âge, là où d'autres applications ont des fourchettes plus larges. L'équipe Feels. 💛",2023-08-10 15:41:52,False
1e62f02d-72a8-43db-bc63-dcca5050b1ce,Trix,https://play-lh.googleusercontent.com/a-/ALV-UjXo2TMI2X2ZI2JQZpXKkDWknh2U7OPi2wvZRLRuiLgu9kNsJoVJgA,it's ok,3,12,4.9.0,2023-07-28 17:34:00,,,False
08279817-1fdc-4563-b319-7cd93277be93,Evan Koehler,https://play-lh.googleusercontent.com/a-/ALV-UjWq-fENShtDK64N67CCtGfLhoNxlLiWYSKw_JxC4xQ4asZJDB0z,"The app is slow. It lets you enough time to regret when you like a profile for example, and it's really annoying. Another thing I don't like is the sound : no way to mute the app. So what if I listen to my music while using this app ? Anyway, I like the fact you can see other people's city, it makes it more friendly. Since the last update, the UX changed, and I cannot understand it. Is there an auto-like or something ? How do we pass a profile if it's automatically liked ?",2,13,4.8.4,2023-07-01 01:16:36,"Thank you for your kind feedback, Evan. We are aware of this problem and are currently working on solving it. Please update your app to the latest version when you see an option. Best regards, the Feels Team ^_^",2023-07-03 14:11:27,False
a44669ab-9567-434a-95d2-61736bb15db3,Said Tigziria,https://play-lh.googleusercontent.com/a/ACg8ocL0ewGYUpS-EPqXUdEQNdqwAV_uJLn7IGcz1m5V1fiKe7UymQ=mo,bad user experience,3,0,4.8.1,2023-06-22 11:42:18,"Hello Said, we are sorry you did not enjoy Feels, could you give us a slightly longer report on contact@feels-app.com ? It will help us to improve the app in the future, thank you so much, the Feels team. 🙂",2023-06-22 15:54:04,False
