reviewId,userName,userImage,content,score,thumbsUp,appVersion,at,replyContent,repliedAt,scam_related
5a667d5c-16a3-4f42-90c6-1ddb52302a1c,Ahmad,https://play-lh.googleusercontent.com/a-/ALV-UjVt86LbXGkEd7ThDe0DnXJ40AxrG_nS4dVoWG7BUqLgpl0BS84,Nice,5,0,1.4.032,2024-07-30 19:31:24,"hello. Thank you for downloading the Global Honey app. Honey app supports global meetings. Actively express your feelings by sending likes to people you like. We are continuously updating it, so please stop by often. have a good day :)",2024-07-31 03:36:17,False
b09eee4f-3f03-4a59-8010-c3043c159bdc,Jacob Lee,https://play-lh.googleusercontent.com/a-/ALV-UjWhn2qRFfRZJutZiZqY8sWmsfElB2HdJK7qY5UUG4dVDFf1viXS,To many scams believe me guys and girls I've been through similar poop don't fall for it!!! PS trying to stay PG,1,0,,2024-07-28 22:20:44,"hello. This is the Global Honey App Team. Honey is a global app and if you use it consistently, you will know that there is not a single 1% fraud and that it is not a scam app. If you have any inconveniences, please leave a 1:1 inquiry and we will help you quickly. thank you :)",2024-07-29 04:31:55,True
4a4b25a1-c717-4d8e-a7cd-2ab65a514280,Gaming Casino β,https://play-lh.googleusercontent.com/a-/ALV-UjW82gMx6EJvLMlU1VZQUb0g2Mv-r6mhFZ8yKg4hJppToWtiKMQ,I have been using this application for long but there are no reall people available,3,0,1.4.032,2024-07-28 13:52:10,"hello. This is the Global Honey App Team. Honey is a global app and if you use it consistently, you will know that there is not a single 1% fraud and that it is not a scam app. If you have any inconveniences, please leave a 1:1 inquiry and we will help you quickly. thank you :)",2024-07-29 04:32:12,False
5dcf6382-1367-405f-b4a0-0bee6ea20707,Anthony Millet,https://play-lh.googleusercontent.com/a/ACg8ocJFeBl-uFIvvDvm8Tf8iaSzddpjmtWTAzmlpXD0n2G6fS4vaw=mo,It's Basically a scam,1,0,,2024-07-27 10:51:55,"
hello. This is the Global Honey App Team.
Honey is a global app and if you use it consistently, you will know that there is not a single 1% fraud and that it is not a scam app.
If you have any inconveniences, please leave a 1:1 inquiry and we will help you quickly. thank you :)",2024-07-28 10:52:05,True
2ac0be11-5897-4346-8e63-4d90da8992f0,yee,https://play-lh.googleusercontent.com/a/ACg8ocLgZXuCr6eHaIlB-IzW3BfwIyEXqwWDXblZ-yieyQWqg6Dypw=mo,Scam,1,0,1.4.028,2024-07-24 20:07:35,"hello. ♥ First of all, we apologize for any inconvenience caused by being an unhealthy member. We take action based on administrator monitoring or member reports, such as false profiles/unhealthy use/sending advertising messages. If you submit it by clicking the [Report] button, we will check and take sanctions.",2024-07-25 06:10:47,True
6d4e8ee8-1845-4747-ac35-768995ef2453,Barry Mcginger,https://play-lh.googleusercontent.com/a/ACg8ocKU_304bEYYXW5RLGIumOXw58OQz7VnS6VDGztQwtN0fobB5w=mo,Great App,5,0,1.4.031,2024-07-24 14:47:41,"hello. Thank you for downloading the Global Honey app. Honey app supports global meetings. Actively express your feelings by sending likes to people you like. We are continuously updating it, so please stop by often. have a good day :)",2024-07-25 06:10:06,False
e5adb2c7-69a6-4792-9cce-506c54abbf42,Rejoice John,https://play-lh.googleusercontent.com/a/ACg8ocJf10PJ9d4DP8MPDfHmOWDlEpBrfEHMYlEwu72eIxZVjQyeNw=mo,I love this app so much even though not much people are like u though is will,5,2,1.4.031,2024-07-24 13:36:22,"hello. Thank you for downloading the Global Honey app. Honey app supports global meetings. Actively express your feelings by sending likes to people you like. We are continuously updating it, so please stop by often. have a good day :)",2024-07-25 06:10:00,False
970b1cd4-2f06-429f-bbfa-d1267eaa0e2d,Ariel Rebels,https://play-lh.googleusercontent.com/a/ACg8ocLL59PSnxrXHJ6dyx26a6dHX_zfFiSGkuH0gZtYVnEt-mqN=mo,I really love it,5,0,1.4.028,2024-07-24 11:08:10,"hello. Thank you for downloading the Global Honey app. Honey app supports global meetings. Actively express your feelings by sending likes to people you like. We are continuously updating it, so please stop by often. have a good day :)",2024-07-25 06:09:41,False
f9b2bc36-7d65-4904-a5dd-6b03c92bdc99,ADEDOYIN ADENIJI,https://play-lh.googleusercontent.com/a/ACg8ocKOB8xNbOzpEuHpyvekRXya8GdOK8BQnXJSv7eARz32F0ww0A=mo,"I was asked to update the app some days back,after the update,I couldn't access the app again telling me somebody already used my username,that I should open a new account with a new name and start afresh......it is so annoying.",1,8,1.4.028,2024-07-20 04:50:12,hello. You have inquired about logging into the Global Honey app. Please send your email to Honey Customer Center (help@honeymatchs.com) and we will check and respond.,2024-07-22 02:59:26,False
a262bd9c-094d-4161-b288-1c043eca86f3,Kolapo Abdullahi,https://play-lh.googleusercontent.com/a/ACg8ocLfKvulVJsmU5jfHBwJtuhbS-rg0XU2eghjfOQ8eOCQ-Hu97A=mo,Very good 👍,5,0,1.4.026,2024-07-19 02:02:06,"hello. Thank you for downloading the Global Honey app. Honey app supports global meetings. Actively express your feelings by sending likes to people you like. We are continuously updating it, so please stop by often. have a good day :)",2024-07-19 04:17:37,False
20a97c8a-26e2-463d-ac2f-96c2a5055897,Ahmed Abu Dhabi,https://play-lh.googleusercontent.com/a-/ALV-UjX6aS40S1-UER5hcCTLbX314XQw-7OdQVa2UxHvlMGaDjwcH2O9bQ,Great,5,1,1.4.026,2024-07-18 21:07:42,"hello. Thank you for downloading the Global Honey app. Honey app supports global meetings. Actively express your feelings by sending likes to people you like. We are continuously updating it, so please stop by often. have a good day :)",2024-07-19 02:00:12,False
b2dcc753-738e-40f6-b1ce-9e6a9660eedb,Qasam Khan,https://play-lh.googleusercontent.com/a-/ALV-UjUlkzKJRr_yXgjS_iAOVFp7HzSBC4RNdqLUpucokx_uIXBSVZgB,Love seeing 💝,5,0,1.4.026,2024-07-17 15:04:07,"hello. Thank you for downloading the Global Honey app. Honey app supports global meetings. Actively express your feelings by sending likes to people you like. We are continuously updating it, so please stop by often. have a good day :)",2024-07-17 02:20:57,False
e93db7d6-f062-4249-a8fd-0b56f2e48a69,Ariann Smith,https://play-lh.googleusercontent.com/a-/ALV-UjU_1r8ArcPuvJGZaOCGvijx_CMnFkAuT0zmomYyjcJZDrePTeKW,So I just turned 18 a bit ago and it won't let me make an account :/,1,0,1.4.024,2024-07-14 13:01:00,"hello. Thank you for downloading the Global Honey app. You left an inquiry because you were unable to sign up. The Global Honey app may have different subscription guidelines for each country, so if you would like more detailed information, please contact Honey Customer Center (help@honeymatchs.com).
have a good day :)",2024-07-15 10:30:18,False
3faa9c0e-843d-4cd1-98cb-ce0a92f2a31d,Omolara Akomolafe,https://play-lh.googleusercontent.com/a/ACg8ocLaevLv-HmssWTAiCjWGS0GqZ7JSd31RRh0Gsx5Agn8az8t=mo,I love app,5,0,,2024-07-13 09:33:48,"hello. Thank you for downloading the Global Honey app. The Honey app supports global encounters. Please actively express your feelings by sending likes to the person you like. We are continuously updating, so please stop by often. have a good day :)",2024-07-15 10:11:49,False
91de55ce-8c9d-4a23-a361-39b5d1725a4f,Mehedi Hasan,https://play-lh.googleusercontent.com/a/ACg8ocKRBxrn8S6lhwsqv_6ZZ6ez43T9oSFdMlf8S04Irfi3SrWbhw=mo,I am from Bangladesh and I cannot login and verify this apps because you're authentication system. please solve this problem.,1,1,1.4.024,2024-07-12 19:13:19,"Hello. ♥ You inquired about logging in. If you sign up with a mobile phone number, you can use the registered mobile phone number by receiving an authentication number and then log in. If you sign up through social membership (Google, Facebook, Apple), we do not know your ID and password, so you can use it. Please contact us and log in to use it.",2024-07-15 06:53:58,False
51139264-2732-471c-b6f8-016ac139efc1,Arnulfo,https://play-lh.googleusercontent.com/a/ACg8ocJMMpMQjAEaW4COyyY2m0vReU1oXXwrGJ3cgJJaUY0MMutRVFM=mo,Can't delete my account,1,0,1.4.024,2024-07-11 20:15:56,"Hallo.♥ You asked about deleting your account. You can delete your account by selecting My Page at the bottom right of the first screen > Settings at the top right > Unsubscribing > selecting a reason.If you are unable to withdraw, you can withdraw on your behalf by leaving your intention to withdraw through a 1:1 inquiry within the app. thank you!",2024-07-12 01:55:22,False
87786571-855f-4b90-b057-3ed4c1465a59,arcuser123,https://play-lh.googleusercontent.com/a/ACg8ocLNyzJovSSKu9C881z_9fwxe3xqqESalcERnK7kTOQ9GhbzZQ=mo,that annoying vibration which cannot be turned off :/ how to turn that vibration off?,1,0,,2024-07-05 19:32:57,"Hello. We apologize for any inconvenience caused by the notification. For notification settings, please note that you can turn on/off the notifications you want in My Page > Notification Settings. If the menu does not work, go to Phone Settings > Honey App and try disabling the vibration mode in the [Notification] menu. thank you",2024-07-08 03:57:21,False
3c63499d-e49e-4d2d-812a-04599e6df997,Ishola Favour Ijeoma,https://play-lh.googleusercontent.com/a-/ALV-UjU_1oaJAslDENrwi7GzZGOSqIYSijDplveBm4CgyGxkKSqbye0,An amazing app but suddenly stopped opening 🤦its not even upto 3days I got it and I can’t access it no more😒,3,15,1.4.021,2024-06-20 20:20:39,"hello. First of all, we would like to apologize for any inconvenience caused. Honey is working hard to make it convenient to use through continuous updates. If you could send more detailed information and screenshots to our customer service at help@honeymatchs.com, we will review them and get back to you with guidance. Have a great day :)",2024-06-21 06:28:44,False
ce8be28a-c2a3-4d03-a98d-e9290441fddb,Super Marketing,https://play-lh.googleusercontent.com/a/ACg8ocKQqUFYsQY_fIbyVA0WF_xDJ5_EDvrMpa61dw6mtr5uXnt-KA=mo,شوفه مره تانية,5,0,1.4.019,2024-06-18 02:31:49,"مرحبًا،

شكرًا لتحميل تطبيق Global Honey. يدعم تطبيق Honey اللقاءات العالمية. يرجى التعبير بنشاط عن مشاعرك عبر إرسال إعجابات إلى الشخص الذي تعجب به. نحن نقوم بتحديثات مستمرة، لذا يرجى زيارتنا بانتظام. نتمنى لك يومًا سعيدًا :)
",2024-06-19 02:38:19,False
9b48c15d-8c13-47e9-9d70-35b5f4328e76,MD MAMUN,https://play-lh.googleusercontent.com/a/ACg8ocKofpynNQtm8o1FXBh_XO-3iaRcygARkwi5R8FAeUnElybEnw=mo,Why apps not send vitrified code UAE number why answer me,5,4,1.4.019,2024-06-17 08:26:35,"hello. This is the Global Honey app operation team. First, we would like to apologize for any inconvenience caused. Honey is working hard to make it more convenient to use through continuous updates. If you need help with how to use it, please email Honey Customer Service at help@honeymatchs.com. have a good day :)",2024-06-17 10:53:35,False
ba1bb9b7-1ef7-4407-891f-cb4642f814fe,Øfficial MC Kudos Master Channel,https://play-lh.googleusercontent.com/a-/ALV-UjXH8_YGtcvI34hkgCmL7uvKpoOddNDJAk53VhqYRPBuWOPajJaC,Like,5,0,1.4.019,2024-06-16 09:49:38,"hello. This is the Global Honey app operation team.
We are greatly encouraged by your positive reviews.
We will develop it conveniently through continuous updates and expand it so that users around the world can use it smoothly.
I hope you meet a good person on the Honey app.
have a good day :)",2024-06-17 09:30:13,False
c5a29857-f87e-4bbe-b9b3-3edfde11662b,Quaysin Animation,https://play-lh.googleusercontent.com/a-/ALV-UjW3YbvUe-ix8EAICtMvUtElnZ7tJQh9xWdFy0tJjxGVMxWoBmU,Ghana is not included in the list of countries to get registered. Why is this so? We don't deserve love?,1,0,1.4.019,2024-06-15 23:35:52,"hello. This is the Global Honey app operation team. First of all, we would like to apologize for any inconvenience caused. Honey is sequentially adding various countries through continuous updates. If you do not see the country you want, please wait for a moment and we will add it quickly. have a good day :)",2024-06-17 02:28:07,False
f6e95746-21ee-4bdb-b4d8-60c82d99749a,Chinecherem Anasoro,https://play-lh.googleusercontent.com/a/ACg8ocJFIQ9zoyXkvD9CAAcPBl63LY6QtloODxhl3deUA9V9A9xtTA=mo,I love everything about this app. But why are my not getting a match? It hurts and I don't even know how to use the app.,2,0,1.4.019,2024-06-14 13:18:21,"
hello. This is the Global Honey app operation team.
First of all, we would like to apologize for any inconvenience caused.
Honey is working hard to make it convenient to use through continuous updates.
If you need help with how to use it, please email the Honey Customer Center at help@honeymatchs.com.
have a good day :)",2024-06-17 02:30:02,False
93db9703-fa8c-403b-bd70-b49dcf9998de,Umulisa Fatumah,https://play-lh.googleusercontent.com/a/ACg8ocJ_0eh5hwwcbCCg6VLu_ByuGkd1xeQhuAs9KXfmuhDMvb1SjQ=mo,"Why is this app has to limit same countries, I was interested to use this app but when you are starting, it asks you to choose the code for your country but there is no all the countries for example: Rwanda 🇷🇼, Uganda, Tanzania etc so why is this app has to limit same countries??",1,3,,2024-06-14 01:10:39,"hello. This is the Global Honey app operation team.
First of all, we would like to apologize for any inconvenience caused.
Honey is sequentially adding various countries through continuous updates. If you do not see the country you want, please wait for a moment and we will add it quickly. have a good day :)",2024-06-14 09:33:21,False
5be8cfe2-1625-48cf-90a8-0d8549311fb0,Big Fundz,https://play-lh.googleusercontent.com/a/ACg8ocJLs8a_5hBD7DJiKY4i8N2kYh3kc-jNd9llrnXTB1s9_h03kA=mo,This app is the best app for dating online,2,0,1.4.015,2024-06-09 00:36:35,"hello. This is the Global Honey app operation team. Thank you for installing and using the Honey app.
Our Honey app is continuously updated to provide you with the best experience and encounter. Express your interest through likes. We plan to continue to develop in the future, so please look forward to it.
Have a good day :)",2024-06-09 09:51:56,False
253e3459-fffe-4a98-80d6-f62c04e3f4ef,TheonlyGodOfDragons,https://play-lh.googleusercontent.com/a-/ALV-UjW-G1ix5n1f-GMp-Xi-1PVMVIVeOfpt806Xl-_MOZ9dN9r1W3pL,"Full of fake profiles, do not download.",1,0,1.4.014,2024-06-03 09:32:51,"hello. Thank you for downloading the Global Honey app. Unhealthy members are immediately restricted upon reporting. We actively block registration and use of fake members, so you do not need to worry about this. We are doing our best to avoid any inconvenience through continuous monitoring, so please use it. have a good day:)",2024-06-04 09:05:43,True
3073113a-923f-4107-a012-1b4a8bb6cb7d,Mindy Young,https://play-lh.googleusercontent.com/a-/ALV-UjWvjMIgzCaPehIY99Gnfreb3M80qXt1Sa18Thi6775zfPcCpn8,"My experience with this app sucked! It was all foreigners from countries that don't speak English. No white people and to be honest, they weren't attractive and not my type. So I deleted my profile and uninstalled the app. I'm tired of downloading apps that tell you you'll have a chance at finding someone and showing attractive people on there and then once I'm on the app it shows the complete opposite. I'm very disappointed in alot of dating apps. It use to be exciting but it's not anymore.",1,4,1.2.030,2024-06-02 04:30:14,"hello. Thank you for downloading the Global Honey app. We are working hard to make it convenient to use through continuous updates. We plan to update continuously, so please wait for a while. Additionally, if you have any inconveniences, please let us know so that we can make improvements. have a good day:)",2024-06-03 05:11:03,False
edcf2e32-6fe6-4f7e-a8e0-2ad877481780,Patience Bazaanah,https://play-lh.googleusercontent.com/a-/ALV-UjX83Z9xKfqu3YQUenoh4km4wcyZLPTOKpOS7BYOWG4DvCcM_hHUYg,I have to use it first so i can rate it based on how it works,2,1,1.4.013,2024-05-31 18:33:54,"hello. Thank you for downloading the Global Honey app. We are working hard to make it convenient to use through continuous updates. We plan to update continuously, so please wait for a while. Additionally, if you have any inconveniences, please let us know so that we can make improvements. have a good day:)",2024-06-03 05:11:18,False
dd726df2-8320-4fd5-b467-8b5188bc5603,Kristana Mary,https://play-lh.googleusercontent.com/a/ACg8ocIIpG3QjfdAoNZb7Cv1HsGWDG0WnCwwVNcw3-6VJslvBT68oA=mo,It's very good app to look for serious relationship and long relationship,1,0,,2024-05-30 22:42:50,"hello. Thank you for downloading the Global Honey app. We are working hard to make it convenient to use through continuous updates. We plan to update continuously, so please wait for a while. Additionally, if you have any inconveniences, please let us know so that we can make improvements. have a good day:)",2024-06-03 05:11:25,False
c20925e3-6be7-4e5a-8e52-aff39faa868f,Lori Korda,https://play-lh.googleusercontent.com/a-/ALV-UjXZxwQyo_KF_HJRQdGyuXYOsbp4PE6CcH5yWpN4ZTnBC3t7c9bvZQ,Riddled with scammers and men looking for green card marriages. Reporting does nothing as the men remain weeks later 🤷,1,0,1.3.010,2024-05-30 19:02:04,"
hello.
Thank you for downloading the Global Honey app.

If there is an unhealthy member, please report it and we will check and take action. We are doing our best to avoid any inconvenience through continuous monitoring, so please use it. have a good day:)",2024-05-13 03:29:56,True
283b4699-cd58-436d-b117-91f7389c8ff0,Claudia Eucabeth,https://play-lh.googleusercontent.com/a-/ALV-UjWL_dQjKnsYPhAWuoB8r5XgBaiftxCgC_8VjBJHZRgYBG8guhr1,I can't My country code Kenya in Africa,5,0,1.2.036,2024-05-30 08:25:42,,,False
9da5e527-d078-41b1-881f-a15604f18c46,Abdulsatter satter,https://play-lh.googleusercontent.com/a-/ALV-UjXV3TALsPI8bb0ov8qtDhc8xELzHHO9IH_YHTdST995xKqQ2M0,Most beautiful app . it's real app for marriage.....,5,0,,2024-05-26 06:09:27,"hello. Thank you for downloading the Global Honey app. The Honey app supports global encounters. Please actively express your feelings by sending likes to the person you like. We are continuously updating, so please stop by often. have a good day :)",2024-05-29 04:12:49,False
007c8538-97ee-4e66-8ebc-d451f27a5ada,Jainaba Bah,https://play-lh.googleusercontent.com/a-/ALV-UjW9zlyKR-f61X8l-_oXwqHIUIRzki6k5YisZ3NMpYPw9V3aYsc,This app is not exclusive. I couldn't even find my country.... Just total waist of time,1,0,,2024-05-23 12:11:16,"hello. Thank you for downloading the Global Honey app. If the Honey app does not work properly, please delete the app and reinstall it. If an error continues to occur, please send a message to Honey's inquiry email [help@honeymatchs.com] and we will check. have a good day:)",2024-05-24 03:57:27,False
12eb7c77-b7ce-47f6-8949-b2973ea81ec4,M Adnan M Adnan,https://play-lh.googleusercontent.com/a-/ALV-UjUfv3-YRx_-1VpYAzi1FBWFRciAEMDkoBdtp2D0XZGso_kLJ7g,Good,5,0,1.4.012,2024-05-18 15:12:53,"hello. Thank you for downloading the Global Honey app. The Honey app supports global encounters. Please actively express your feelings by sending likes to the person you like. We are continuously updating, so please stop by often. have a good day :)",2024-05-29 04:27:37,False
7635fddf-cb0c-44de-ad36-8db5bec666e7,Syed Waqar Abbas,https://play-lh.googleusercontent.com/a/ACg8ocJLci31VHlnKtRAd-NkeM4Zs5RF67QoU1l8OQeNt2cPAFhz-w=mo,Bad experience I have not open in my country,1,0,1.4.012,2024-05-17 09:12:59,"hello. Thank you for downloading the Global Honey app.

If the Honey app does not work properly, please delete the app and reinstall it. If an error continues to occur, please send a message to Honey's inquiry email [help@honeymatchs.com] and we will check.

have a good day:)",2024-05-17 10:19:36,False
ca47de19-3870-45cd-a753-703c7673a2cf,Angelica Chikere,https://play-lh.googleusercontent.com/a/ACg8ocJ_r3NMtLsRdoOGGwRIDd8825IX9ktzDtjkfg6W3uoAyAVT=mo,Not even letting me sign up,1,0,1.4.011,2024-05-15 22:03:42,"hello. Thank you for downloading the Global Honey app.

If the Honey app does not work properly, please delete the app and reinstall it. If an error continues to occur, please send a message to Honey's inquiry email [help@honeymatchs.com] and we will check.

have a good day:)",2024-05-17 10:19:54,False
8e543e12-93fc-442d-91dc-8cc8107f0c42,John David Sumner,https://play-lh.googleusercontent.com/a/ACg8ocKbDrThpUg7wuw0Wwj2F3GAkwa0T84hvymvNBu2csjnSaQDvtpH=mo,"𝓗𝓸𝓷𝓮𝔂 - 𝓓𝓪𝓽𝓮 & 𝓒𝓱𝓪𝓽, 𝓜𝓮𝓮𝓽 𝓲𝓼 𝓽𝓱𝓮 𝓫𝓮𝓼𝓽",5,0,,2024-05-15 03:02:07,,,False
c3bc5f9b-752f-491a-8829-dc3f8fa3cfcb,Omar Samir,https://play-lh.googleusercontent.com/a/ACg8ocIQN1D3kYCDRNmB5Q-zII4K1dVker8u8d0BTFTMwabQviY8iw=mo,I just downloaded the app but I can't inter always show app stop I don't know why need help,1,0,1.4.011,2024-05-14 20:50:05,"hello. Thank you for downloading the Global Honey app.

If the Honey app does not work properly, please delete the app and reinstall it. If an error continues to occur, please send a message to Honey's inquiry email [help@honeymatchs.com] and we will check.

have a good day:)",2024-05-17 10:23:26,False
5e6eb929-532c-4fbf-8da9-7b0a0b309368,Patricia V,https://play-lh.googleusercontent.com/a/ACg8ocJuB1PXTFPnn8Y9YtzF4XsMfAbygOpw295I8XCSaGyYEq0-vw=mo,Not sure can't get onto the site yet,3,0,1.4.011,2024-05-13 13:47:24,"hello. Thank you for downloading the Global Honey app.

If the Honey app does not work properly, please delete the app and reinstall it. If an error continues to occur, please send a message to Honey's inquiry email [help@honeymatchs.com] and we will check.

have a good day:)",2024-05-17 10:25:06,False
7c8062a6-2968-4690-adf3-be663b1a5d8a,William Jackson,https://play-lh.googleusercontent.com/a/ACg8ocL1iajKlThCvA-k0Q4Vdywyc6PUkX9O5lYVUTzm6d7pMe6OTw=mo,I don not want scammer,5,0,,2024-05-11 00:04:57,"hello.
Thank you for installing the Global Honey app.

If there is an unhealthy member, please report it and we will check and take action.
We are doing our best to avoid any inconvenience through continuous monitoring, so please use it.

Have a nice day:)",2024-05-13 02:15:41,True
5fb60e72-3581-4228-879f-d28e6dd8ea9a,Praise Akanu,https://play-lh.googleusercontent.com/a/ACg8ocLLHuIhfH_Dk2l35wLEi9Apxyyoy_rXR3K9z0WUyGbpqi2Hjw=mo,My experience was terrible. I've been trying to complete my profile the whole day and it's not working. When I want to message a profile it keeps telling me I have to complete my profile and when I do as told and I tap on the DONE it doesn't work at all. Please try to fix it cause I'm getting upset,1,15,1.4.008,2024-05-08 00:03:33,"hello.
Thank you for installing the Global Honey app.
First of all, we apologize for any inconvenience caused.
You had difficulty using it because your profile was not registered properly.
If you have answered all questions and registered photos, but your profile is not complete, please contact customer service and we will check.",2024-05-13 02:22:34,False
db216362-8c43-4fe7-83cb-729e9b96e0ef,Usla Kuku,https://play-lh.googleusercontent.com/a-/ALV-UjWxJvaHXiq6I__PKGxPKWpYxlLutYbtYQeOwgrh-HTXJrbj-0FZ,Not need,5,0,,2024-05-06 23:43:49,"hello.
Thank you for installing the Global Honey app.

If you no longer wish to use the service, you can cancel your membership through My Profile > Settings > Cancel.

You can use the Honey App at any time, so please visit us again.

Have a nice day:)",2024-05-13 02:28:13,False
4aecd031-02ba-4e6c-854e-04103bf7acf7,Richard Bowes Cavanagh,https://play-lh.googleusercontent.com/a/ACg8ocKubZzCyBX89m4Jy2OQvdpbPSxKqMtEzuhcAj5dLhOIEVBnqw=mo,Can't even get a verification code 🤷,1,0,1.4.008,2024-05-06 10:54:36,"hello.
Thank you for installing the Global Honey app.

If you do not receive the verification code, please check your email and contact information. If you continue to experience any inconvenience, please contact customer service and we will be able to assist you.

Have a nice day:)",2024-05-13 02:29:40,False
b7654e73-a6ad-4104-942c-66be5920e3d1,Zaheer Abbas,https://play-lh.googleusercontent.com/a/ACg8ocKQtjVa9HV0u6X3B4zgeoVJpVzah61cug7-lWRwZzRtfKtpjQ=mo,all good,5,0,,2024-05-05 23:42:00,"hello.
Thank you for installing the Global Honey app.

Honey will support you so that you can meet good people.

Have a nice day:)",2024-05-13 03:18:48,False
ca6adc47-2976-416f-a66f-067cc288e25f,Tayyab Malik,https://play-lh.googleusercontent.com/a-/ALV-UjWD9m2uX2LYM-RLgbTBjlW0Akv-L9fp_PZeR7Rs5W4XxVM8xd9-,I installed this app and enjoying it but after sometime it's automatic ask for a registered phone number and when I tried to put my phone number it's say that it's not supporting my country that's why I am giving 1 star,1,0,,2024-05-03 23:26:06,"hello.
Thank you for downloading the Global Honey app.

I think you're experiencing some inconvenience because you can't enter your phone number.
If you enter the country name, we will check and provide guidance. Please note that we will respond more quickly if you contact our customer service center.

Have a nice day:)",2024-05-13 03:25:12,False
0cf1ddee-da61-4ae9-a75b-def32a31b508,Onajite Eunice,https://play-lh.googleusercontent.com/a/ACg8ocLzsaSz1OIo61pZVbTz52OQv16xNrJuA3WOpKjXkpmdBRvzpQ=mo,"I'm not able to receive a code while logging into the App, I guess I'm not welcome here",1,0,1.4.007,2024-05-01 19:24:53,"hello.
Thank you for downloading the Global Honey app.

If you have received the authentication code but cannot enter it in the Honey App, please delete the Honey App and re-download it to use.

Have a nice day:)",2024-05-13 03:29:20,False
