reviewId,userName,userImage,content,score,thumbsUp,appVersion,at,replyContent,repliedAt,scam_related
e8400a76-e10e-4644-b7d5-fe8dcae608b3,Kenbo -,https://play-lh.googleusercontent.com/a/ACg8ocJbi3yNto7hNnKzP6c-jQcHyf87IXUM2X4g5cArIZaTH78IVA=mo,"It seems like 90% of the profiles are fake. You will find a wealthy, single, middle aged woman who can't put together a coherent sentence in her native language, right next to a 20 year old OnlyFans girl posting soft-core videos, who also can't put together a coherent sentence in her native language. I also noticed how almost nobody takes the time to write more than a few words about themselves... On an app that gives you ONLY 500 characters to try to sell yourself for a serious relationship...?",1,24,1.3.006,2024-02-19 06:53:36,"hello. Download the Global Honey app
Thank you for doing this.
First, we apologize for any inconvenience caused by being an unhealthy member.
Honey administrators are monitoring in real time and can take action based on member reports.
Scammers, please report the message.
have a good day :)",2024-05-17 11:05:03,False
2c43fcd5-20b8-4615-a91e-e7458a82b8d5,Poochie Lou,https://play-lh.googleusercontent.com/a-/ALV-UjX4mUUh5DAYoBdDHobIY64dQfgKZ39OCxQt6ALbb7yVabZqwLKc,I only got one message 😭no one else message me 😭😭😭,1,0,,2024-02-13 10:04:44,"hello. Thank you for downloading the Global Honey app. We are working to make it more convenient to use through continuous updates. We will continue to update, so please be patient. Also, please let us know if you have any inconveniences so we can make improvements. have a good day :)",2024-05-17 11:06:09,False
789c3c33-0757-4d37-b6e9-43a58c0572d2,Lyka Villahermosa,https://play-lh.googleusercontent.com/a-/ALV-UjVQrn7fuutslnrMW_caYTUNvMAn-XFgs2jHQVpQLwSLe19IeZeq6A,So laggy i can't even set up my profile. 🙄 You just cant do anything due to its stupid lag. Waste of time waste of space.,1,1,1.3.006,2024-02-12 15:05:57,"hello. Thank you for downloading the Global Honey app. We are working to make it more convenient to use through continuous updates. We will continue to update, so please be patient. Also, please let us know if you have any inconveniences so we can make improvements. have a good day :)",2024-05-17 11:06:11,False
e60c7112-02fc-47db-84b4-258045d75f35,Ahad Khan,https://play-lh.googleusercontent.com/a-/ALV-UjVxjty2xzpwBQfhrTiwqtIiAwTaqhWUlu3Ni7PcSjZpieBuByxf,The updated version is not working good we didn't find online peoples and there is no swiping option we get random people's which are to old on this app and closed accounts,1,3,1.3.006,2024-02-11 07:07:57,"hello. Thank you for downloading the Global Honey app. We are working to make it more convenient to use through continuous updates. We will continue to update, so please be patient. Also, please let us know if you have any inconveniences so we can make improvements. have a good day :)",2024-05-17 11:06:41,False
5f72df4d-ae83-431c-9c19-5d816032baff,Kari Lane,https://play-lh.googleusercontent.com/a/ACg8ocJcQg8utbEmtlFG3azCa1o-lGWZJXFrxCQf0nNY0VeIFH38Fw=mo,I what to message my people,5,0,1.3.004,2024-02-06 16:26:37,,,False
83128b7d-b15a-419b-8c2e-620f418dc92d,Tajay Bruce,https://play-lh.googleusercontent.com/a/ACg8ocJp5QTU2blF7Oy6ghDxGfSu86-_OxsuH6ATX6nA0oRIcw2Fig=mo,Am a loving caring gentleman,5,1,,2024-02-04 12:47:35,,,False
c88f375e-957a-4475-9802-40e9d6b6e200,Serkan Arsuzoglu,https://play-lh.googleusercontent.com/a-/ALV-UjU3VHfUH_oFtALHH69oG4t2bhxFaw60iCGhNbW1zmtYp7Bf73Sy,"Registration stuck and ask you to upload photos. I have tried it few times, same problem. I have uninstalled the App.",1,5,1.3.004,2024-02-02 21:52:01,"
hello. Thank you for downloading the Global Honey app. We are working to make it more convenient to use through continuous updates. We will continue to update, so please be patient. Also, please let us know if you have any inconveniences so we can make improvements. have a good day :)",2024-05-17 11:07:32,False
e909ecee-8bc0-40fc-a1bb-aa6d2d1071d9,Daud Ogun,https://play-lh.googleusercontent.com/a/ACg8ocKSaGgTlQsWwD1qpVKG-3nHGs8-MqENsSDRuMGq5bQkpfzqjQ=mo,The app is very meaningful and it makes me find my soulmate,4,0,,2024-02-02 07:32:03,,,False
e1820728-9987-49cc-a3b9-bd2364cb0e88,Yasmine Abdullah,https://play-lh.googleusercontent.com/a/ACg8ocIV1GMjNzOQPNxJecljm0zeGKIHGY8u6nD-M_p4hYGoHUTVcw=mo,Good,5,0,1.3.003,2024-01-28 19:42:42,,,False
91d0e20e-8016-4b78-871d-436239ae2fac,Maryke Kruger-Rowan,https://play-lh.googleusercontent.com/a-/ALV-UjXbpCFX0WC2wHhuvCmMeqpYvudyjAUnlIdXHi6l444oMrGdFnW7,A LOT of fake profiles on here. And most men ask you for money.. I first thought it's a marvellous idea but the level of deceit on here is shocking especially if one is truly looking for a partner,3,1,,2024-01-25 12:53:51,,,True
84cdfc70-97b4-4ef9-bf56-98c0c963699d,Broken Soul,https://play-lh.googleusercontent.com/a-/ALV-UjXi6cZ1dQmcsfpQT6tECogIqDDT3LV6qw8bKGvenwgHTEWlhm2I,Please change this update so many glitches and visitor option are missing scrolling option missing and so many more glitches please change this update we want old features,1,1,1.3.002,2024-01-25 08:41:24,,,False
1e4ed95a-95c9-445f-b341-c11591540579,Olivia Okeke,https://play-lh.googleusercontent.com/a/ACg8ocKk9z66xIl8YGX3_baythWXpfpcXaJZ6JLh2wU3PuO9NPq80Q=mo,"Lovely! smooth app, the yellow color is appealing 😍 I hope I find my match here",4,15,1.3.002,2024-01-23 20:49:57,,,False
88db4fdd-b90f-4396-9c3b-866ca3b1b66b,Oluchi Isogie,https://play-lh.googleusercontent.com/a-/ALV-UjWcfWROl4JD3ClSXr5dCy2pu0MQqr5IpnYrWGNqcQK61eyhEbM,Very nice app,3,0,1.2.041,2024-01-23 12:23:22,,,False
7ebd841c-832c-4783-ae20-505b9e1c01e2,Faith aiji Ene,https://play-lh.googleusercontent.com/a/ACg8ocKtMHQ6Uzhit0dZbTrDqyuPd41-wNdj2IZH3O-kjUfNIWYQew=mo,After I download can't install I don't know why,1,0,,2024-01-22 23:37:43,,,False
46ad22a8-1941-41ae-8bb1-b3795ac1e21b,Miriam Johnson Baffour,https://play-lh.googleusercontent.com/a-/ALV-UjXL4Rd_eCdG-JnLqzORpDVd2T3z76IT3H56giY5NpKLsXmwkXRj,The app is ok I will rate 3star the reason is the people in this app are wired when chatting with them or any person then they just send there neud pic I don't know why am not happy with that,3,10,1.3.001,2024-01-22 20:30:54,,,False
36a96288-d552-4d96-9efe-5f13dac1ac59,Yvonne,https://play-lh.googleusercontent.com/a/ACg8ocIgoCdmDGeICBuMkVmsEAyprUIjvBwnZPKpngXo7JLfFLCzrQ=mo,Good app friendly people are here on this app,5,0,1.2.041,2024-01-22 11:02:51,,,False
cab524a7-d680-42b5-9ad3-cf96bdf9894f,Janet Atwiwaa,https://play-lh.googleusercontent.com/a/ACg8ocKuW-PvAzgmzxGqdUyvVz_E84LKjTO6jZiZghjOX-AePJSbeg=mo,am now looking for the find what am looking for any way from my point view it will be good site and recommend it to everyone,2,0,1.2.041,2024-01-21 15:15:59,,,False
283672d1-88a9-4eed-bada-e4ca17fa9e4a,Thomas Collins,https://play-lh.googleusercontent.com/a-/ALV-UjVzKrxr1skTWKNCx-ITIq3-1ZmNDryjb0O7fJo31ZgmlV8iOmk,nice app,5,0,1.2.041,2024-01-20 13:15:13,,,False
4fa504b7-ab71-4bc7-a876-6eecc255b087,Christine Kyatorine,https://play-lh.googleusercontent.com/a/ACg8ocIBxunpGB3zSyFTHCToDs2_hRK7X_I4xKIFQsXbzEEzpvdj4w=mo,not bad so far,2,0,1.2.041,2024-01-20 10:07:50,,,False
f0e8a73d-e7c1-48f4-9f75-f497d2d819fb,Oseni Zainab,https://play-lh.googleusercontent.com/a-/ALV-UjWCtvyOV4T_3WVoA0V3wcY-SmgNjDPlE2ulUprOLi2lHbh_RzvB,"I'm new to this app and I'm enjoying it so far.. giving 4 stars now and might come back for a full review,but in my honest opinion this is the best dating app I've used so far...no pop up ads,no bugs and it's smooth and easy to navigate 👍",4,42,1.2.041,2024-01-20 09:45:57,,,False
232e12a6-02ae-497a-b71b-a4ff1f90c41d,Gannon's Garage,https://play-lh.googleusercontent.com/a-/ALV-UjVPfsdq3ZEhomigubo3BZut9cmVlEcP_s9RI-0qMo7XNtosFydc,It's a porn shill site for dudes to buy OF pages. There are real people on here but they are all abroad.,1,1,1.2.041,2024-01-19 15:37:29,,,False
8f12e9bd-0f27-40af-bb43-6482b6e2cae3,Nakanjako Margret,https://play-lh.googleusercontent.com/a-/ALV-UjX8ScJjFom_f2tMKljPuttitrH04skhhRqJIisWaRHpRiuKFNo,good,5,0,1.2.041,2024-01-19 01:47:57,,,False
958779aa-7542-4ce1-bece-833669cedd50,Omolabake Temitayo,https://play-lh.googleusercontent.com/a-/ALV-UjWHgS4e3CeUoNfI8mY4301mUeh0UwC96Ty7geXTddZs8AJfSUYf,great app,3,0,1.2.041,2024-01-18 15:35:13,,,False
767e297b-98fd-43be-99b5-170d3dbcd4c7,Angie Dennis,https://play-lh.googleusercontent.com/a-/ALV-UjVXsJpQRp0vgYEsbP40ILckYXpbjDblMz0e0bSWZBH25hg_-qrR,is the best by far... simple and easy to use.,5,0,1.2.041,2024-01-17 13:15:16,,,False
cf62792a-5447-45ef-bf13-ef3f4aba767d,tumukunde Jordan Keith,https://play-lh.googleusercontent.com/a-/ALV-UjWhrMNm7shE7so1OoqGW-OGksJvqwjHrJ35Xj4y2kTRvipgCI2E,good in everything,3,1,1.2.041,2024-01-16 12:34:48,,,False
0c5838e8-ad22-468c-a5e5-0b9f18f40eba,Samba Jawo,https://play-lh.googleusercontent.com/a-/ALV-UjUdVeUtzB6lws12WqU7T2RdGi4TuV6RaFQnRlxZf68JgaQFEV0,the app is cool but whenever you text someone they don't reply,3,4,1.2.041,2024-01-15 17:09:15,,,False
c6873e4b-d69d-499e-ba67-dd50e252cc5d,Fatuma Kabugho,https://play-lh.googleusercontent.com/a/ACg8ocLVq0sRACYaHk7xFGV9GGBlJ1qcKWspgGgSFPwysmk1R8HflA=mo,I haven't found someone but this app wonderful,5,1,1.2.041,2024-01-15 15:31:05,,,False
545c9c9d-9a0d-4e7f-ae2e-7d5abc0c5973,Uchi Tembo,https://play-lh.googleusercontent.com/a-/ALV-UjWhsFnwqwSTiXGuCbu-d-od_Vzumhgbts58sPNFPHc5yMODs89L,The app is just showing blank.,3,0,1.2.041,2024-01-14 22:35:28,,,False
becd9e7f-a428-4734-a088-c32ec6561392,Jerry Steven,https://play-lh.googleusercontent.com/a/ACg8ocIrVOrVGKbCMv2f1-cnhFi9XB9X5oXPQyZKTHg6i0qrdgs5pQ=mo,Nice app,2,0,1.2.041,2024-01-14 05:26:09,,,False
3eb6574f-16c8-4072-8216-8b3417fa824d,Martha Zabwino,https://play-lh.googleusercontent.com/a/ACg8ocI7ruYcKoiyF608mrFPCkaLHRSy2EAnLdTS6qpM7bWR7IlTTQ=mo,"it's a really good app I'm enjoying it, it's free for everyone to join 💖💖💖💖🇿🇲😍",5,0,1.2.041,2024-01-13 12:28:30,,,False
16e4a38d-857b-4746-b34e-da681f09fa33,Olorunshola Bamidele,https://play-lh.googleusercontent.com/a/ACg8ocLG0FhPdSlKLax_2SJsFSQg1hWtahtdZPLcGq_G2g7C4fWxtg=mo,"I've been unable to to input my present location to complete my registration, what should I do?",1,0,1.2.041,2024-01-12 23:27:55,,,False
e2821d41-a83f-4a21-b068-bd707168f5f5,Violet Smith,https://play-lh.googleusercontent.com/a/ACg8ocIOFJVRGrmCZ5zRywM3bz5FFR_GlhKM0BCr73vUGe513gd53Q=mo,Good,4,0,,2024-01-12 19:34:58,,,False
ea287fed-6828-4062-90d9-5f16ad08cf27,Lamin Kassama,https://play-lh.googleusercontent.com/a-/ALV-UjU9qdsJdVOtwtyitHTYwJoyWu9EWRLKLP3Ge5C3CH50Ki6DZZ0,it's cool,3,0,1.2.041,2024-01-12 16:32:46,,,False
98012ce5-692d-4b11-8d65-6939504ffb5b,Michealson Samson,https://play-lh.googleusercontent.com/a/ACg8ocK4Yedh-7iaKs-jj7Wl9occzLHmJBzhMep6SylGtbgswUjrbA=mo,"I have been on this damn site for the past 2weeks now, It's so worst to the point that I can't meet one legit US citizens all the people I do come across till now are fake profile!! This application need to be sue and shut down from playstore entirely it's so worthless.",1,6,1.2.041,2024-01-12 15:17:09,,,False
cc146f82-a2b3-4726-8cad-ca9edc71057c,Mauriners Mwende,https://play-lh.googleusercontent.com/a/ACg8ocJWP0YhAWcUoKALUSFLGqvy-fRZeyRF1PZX6jl_oPBLRh8Dqw=mo,the app is very good,3,0,1.2.041,2024-01-12 13:03:48,,,False
c9ea0912-beda-4e5b-bd88-5da998f22af1,Segawa Sharuqi,https://play-lh.googleusercontent.com/a-/ALV-UjWsVu2Y_TkHFgPK7M02TU8o3DttKDrjdoGWXXtZxqqg56o1-yOPSQ,it is so nice 👍,5,0,1.2.041,2024-01-12 07:42:13,,,False
e7ebcc38-674b-4686-9719-2216db78e311,Vin Kays,https://play-lh.googleusercontent.com/a-/ALV-UjVVxlozQDaS4E_G8U4_xXMmwtjfnEUfsYv8tFYX5VWlzipStJ8K,"The confirmation code feature is terrible, it can't be that hard to figure out",3,2,1.2.041,2024-01-11 04:09:44,,,False
7b621e66-5d07-4294-92a0-67ecffabf560,KATE PRITCHARD,https://play-lh.googleusercontent.com/a/ACg8ocLRbCfw74CS0uQ4l9zDftsGx_F9Sr5VnRJV6lT3eiBkau-LJA=mo,excellent,5,0,1.2.041,2024-01-10 21:48:26,,,False
30938287-5ce5-4c7a-a2c3-0e6945d48d38,Dr chen Luwis,https://play-lh.googleusercontent.com/a/ACg8ocIi8yp38aw2HD7Mv6Alk9KZMuZNTb2BPCpfsEDbpvPMdxZYsg=mo,It's very good to use,5,0,,2024-01-10 06:37:19,,,False
1b632a01-77fe-4926-b87b-c6216327a2fc,Mark Wood,https://play-lh.googleusercontent.com/a/ACg8ocIkqH9gA7C-I3BlQCj6YBMEzhhr2ohiSIDAkpovgQvBQ60quA=mo,it's really a nice app,4,0,1.2.041,2024-01-09 04:13:46,,,False
394d82d6-f4ad-4c01-9005-a75cccca3f2c,Emmanuel Segun,https://play-lh.googleusercontent.com/a/ACg8ocL2OA7yjswOqsWDA4jTCS562XHZpzOUQH_k_aJ4XFZ74Shm4Q=mo,lovely app easy to control,5,0,1.2.041,2024-01-08 16:50:38,,,False
c14a72c3-a525-4d1d-ac5c-bf3c06be595f,Abdullahi Isah (GGV Emperor),https://play-lh.googleusercontent.com/a-/ALV-UjVOq4gyz9ERx69c8pftvU65pTQ0MLKQLZ7C06u0AI2CL3EzmX53,lovely app,5,0,1.2.041,2024-01-08 16:22:11,,,False
a4d8b8c6-ddaa-41e1-aa7a-7e0e73b2464b,Toheeb Ayomon,https://play-lh.googleusercontent.com/a/ACg8ocJ4otO3r3XXbFy5AG75k1-bsmTTQiv-2pK5_F29fkTSDjObIQ=mo,I couldn't sign up on this app they tell me to fill the place of residence then i will put my city and still it's couldn't get done I'm tired,2,1,1.2.041,2024-01-07 16:44:06,,,False
7139b310-c856-4b89-b654-ff3a9bf7f59b,Lola Joy,https://play-lh.googleusercontent.com/a/ACg8ocKkFIDGcIpSGBNaYNo6LgodYXbePoYpmY_Elbg01SGwvZOtKA=mo,I love this app,5,0,1.2.041,2024-01-05 16:25:42,,,False
8f9ea420-5332-47b9-ba67-346cb128e16e,RABIU GANIU,https://play-lh.googleusercontent.com/a/ACg8ocI0qNkkAZ6D8bLcvaHpYJu7cufk6GviHcWHAQ60jMLfVVzzuA=mo,"You have to fix your search reference because i got text from random people across the world both African, Asian, American. I don't even see my local friends. Whenever i set it to my country it would reset itself to the world and i got text from both gender which is annoying. Please fix this.",3,146,1.2.041,2024-01-05 14:24:56,,,False
1dbeb27f-098d-4735-838a-d49ae58f3fb8,Wax Ayodele,https://play-lh.googleusercontent.com/a-/ALV-UjUjLwSmcbQijOLdI2G9izqk6CIRm40Te0xEzfx7KeAMC1LaMJ8,Nice app but can seem to know when someone is online,4,2,1.2.041,2024-01-05 12:11:07,,,False
1b785d54-92f8-40db-a1ab-9aa960255c44,Oladele Opemiposi Ayuba,https://play-lh.googleusercontent.com/a-/ALV-UjWOSTd2WBhBewSM0HtCqxLvcTvDoz9TXWFKKD1Uz5jWAV3JaLdB,Good,5,0,1.2.036,2024-01-04 21:31:54,,,False
76d37b95-1b11-4ebd-9dd5-cb3e6f297c79,Bendu Karnley,https://play-lh.googleusercontent.com/a/ACg8ocL3NaD-gyMN7IdJ7pAGMEskgQ8v4O64z8_A9Yx1G01oprQ-vA=mo,this app is ok,5,0,1.2.041,2024-01-04 20:19:08,,,False
12318699-62d3-487f-ae50-e9a53f94277a,Samolary Ogba singer,https://play-lh.googleusercontent.com/a/ACg8ocJsB6XcWUJo9oY-MYxXwWrsVn-cmufZZpdHjsngdRCVzdi6hw=mo,But there's one error on this app When I want to create it After I have put all the things they need They won't let the complete sign up put yellow 💛 outside,5,8,1.2.041,2024-01-04 09:32:08,,,False
b4382110-514f-4938-b0dc-6ebebf451e88,TOLUWANI MICHAEL,https://play-lh.googleusercontent.com/a/ACg8ocIzCRXNbidd3VYuDhbhD0wj6pQqTYeeKoUuwikWW05D_rVbQw=mo,It a great App I love it,5,0,1.2.041,2024-01-04 04:14:11,,,False
9e492074-2539-4100-95ec-b21dbdb70e87,Sarah Serunkuma,https://play-lh.googleusercontent.com/a/ACg8ocJxoZF8JYMc9yV3CLZkTtqJUduWzCpcazGrEmg7ZQuUq6R9nQ=mo,good,5,0,1.2.041,2024-01-01 19:57:20,,,False
78274bcc-01e8-4547-b279-0aad7495938a,Igho Asisisi,https://play-lh.googleusercontent.com/a/ACg8ocJLxuVl2t_laEhaGVb_ELm4BobycrPNs096Vj2mEm3X7mTSMA=mo,"this app is waste of time, I can't create an account keep sending me emails code but can't continue",1,3,1.2.041,2023-12-31 17:48:11,,,False
5d8a76e2-553e-4cd9-b6b4-f20cbe654d50,Blessing KODDI,https://play-lh.googleusercontent.com/a-/ALV-UjXFOrNhl4K3zsOYP6dScNHnEx2uSMYZE9zy35JzAh3ddjyGaro,After filling my information and details.they send a code to me yet I did that and they couldn't sign me up.pls work on that,1,1,1.2.041,2023-12-30 23:49:19,,,False
18c2643c-6342-4def-aaea-1cd372534980,Muhammad Mass,https://play-lh.googleusercontent.com/a-/ALV-UjVuWfy6PHoDgCaPPL3D1YwSIZqcxmt6GmXsRcwck7ET-BMUYto,love is above everything in this world,5,0,1.2.041,2023-12-30 05:51:55,,,False
cf08881e-1dfa-45f2-9e6f-f13d62b310eb,Olori AbimBola,https://play-lh.googleusercontent.com/a/ACg8ocLjKW9szg7MR77tL97x2OsPyxMgtxhpeGaurr45GihgFnPsSw=mo,This qpp is good,5,0,,2023-12-27 11:59:40,,,False
a900014e-2b1b-46f5-a0ae-d64fc8bb172b,witness kilawa,https://play-lh.googleusercontent.com/a-/ALV-UjWUxUIUpJTtD8QOBn5s-wJPsGtTJvalUWwAjVRp_7WWDKY_J549,its a good app for the start,1,0,1.2.041,2023-12-27 05:05:43,,,False
7a6ce519-a533-4caf-abcc-455ac9f6e9b6,Hammed Biola,https://play-lh.googleusercontent.com/a/ACg8ocIGW_t0a-m0CqL64jVeMDf7Q2mfVK9ZITh_f7bEL4c-fPuaYg=mo,it's a great app but the ads is not really okay to me.,4,0,1.2.041,2023-12-26 18:12:44,,,False
0455de50-bc00-4bf8-bed4-c1b53bbbd6c9,lee evans,https://play-lh.googleusercontent.com/a-/ALV-UjXJdezwpk4LGnVcTV36M8aDB6MRCOeiEGMnzOvs85V1riIdgqf3,it's OK but to many fake profiles not many British either,2,0,1.2.041,2023-12-21 13:14:15,,,True
06fe2484-a84c-4c25-b353-20bb8606152b,Olanitori Oyindamola,https://play-lh.googleusercontent.com/a/ACg8ocK3G_t7EzHW_5Qa22ESG5hV59pkfkVn-M8R85JLLiPv4OuT6Q=mo,"Hello, have been trying to register my profile, it kept rejecting, not connecting.",2,3,1.2.041,2023-12-20 22:09:08,,,False
d80f790c-ea44-4049-98f7-fecbec0043ce,Xdone Nwode,https://play-lh.googleusercontent.com/a-/ALV-UjXtOlNn5Tej5HUif2jq70drC8Qr1Rd61HgpMEgQlFcHq45HmJk,nice,4,0,1.2.041,2023-12-20 01:21:23,,,False
3f2d4920-930f-4622-8719-aa58636551c2,Grace Ngambi,https://play-lh.googleusercontent.com/a-/ALV-UjWUF6kql9IXXBAio5fcIVuOdv0YC7EWz-nZP-Ae2xtMD_9lxrSs,it's very much amusing 🥰🥰🥰,2,1,,2023-12-17 18:27:56,,,False
4e94671e-af04-421f-a67b-911eceab80d4,Canaa Peggy,https://play-lh.googleusercontent.com/a-/ALV-UjU-rsfeicZijmzNHlnqp06YFzGxAIuU39hzDQkZmezXtKEbvRch,It's a great app very easy to use and people are real. I recommended it to everyone.,4,1,1.2.041,2023-12-17 02:48:46,,,False
a1845c91-1da8-42b4-816d-5be1e681b467,Henry Christopher,https://play-lh.googleusercontent.com/a/ACg8ocJDF8vkNWv47mR6k5fdcgqGtIhDZaFHi2WW-_SB0vwfr2tq5Q=mo,Good,5,0,1.2.041,2023-12-16 23:36:20,,,False
3b44cfbe-560a-4c3b-b13b-583b97a4338c,Chongo Chishimba,https://play-lh.googleusercontent.com/a/ACg8ocKH2dvo7zbbLyVFzSYWDsK9r2cPXbDqeLr3LKbZtJFpokUifQ=mo,I feel so lonely,5,0,1.2.040,2023-12-16 11:48:51,,,False
76fd47a6-1611-430b-a7e0-50b62fd06e91,Lawrence Chinwe,https://play-lh.googleusercontent.com/a-/ALV-UjXaFhRGpylwt4sm5do7Lx0uuNDWkhgvyrOrQRSKOlHDK3ZoE54,Its a nice app actually but l m still reviewing it,5,0,1.2.040,2023-12-15 18:12:44,,,False
3ce5cf7c-b2a9-49c5-8e5c-50133140660a,Lauren,https://play-lh.googleusercontent.com/a/ACg8ocKgGkKxKvVYwXaEOvu2FFUXhkYHKNqC7xL8Wtloupx-UlWYfQ=mo,happy 😊😁,5,0,1.2.040,2023-12-15 16:28:49,,,False
8f1bd6ef-c97b-4ddf-9e00-7824f409351c,Henry Chisom,https://play-lh.googleusercontent.com/a-/ALV-UjUoBJ2TioJCxJXrzRK47CayMgEKGTaEQncJqrWV20A1EV5mEZUs,nice app,5,0,1.2.040,2023-12-14 17:17:30,,,False
a84593d9-3d2a-48a4-89ef-23863504374d,Favour Abel,https://play-lh.googleusercontent.com/a-/ALV-UjUE7jSRPbEE6uUVHUdQDtF-e-1r8JWOGKCW3ohIqTqNkCJBSh8,This app is complicated I can't create a account anytime I received code it doesn't allow me to login the process,1,0,,2023-12-14 07:40:58,,,False
01cd53bd-3893-42a8-8ca5-1fca71045e06,Stella Dike,https://play-lh.googleusercontent.com/a/ACg8ocKPpKz7GWOMUTBSEkeUYnAWuc8AEc1mNkQJkpPkLcNDOBLAqg=mo,I really Love the app..,5,0,1.2.040,2023-12-14 01:41:43,,,False
a07a4d65-83a9-42d6-8d39-dbe883f51975,Maria Maria,https://play-lh.googleusercontent.com/a/ACg8ocJI9LFtCbOSwYlxUX0yN25uR6IfZCuITVgQ5gX56Z4-45YBeg=mo,"It's doesn't work why ??l keep updated my profile every now and then but no reason can someone tell how it's works plz??,🤔🤔",1,2,1.2.040,2023-12-13 07:56:29,,,False
ef947f41-176f-435e-8706-3987cdfbbf22,Okpave Friday,https://play-lh.googleusercontent.com/a-/ALV-UjVOryIaXHThSSrCXssR7DbvSoVa5icCBlYc0z5NmRvzEaqvToHx,nice 💯,3,0,1.2.040,2023-12-12 01:26:21,,,False
031abc9b-da45-40c3-a80e-96334ce89f0c,Wendy British,https://play-lh.googleusercontent.com/a-/ALV-UjWxALxI9wZUBY1zPSklLKvXZuulDMiL27DdG0NupccLSgUrKDA,nice app kudos,4,0,1.2.040,2023-12-11 12:37:33,,,False
2170ce16-d045-4afb-a991-3b906f06a4f2,Saadatu Yahaya ibrahim,https://play-lh.googleusercontent.com/a/ACg8ocICptWyj4nCsY4l6PtqCiJRTbKd-Xnv_XtEYxJ8RnQLL3DzxA=mo,this app is really nice to meet my soulmate,2,1,1.2.040,2023-12-10 22:50:01,,,False
d1a1acfc-771e-42e5-a109-81fcd10cc462,Umoru Yunusa,https://play-lh.googleusercontent.com/a/ACg8ocL7VD9Y-ePL22O7maOl0y-LUnsbe0UiVsfz3KWxxn6Ob6jVlw=mo,I can't sign up to this app,1,1,1.2.040,2023-12-09 15:22:37,,,False
1e88d3c2-1b49-43ae-b9c2-da50301e1f9e,Olasoji Korede,https://play-lh.googleusercontent.com/a/ACg8ocJsZsGLHPoh1-DogHFCj6-uXC8psMywU4YLkBVbVldwwgAlfQ=mo,Amezing app full of fun,5,0,,2023-12-08 20:07:46,,,False
95895cb8-44e0-4300-aefc-b89d55f9ea58,lucy mavhura,https://play-lh.googleusercontent.com/a-/ALV-UjV0Ggs4gVlhsHm3cfjx9EMLYIZ6PNIlZ4HmfO9uuArkvq0LbDUOyg,"If i could give you a zero i would,the app is full of scammers,using fake profiles to be white yet blacks and asking for some codes trying to hack my whatsapp .this not safe upgrade and make sure u verify users",1,1,,2023-12-06 21:01:28,,,True
1cc94a1c-2ff6-4d3b-a75f-2ff694306a2b,Nandi Mpshe,https://play-lh.googleusercontent.com/a-/ALV-UjWie2OHBMEkFTWaJ5CrbokOzrNbYQIwGNS48s5PZEh1uw7pRRf1,It's a good app . Easy to navigate.,5,1,,2023-12-06 19:27:05,,,False
523c921b-e516-4ce9-bd2f-8d4e7aac058d,Aliyu Julius,https://play-lh.googleusercontent.com/a/ACg8ocI3THpo8uWVbbTMkqE7XECAGK_iTVRLJP7KWJwtq4mtAviBcfk=mo,This is good,1,0,1.2.036,2023-11-30 09:21:04,,,False
25a64986-8a2c-47e9-8074-2572272ed3f8,Iyanu Peter,https://play-lh.googleusercontent.com/a-/ALV-UjXpnn8ICF62uvHjmJUYN6x236Bk2BLl5YJRVGf2I-38qgGX3CoJ,good,1,0,1.2.036,2023-11-28 15:04:50,,,False
2c78c093-8d64-4646-a3ea-ec4ae7998104,Acca Bookkeeping Services,https://play-lh.googleusercontent.com/a-/ALV-UjWM_2iKzWt_9zLfp8CcLoo7LTT28vD1dmn-qVN1Ubjhs-2aIyM,"You cannot send a message, it always ask you to watch ads before sending a message. After watching the ads, still, it cannot send a message.",1,11,1.2.036,2023-11-21 10:47:18,,,False
745776ff-688d-4883-91c6-768dd8ebf9c3,Rana Goshi,https://play-lh.googleusercontent.com/a-/ALV-UjWwj-Agy3mDxsVdbdcdrxMd-2pVv9HtwIqzJrQKXJ3r85RJ_3t73A,good,5,1,1.2.036,2023-11-21 09:17:57,,,False
2713069f-4603-4367-9dd1-b5bc105fec38,Richard Min,https://play-lh.googleusercontent.com/a-/ALV-UjVhrJVDWye4qJfyYNCYbUZtqADUa5lYmpId4Zu-_KPJ47o-blJrZA,I can't get any profile views (I want to update) and notifications in the honey app. Nothing. Help?,2,1,1.2.036,2023-11-19 09:45:51,,,False
f21f567c-5a72-44fb-9fae-12547ce6d942,Richard Min,https://play-lh.googleusercontent.com/a-/ALV-UjVhrJVDWye4qJfyYNCYbUZtqADUa5lYmpId4Zu-_KPJ47o-blJrZA,"The Ads are miserable!! Not the showing of them (Honey does have to make money), but it's presentation of them is horrible! For example, it's doesn't allow me to get out of vicious circle of the ads. It's keep showing them and showing them and showing them, and I can't get out of it until I close the app. It's previous version don't have that. Fix it.",2,314,1.2.036,2023-11-17 04:43:00,,,True
6d60e395-846b-49ab-b227-6d45ebd62912,Mohamed Salah Aliouat,https://play-lh.googleusercontent.com/a-/ALV-UjX_7C9txfcE2q9VONbPuvMV-CEQGSjmTTGSnhfovB0RdvI-h0-I,Full of scammers but the design of the app is so unique the UI is awesome wish that they put more effort into removing fake profiles just like the effort they've put into the UI.,4,16,1.2.034,2023-11-16 20:36:29,,,True
b3599179-68e6-4eef-9656-f49ab18e3569,James Miller,https://play-lh.googleusercontent.com/a-/ALV-UjVNkU995tC0BFMqJTsJSZJkjyOvR1OL9t328jAtgq9SKGrPEmw,"Your app is now gradually becoming worse each time I updated it now I can't change who I want to see or age gap i want to chat with, too much ads with nothing to show for it",1,1,,2023-11-11 01:26:30,,,False
9a34c0f4-f9c3-427d-90d1-a06ce13e78d2,Paul Testimony,https://play-lh.googleusercontent.com/a-/ALV-UjWo1idH1WEA9oznnRl23D2W4CamBGDDiCGFwNHzWkvwS-fr4qY,The most worsted app I have ever seen in my life,1,0,,2023-11-06 14:29:35,,,False
012984c9-ca0a-415c-ab4a-2bfcba5aed67,Skhululiwe Mayisa,https://play-lh.googleusercontent.com/a/ACg8ocK1dCaycwzulIJ6JHcilTuiRoOcp2txfeBrRjoURbpAK_Lg4A=mo,So far I don't have a problem with this dating app,5,2,1.2.031,2023-11-04 20:27:14,,,False
d81e5338-9e2a-4ce7-9eea-dba0432e8ccc,Christopher Henry,https://play-lh.googleusercontent.com/a/ACg8ocImdQpXcZzqchQj3cYJCMJC7w25EqajPJByY7ujgS6bWdj2PA=mo,Is the best app ever,5,2,,2023-11-04 15:02:28,,,False
8eb8730f-d8b9-45a0-ad9d-b9c96befe39d,Trade Now or Never,https://play-lh.googleusercontent.com/a-/ALV-UjWsCiycU6chr7WddHvPT0VoihKbZcuIxn7SoeRvnpnmwi00JmJg,watch ad to see profile details then nothing happens 🤣,1,0,1.2.030,2023-10-29 02:58:40,,,False
09d43142-80d2-44bf-beb6-a7359087915b,Philip Christ,https://play-lh.googleusercontent.com/a/ACg8ocLSLJH4WWTplu52PHPdmrkU5YjIP_SvXpV8TNggs_qf3QjS7g=mo,The app is very reasonable an there are although of scam there,5,2,1.2.030,2023-10-26 19:08:09,,,True
3e0d0675-4704-4d87-a52b-53f7e754bf8b,Suzy Simpson,https://play-lh.googleusercontent.com/a/ACg8ocKMzDyQCw9o_I8G2wEQfzqtNDqDFkPqM73zgK9u8Izu5YRRZg=mo,"A lot of ghosting,nearly all contacts are in another state or country",2,3,1.2.027,2023-10-26 02:59:56,,,False
