reviewId,userName,userImage,content,score,thumbsUp,appVersion,at,replyContent,repliedAt,scam_related
81272f3c-eba7-47de-8cef-32841b52478a,R S,https://play-lh.googleusercontent.com/a-/ALV-UjVdgWjt_hs9mLluVzka3nUBFnMbQ19OleL7SzVyiAPUetL1p6er,Let me save you some time with this one before you even install it: they actually make you wait to create an account and then refuse you anyway like this is some sort of exclusive club. Absolutely pathetic display.,1,0,,2025-01-17 22:30:05,Hi RS! Thanks for sharing your feedback and we will take your thoughts into consideration. Have a great day,2025-01-20 16:09:19,False
cfed280c-04f3-467d-a89f-76be1f9e9975,Jagannath Parida,https://play-lh.googleusercontent.com/a/ACg8ocKiOKu5gQnL5T7e5grCmIYQm_TxjTyo-1GtYMCXV6gILH1v1A=mo,wonderful,5,0,5.12.1,2025-01-15 12:10:22,Hi Jagannath! How wonderful.Thank you very much for sharing and recommending our app. Have a great day.,2025-01-16 15:41:37,False
edbf676d-ac0e-4ed4-9085-14bd2bd72497,Leonardo Lorenzon,https://play-lh.googleusercontent.com/a/ACg8ocI42LdJRdYXDT1_zAMyIlvyyUtUMiSC3aJEPZqeOPSJIVpUkOE=mo,"I don't get it. What is the point of offering very limited free access. Half of the women add their instagram account in the description saying that they can't read or awser the messages, it ruins the experience in the app. Either make it full free or nothing free. Nothing free being the best. Also if I'm paying a subscription why charge extra for boost whatever that means. This ain't Tinder right?",2,2,5.12.1,2025-01-13 00:08:31,Hi Leonardo! Thanks for sharing your feedback and we will take your thoughts into consideration for future improvements. Have a great day,2025-01-14 16:22:16,False
a3b21d39-828f-4763-ab39-4f2dc1e68146,Darren Nielsen Jr,https://play-lh.googleusercontent.com/a/ACg8ocLMT10taQN0YPulZXrreGl1eo91ppAoC99nrsfWS2WImS7pLw=mo,Just a poor app,1,0,,2025-01-12 23:40:01,"Hi Darren, We're sorry to hear this! Please send us your feedback at support@theinnercircle.com and hopefully we can change the way you experience our community.",2025-01-14 16:20:57,False
3e4967a3-a6fa-45c4-84a2-d6d0334af8cc,Pasqual Streiner,https://play-lh.googleusercontent.com/a-/ALV-UjXN7VxbBTReClFEcDPj5Kk0InE5gupnLlLK_u0t9arNYTamuDuD,"Have been paying for nearly 4 years with an inactive/disabled account. No messages, no questions whatsoever. Pure theft!!!",1,0,,2025-01-10 18:03:22,Hi Pasqual! It looks like you didn't realise that the membership is an automatic subscription. Questions about the membership are also stated in our FAQ's and it's actually pretty easy to cancel this. Please contact us at support@theinnercircle.com and we will look into it for you,2025-01-12 20:01:41,False
acbba507-9498-4eaa-a491-fac94e0834ee,Nik,https://play-lh.googleusercontent.com/a-/ALV-UjWtQSrc6pw1Op9H6MzgvIOZUC2Z52D6biZ2wZqYsL9wh1Bl5w1X,Why do you need to be specifically 20 for this? I get the application process (or at least how far I went),1,0,,2025-01-08 11:25:02,"Hi Nik! If you need more assistance in regards to your account, please drop us a line at support@theinnercircle.com and we will be in touch . Have a great day.",2025-01-09 19:40:31,False
5857c0f2-3e3f-47ae-9443-3219366750d2,ED,https://play-lh.googleusercontent.com/a-/ALV-UjUFJHTdAzHlSnbGd0nFeZky419OIXS3I9IoKVx4cVatMll-9-5I,Verification refuses to work. The problem is your broken software.,1,1,5.12,2025-01-06 18:54:57,"Hi ED, Can you please contact us at support@theinnercircle.com and we will look into it for you. Have a great day",2025-01-07 13:28:07,False
9d3b9a93-b437-4054-96c3-27938289570f,SeanaCorn Wilby,https://play-lh.googleusercontent.com/a-/ALV-UjXTHA6gDyDQYRGfoEcHvZrwq4DJXfBDo7eQJ0q2TtCVrmQqtM0,Stupid app won't even let you sign up,1,0,5.12,2025-01-05 09:48:14,"Hi SeanaCorn Wilby, Can you please contact us at support@theinnercircle.com and we will look into it for you.",2025-01-06 16:46:35,False
e69fdad6-48a1-46cb-a824-24e84b098450,Gabone Catanescu,https://play-lh.googleusercontent.com/a-/ALV-UjVbvPakD1TtLJb-jkDC7GTBHDiO2_oduFJnmktYHgDK5lworu25,Discriminatory and elitist! It sucks,1,0,,2025-01-03 23:00:17,"Hi Gabone, We're sorry to hear you feel this way. Your feedback is important to us, and we'd like to understand your concerns better. Please reach out to us directly at support@theinnercircle.com so we can address this. Thank you.",2025-01-06 16:34:53,False
cbab7fa7-af62-4e66-acb2-e00d2787a9a7,Ingrid Elliote,https://play-lh.googleusercontent.com/a-/ALV-UjU1uLAFDpKePsZV5t-a4T5Lam4K80Z5lCXmID0b7P3w3h4lptHm,"Já tentei criar perfil e toda vez recusam, parece mais um ENEM de tanta pergunta e no final recusam o perfil",1,0,,2024-12-31 02:18:21,"Hi Ingrid, Can you please contact us at support@theinnercircle.com and we will look into it .",2024-12-31 12:35:18,False
27cf3115-5485-457e-85d0-aed0a18531d5,Kttks,https://play-lh.googleusercontent.com/a/ACg8ocI7l65yBl4LhG8l_dmB3hf4x68MErz4qqhTHljRCQJB-ZRg6Q=mo,Wasted hour or two filling out application just to get denied.,1,0,,2024-12-31 01:02:22,Hi Kttks! Thanks for sharing your feedback and we will take your thoughts into consideration.,2024-12-31 12:35:49,False
6b48f80c-cfa8-4005-abd8-35ec5250dee0,Issa Saad,https://play-lh.googleusercontent.com/a-/ALV-UjXGROeEPfbpfWx9j1qhlBNJW84EtFmLqppeS0bet1WkpJx6Zi4y,I'm gonna make this as constructive criticism as possible - your app sucks. Putting aside the high cost of the membership (as if im meeting the queen here) - there are no profiles in Doha and maybe 4 5 in dubai and they keep on looping even if i click X on them - too many personal questions when setting up the profile that theres nothing left to SAY when matching with someone! Keep something for us to talk about. Piece of advice - close the app and look for another idea away from dating apps.,1,8,5.12,2024-12-30 08:42:37,"Hi Issa Saad, thanks for sharing your feedback and we will take your thoughts into consideration.",2024-12-31 12:36:33,False
9e1d7aa7-546c-4080-9080-839d19e0dcc7,Tejash Doshi,https://play-lh.googleusercontent.com/a-/ALV-UjUaOvoFCi1KWWTxr2Wu-tXTVUNEkuYexByFL2fDi18CYjm7Qivs,"Though it is an expensive dating app there is no payment option to purchase premium membership in India. Even after a match chat is not possible. Though the concept and design is very good, execution and customer support is terrible.",1,7,5.12,2024-12-29 03:25:09,"Hey Tejash, thanks for sharing your feedback and we will take your thoughts into consideration.",2024-12-31 12:37:11,False
a439a9ba-a258-4667-81cc-459ada7b70ce,Meday Calixi,https://play-lh.googleusercontent.com/a-/ALV-UjXNMboCqaLMb0rPSMRtTFBn1DGSrW9aPZh3K2rEHrHUfcwxQP-o,After verification I got this email.. Thanks for applying to join Inner Circle. We've considered your application but at the moment we're unable to invite you to join. What is your problem?,1,1,,2024-12-26 10:14:41,Hi Meday! Thanks for sharing your feedback and we will take your thoughts into consideration.,2024-12-28 19:48:34,False
100912fa-fac8-41e0-968c-d1e54981371f,Guilherme M,https://play-lh.googleusercontent.com/a-/ALV-UjXL8eQFRM5CbjsMPjQ0lYh1pQ0eEX9-rHE3crbW8ilHE-U8xKa1Fw,Não permite conversar com quem dá match. Ridículo.,1,0,5.11,2024-12-26 01:32:37,"Olá, para ter uma experiência completa é preciso comprar nossa Assinatura Premium. Nós nos esforçamos para construir uma comunidade interessante para poder gerar conexões genuínas. No entanto, se você trouxer amigos para o app, nós liberamos as suas mensagens de graça, por um período, espero que entenda e qualquer coisa ficamos à disposição.",2024-12-27 20:07:45,False
183ab477-e7b2-4009-973c-4e420a485811,Pedro Chaves,https://play-lh.googleusercontent.com/a-/ALV-UjVc-_w9F6dVVHhrO7ybNj6jOWbrq9IT1nqWQpUXU2sQh_u3dMX8,muito bom,5,0,5.10.2,2024-12-15 20:25:39,"Hi Pedro, Wonderful! Thank you for sharing. Enjoy Inner Circle.",2024-12-17 11:17:01,False
f89c7298-0a99-496d-9a77-af811af337d0,Rapha Oliveira,https://play-lh.googleusercontent.com/a-/ALV-UjXEqN_vFPd77aPTLzyhLkhPyI9YwhSPsfYsoKBpR7ac0vRL6cHB,"Não recomendo. App é uma bolha de ricos. Todos os preços são muito maiores que os outros apps de encontros, os likes são ilimitados, mas msmo em quem você da Match, não é possível conversar sem pagar… É um Tinder gourmet mas mal feito.",1,1,5.10.1,2024-12-07 18:37:29,"Hi Rapha, We're sorry to hear this. We are always open to feedback and continuously improving so if you have any other suggestions please feel free to send us a message at support@theinnercircle.com",2024-12-08 18:10:40,False
d1e6bbfc-9ab3-4418-8f0f-a7c51311912b,Leonardo Guia,https://play-lh.googleusercontent.com/a-/ALV-UjWFXjgHyqxDArJxmZNmXfwbodLM8MEe_ocHbhbW-e2XuCdHG46S,A disappointing user journey. The app's tedious waiting period after the user has already completed the profile and submitted photos and a selfie for subsequent approval is far from user-friendly. I wouldn't recommend this app to anyone.,1,1,5.10.1,2024-12-05 05:59:09,Hi Leonardo! Thanks for sharing your feedback and we will take your thoughts into consideration.,2024-12-05 16:12:14,False
75e3cb2d-0573-454b-b276-ffb499842615,Cecilia Laura Garcia,https://play-lh.googleusercontent.com/a-/ALV-UjVXkXkKpK9aokRBrN4gN3mJFUCPeWV707JR5Bmjyv34mmhtAiKh,Impossible to open a profile. This is the worst ever. No support provided,1,1,5.10,2024-11-30 06:29:39,"Hi Cecilia, Please contact us at support@theinnercircle.com so that we can locate your profile in our system and resolve the situation for you.",2024-12-03 16:00:03,False
b6978ec2-5c27-4909-a7e5-3a84e4034936,beatrix,https://play-lh.googleusercontent.com/a/ACg8ocI_C2t9gYciJYrB4PQ9EiNrZj7xcMr_AiNNJkAAmKQQ_-zS6n8s=mo,💯🙏,5,0,5.10,2024-11-23 08:01:07,"Thank you so much for your encouraging star ratings!
",2024-11-30 16:30:15,False
f412af8c-5099-416a-bd2b-44633bd2975a,Romulo Araujo,https://play-lh.googleusercontent.com/a/ACg8ocJ9FkkKcjgiGYToiUbRy5qHlhWYs9APJYel1jE5ot1Q-7_Q5A=mo,"Buggy, expensive and shittier than tinder. Basically pay a premium price to be ghosted by people. Expect a lot of matches that lead nowhere.",1,1,,2024-11-21 21:26:39,"Hi Romulo, We're always open to feedback and improving our community. Please feel free to share your thoughts with us at support@theinnercircle.com and we will look into it for you.",2024-11-22 20:29:11,False
8042f1b8-fb6b-480d-83c4-87bfc6a735b8,Fabrizio Vargas,https://play-lh.googleusercontent.com/a-/ALV-UjWPGrmZixsO33T67kbxvCPMu1sNK_QBNjYcZYmxKjPYdGHSiWLcqA,"Unfortunately inner circle choose the worst gave recognition company around, facetec. I have trouble with this system everywhere. Terrible technology",1,2,5.9.1,2024-11-21 20:21:30,Hi Fabrizio! We're always here to support you. Please send us a message at support@theinnercircle.com and we will be in touch.,2024-11-22 20:27:44,False
9071fe13-b227-4a3b-b508-52a9d71ecf3c,Paul McCran,https://play-lh.googleusercontent.com/a/ACg8ocIyD7ZwG1e_MeL92gZK1tp1boVokECIuJR6wfvArjgZ3ds0zA=mo,You would have better luck in a convent.,1,1,4.0.1,2024-11-21 20:19:24,"Hi Paul, We're always open to feedback and improving our community. Please feel free to share your thoughts with us at support@theinnercircle.com and we will look into it for you.",2024-11-22 20:27:18,False
6dcdc67e-feaf-439f-be06-102f2dc2858f,James V.,https://play-lh.googleusercontent.com/a-/ALV-UjXIOUB_jeiBa1D_Inhgt7ZLxI9Q7EMhXZeh5AFDDUlNw59KQyoZ,"The lengthy application process wasn't something I had in mind before entering, and not something shown in the ads, it alone was enough for me to give up, maybe I'll re download it later, but for now I think I'm good, and seeing other people complaining about prices to open messages? Like hello, are you just a bunch of money hungry developers looking to build a cash grab? I'm not that person, sorry!",2,0,,2024-11-18 01:56:29,"For the full Inner Circle experience, including messages, you must sign up for a full membership. We believe that quality is worth paying for. You can also invite your friends to the app. If approved, we'll give you access to your messages.",2024-11-20 15:38:20,True
1b470c5d-4a5d-4d40-8f1e-85da82088e1f,Jeffrey,https://play-lh.googleusercontent.com/a/ACg8ocIe1SKL5z7U_hRTi8mD1n9Ux3hvz5-HwdCA20tDObHKnHpMyA=mo,"My experiences are as follows You will get waitlisted It can take months until you get in After you get in, you can't see likes unless you pay for subscription. I wouldn't use this app again.",1,5,5.9.3,2024-10-29 09:04:28,Hi Jeffrey! Thanks for sharing. Your feedback is valuable.,2024-10-31 11:33:13,False
afd5bff5-0d22-415d-bc77-fd862264e169,Juliana Torquato,https://play-lh.googleusercontent.com/a-/ALV-UjV9RHUM-0sh7emFJ7ihMAjxugDpB3T_W2t7dX_kcJaIx_Zgfu0,"I was invited and can't finish my profile because, no matter what I do, I can't get pass the verification (YES! I FOLLOWED ALL THE INSTRUCTIONS) and there is no support for it. I can't go back and I can't move forward so I had to come here for help (which is quite ridiculous, let's be honest) UPDATE: After months, NOTHING has changed: pic rejection with 0 personal explanation, 0 possibility to move forward or backwards and the verification process one worked 1 to reject the pic. Doubting this",1,30,5.9.3,2024-10-28 15:09:45,Hi Juliana! Please email us at support@theinnercircle.com and we will be able to get your information to pull up your account and help you.,2024-10-31 11:32:14,False
21ddabb2-9ec9-4ad0-a63f-33ee6a1245c5,Matheus Gabriel,https://play-lh.googleusercontent.com/a-/ALV-UjWhs-bus9l32WxTf0vkbGtgivCKlo3Zm49P-GBro78S67BtKS1biw,Nunca vi um app q o propósito é conhecer pessoas e é preciso pagar para conversar,1,1,5.9.3,2024-10-27 22:50:24,"Para ter uma experiência completa, incluindo o acesso às mensagens, é preciso comprar nossa Assinatura Premium. Nós nos esforçamos para construir uma comunidade interessante para poder gerar conexões genuínas. Como também acreditamos no poder da comunidade, se você trouxer amigos para o app, nós liberamos as suas mensagens de graça, por um período.",2024-10-29 16:01:45,False
e7c19b18-9d8b-40a2-8a72-15f3c51322cb,Bjorn Roos,https://play-lh.googleusercontent.com/a/ACg8ocKI-_o03aMt_-AkaZRrbTYYpXdVs6vxM_Q2fvwSh6-94EZnZA=mo,"After I entered my details and my photos, the program crashed several times. Not recommended",1,1,,2024-10-18 21:47:30,"Hi Bjorn, Please contact us at support@theinnercircle.com so that we can locate your profile in our system and resolve the situation for you.",2024-10-20 16:04:17,False
87f68e43-0f5c-40c6-ba55-c849144352a8,Jairo Alejandro Barbosa Alvis,https://play-lh.googleusercontent.com/a/ACg8ocIETZTVBeahvj8KTyMFsHPAjyFRgHNM76dAHFsS_EgWNcALKA=mo,I dont receive notifications,2,1,5.9.1,2024-10-12 05:46:00,"Hi Jairo, We understand how annoying that must be. We're working on a solution and will have it working again soon. Thanks for sharing.",2024-10-15 13:56:49,False
5b8542e2-0945-413c-9941-f0ff9b7e29c4,Gaston Antico,https://play-lh.googleusercontent.com/a/ACg8ocK-RSvsGrwQKxB-P-ij8HrSMm6s-4c87RdDQGbT8RqEIGsrUA=mo,"Lenta y con features basicas tras paywalls, cada año sacan mas cosas y despues las cobran para tenerlas de nuevo Edit: oh... If by Full experience You mean, basic features that other apps have for free... Yeah sure... ""quality"", terrible performance since update, and removing features that were initially free... Then the ""Full Experiece"" depends on how much you think you can squeeze people",1,5,5.9.1,2024-10-10 16:26:48,"For the full Inner Circle experience, including messages, you must sign up for a full membership. We believe that quality is worth paying for. You can also invite your friends to the app. If approved, we'll give you access to your messages.",2024-10-09 17:18:13,False
1ddb5b2b-e9df-4ae6-9467-3a535762bf28,Eilder Jorge,https://play-lh.googleusercontent.com/a-/ALV-UjX3vyKTH-_bTVfEOKK5185lHxKHBURhZ6UP5SpvpeVGIGvi39A,I don't usually bother reviewing garbage but deserves the 1 star for using defective face recognition software that never works.,1,2,5.9.1,2024-10-07 18:34:24,"Hi Eilder, That is not the Inner Circle experience we want to provide our new members. Our technical team is working on it, but in the meantime you can sign up again. Once you are verified, send us an email at support@theinnercircle.com and we will give you a little gift!
",2024-10-09 17:17:38,False
287e98ec-945f-4e73-bf7e-f8d6687153c5,Geison Lourenço,https://play-lh.googleusercontent.com/a-/ALV-UjVyRqSkS_tRrbrAnqssnwfe3gpnwIsm8LwbkUNkmWzmDXLyuRdM,I'm not receiving notifications from this app on my Galaxy s23 ultra since the last update. My notification settings is allowing all and even with that is not working. I've already reinstalled the app with no success. Very bad,3,2,5.9.1,2024-10-06 05:09:37,"Por favor Geison, envie um e-mail pra supportbr@theinnercircle.com com os detalhes do ocorrido que vamos verificar o que
houve e te oferecer uma solução.",2024-10-08 16:59:54,False
e4f244d8-ec6c-4da7-82aa-fb798073b411,Nacho,https://play-lh.googleusercontent.com/a/ACg8ocI2XarVKZxltRpFHMtE0-vX8rJ1m-5nW7SUiXX1BjTl-SnWfw=mo,"Recomiendo esta app no solo por que es distinta a las demás en cuanto a ser una comunidad de gente mas variada que en otras apps sino porque los filtros son mas especificos y te permiten encontrar a personas afín mas rápido. Ademas, el hecho de poder ver lugares recomendados en tu ciudad te ayuda a integrarte en su ambiente. Muy buena app para conocer gente para amistad tambien y poder crear un círculo social nuevo. La recomiendo sin dudarlo.",5,0,5.9.1,2024-10-01 13:40:18,"Hi Nacho. We're thrilled to hear that you enjoy our curated community and the ability to find like-minded people quickly. We're also glad the recommended places feature helps you feel more connected to your city. Your recommendation means a lot to us, and we're excited to continue improving your connections. Have a great day",2024-10-01 19:03:59,False
8aa36ca2-8bd9-4483-8abf-c413dc18c4ee,Heribert Rosales,https://play-lh.googleusercontent.com/a/ACg8ocLLgSQ7nJepjqktFwBhFJ2hOvPqRelW0UMJV90fR8-p1yru2g=mo,"En esta app encontré a una excelente personita, me enamoré, duramos un año y fue una de las experiencias más bonitas y a la vez amargas que pude vivir. Aunque ya no estemos, puedo decir que realmente pude conectar con esta persona gracias a esta app. Lástima que no se pueda volver al pasado, pero no me arrepiento de haberle dado cada parte de mi ser.",4,0,,2024-09-27 02:15:10,"Hi Heribert, Thank you for sharing your experience with us. Although we are very sorry it didn't last forever, we are happy you made a meaningful connection through our dating app. We wish you beautiful new beginnings again to come. Have a great day",2024-09-27 14:46:10,False
6de109a6-f3fa-4100-9abd-287662862f0e,Sebastian Lonsdale,https://play-lh.googleusercontent.com/a/ACg8ocKYhP8MNLKMlcS_PapoPSpSHXfwxMfq9Ogmsa1yVTVTOFrghQ=mo,"Great app, it's easy to find the right person, if you're lucky !!",5,4,5.9.1,2024-09-25 00:07:28,Hi Sebastian! Wonderful! Enjoy our dating app and let's get together at one of our dating events :),2024-09-25 16:28:48,False
fcf8d0b7-c5a9-4629-8f18-c318ca6d5549,herc ules,https://play-lh.googleusercontent.com/a-/ALV-UjURaMNn5p8ko_Pbqewmf1ruSSCEufEVo4dSpUhRJSFx-BCMdho,Trash app,1,1,5.9.1,2024-09-23 16:27:57,"Hi Herc, We regret that you did not like our dating community, but thanks for the feedback. Have a nice day.",2024-09-25 16:28:00,False
b1a22884-98d5-4341-af8b-1f6c635cda0e,Gabriel Martins,https://play-lh.googleusercontent.com/a-/ALV-UjV3yK7oYxidFcRzMumnw9pHMGopj8trcwTbgF6UHuMe_XBauko0,"Could not use it, half a year on the waiting list and wasnt accepted",1,1,,2024-09-16 07:43:33,"Olá Gabriel, realizamos uma verificação manual de cada membro, portanto isso pode demorar um pouco mesmo, mas por favor entre em contato conosco no e-mail supportbr@theinnercircle.com, assim conseguiremos localizar seu perfil em nosso sistema e te ajudar com a sua solicitação.",2024-09-17 20:00:58,False
19072640-86fb-4534-853c-9c5db31e20b0,Jack,https://play-lh.googleusercontent.com/a/ACg8ocIRoP1B1ZHB6kNGchmoVtua7kgf9w_A9Syi-VFY0VcDo3oaolg=mo,"This app is actually a joke lmao I tried to make 3 accounts and all of them got declined,they do not give you the reason.do not even download this you will waste your time.",1,1,,2024-09-13 15:28:07,"Olá, realizamos uma verificação manual de cada membro, portanto isso pode demorar um pouco mesmo, mas por favor entre em contato conosco no e-mail supportbr@theinnercircle.com, assim conseguiremos localizar seu perfil em nosso sistema e te ajudar com a sua solicitação.",2024-09-13 21:20:34,False
1e844850-d784-472c-89c9-0c9c949f5f01,Claudio Kinzel,https://play-lh.googleusercontent.com/a-/ALV-UjX6WzDmiPnYQpHJ-ioGnpcratX0joNlwxg2Wxy0fBoMfP7stAvK6Q,You must pay to chat with someone. Ridiculous!,1,2,,2024-09-10 20:12:01,"For the full Inner Circle experience, including messages, you must sign up for a full membership. We believe that quality is worth paying for. You can also invite your friends to the app. If approved, we'll give you access to your messages ;-)",2024-09-11 09:45:18,False
246ac6c8-fd85-4405-abf6-85f8e32d2b14,Rodrigo Rajão,https://play-lh.googleusercontent.com/a-/ALV-UjXMPB4vlPkE2sSd66XiulEoRrSrQf5aIaZGlxCd6rBhn6l_XZsn0w,"Ficou tão caro que não sobra dinheiro pro jantar, motel, etc.",1,2,,2024-09-10 01:27:39,"Para ter uma experiência completa, incluindo o acesso às mensagens, é preciso comprar nossa Assinatura Premium. Nós nos esforçamos para construir uma comunidade interessante para poder gerar conexões genuínas. Como também acreditamos no poder da comunidade, se você trouxer amigos para o app, nós liberamos as suas mensagens de graça, por um período.",2024-09-10 14:47:56,False
d7a64ff7-204f-4b11-9df5-8e9d9f752fc4,Jeimes Mazza Correia Lima,https://play-lh.googleusercontent.com/a-/ALV-UjWYt32c1JApgV6_UN-NNfPN9Iuy8ajgNYs3eSfE3XXUGwgs82iS,"O atendimento do Inner Circle foi rápido e ágil, muito atenciosos e resolutivos.",5,0,5.8.1,2024-09-05 20:36:23,"Por gentileza Jeimes, nos envie um e-mail pra supportbr@theinnercircle.com para que possamos averiguar o que houve e te ajudar :)",2024-02-20 18:54:30,False
7a6301c9-1a34-4933-abcf-ff3a50991e3e,Fabiano Machado,https://play-lh.googleusercontent.com/a/ACg8ocLt4_DeLs9pHyasN8MwnRpPsMsOtwm30Is41tUpEbbqbLBkaBcL=mo,"Unfortunately we cannot do nothing with this app, everything you have to pay, and it is very expensive.",2,1,5.8,2024-09-02 18:17:28,"For the full Inner Circle experience, including messages, you must sign up for a full membership. We believe that quality is worth paying for. You can also invite your friends to the app. If approved, we'll give you access to your messages ;-)",2024-09-04 17:42:42,False
34ca17ce-c47d-4089-881d-35982dd7250c,Cristina Medeiros,https://play-lh.googleusercontent.com/a-/ALV-UjUtvq4t6nG6DFFRscSLqb_snxsfxoJVCFqZNt_XfK41jzA37vtAHg,Not really useful if you don't pay the membership plan,1,2,5.8,2024-08-30 22:07:19,"For the full Inner Circle experience, including messages, you must sign up for a full membership. We believe that quality is worth paying for. You can also invite your friends to the app. If approved, we'll give you access to your messages ;-)",2024-09-01 14:26:37,False
5f958bff-8ebf-4288-8991-761c34bb8664,daniel aviles,https://play-lh.googleusercontent.com/a/ACg8ocIcux_4Iofi4aoIixZkLxX1dhbAwkJbRbrB5qSfE-UNLKvpAQ=mo,"Ya mejoraron muchas cosas como la suscripcion basica, ya deja ver perfiles e interactuar sin pagar. solo hace falta más gente online",4,0,5.7,2024-08-26 20:14:05,"Hi Daniel, Thanks for sharing your feedback and we are happy you are enjoying our community. Have a great week ahead",2024-08-28 10:12:07,False
5aab3f30-1e1d-4605-bc31-a654dc646f69,ali mekni,https://play-lh.googleusercontent.com/a/ACg8ocIS5WVV4cvmFEc6YId26TvN_Bswaz42y2VsFqaNNw2pAATVT0Q=mo,The app stucks in the verification,1,1,5.7,2024-08-26 08:19:39,"Hi Ali! If you are experiencing troubles signing up, please send us an email at support@theinnercircle.com and we can look into it, so you can complete your registration. Have a great day",2024-08-28 10:08:00,False
8c6f7ef6-3dd3-47cd-81a7-77d1c85dc2bd,Guilherme Reinheimer,https://play-lh.googleusercontent.com/a-/ALV-UjXxlE4fadkrxo6tf1U-iAvH3m3yFqRL3ZaxX3Y_F8adw9WhUYS70g,"Ja foi bom como um app free, agora só com mensalidade",1,1,4.52.1,2024-08-25 13:32:45,"Oi, para ter uma experiência completa é preciso comprar nossa Assinatura Premium. Nós nos esforçamos para construir uma comunidade interessante para poder gerar conexões genuínas. No entanto, se você trouxer amigos para o app, nós liberamos as suas mensagens de graça, por um período, espero que entenda e qualquer coisa ficamos à disposição.",2024-08-27 17:17:56,False
60483166-20cd-4c68-a6ec-3e5fdb9d08a0,Divine_favour,https://play-lh.googleusercontent.com/a-/ALV-UjV9mu0RNXQrrcs51YJ33SJsRBvUOPhXPoikeEEmFM8cq4klKBE,Great app,4,0,5.6.2,2024-08-14 08:45:45,Hi Divine_favour! Thanks for sharing your feedback and we love that you are enjoying our community of inspiring singles! Have a great day :-),2024-08-14 13:16:17,False
26ea2915-39c2-468d-a009-e183d5cf07bd,Igor moura franco,https://play-lh.googleusercontent.com/a-/ALV-UjWHFxBMV0xivLugBLqVubokd5ma4hSoiuygtmTCCVTucjLK5-d9,"Não é um excelente custo benefício, mas tem algumas funções eficientes para encontrar pessoas com afinidades semelhantes.",4,0,5.6.2,2024-08-13 00:49:45,"Obrigada pelo feedback Igor, qualquer coisa fico à disposição para te ajudar pelo email supportbr@theinnercircle.com :)",2024-08-13 17:50:54,False
9d5a31a8-57e5-4061-a617-d5550c82b531,Larissa Gava,https://play-lh.googleusercontent.com/a/ACg8ocLLliPTIynE0kDD8RpW8hUf_Ts5pn27wjSWSv7ocQNCGWamgQ=mo,O z,4,0,5.5.1,2024-07-25 12:11:33,"Hey Larissa! We are always open to improving our dating app, so feel free to get in touch with us at support@theinercircle.co and share your thoughts :)",2024-07-26 14:45:54,False
