reviewId,userName,userImage,content,score,thumbsUp,appVersion,at,replyContent,repliedAt,scam_related
df1620d9-d57f-4832-95ed-7f741db7cbc6,Gloriana Joshua,https://play-lh.googleusercontent.com/a/ACg8ocJFnS5Ak0STY9upNVbMyf4OmMpwCbk6mlyIsw6JO4qXgYAx9w=mo,I did all I was asked to do by registering since 2 days back but I'm not able to view the dating site at all. It keeps telling me to share it to friends which I did but nothing happened.,1,1,4.26.3,2022-03-07 17:21:56,"Hi Gloriana, We'd really love to help you. Please write to support@theinnercircle.co and our team will help resolve your issue quickly.",2022-03-10 15:27:38,False
a812ddf4-87af-4714-bafd-d93c552fba18,Camilo Sandoval,https://play-lh.googleusercontent.com/a-/ALV-UjW6pjRdAYSVkgG3jEGPYhHK2bZ0TrRYxgjHM-yKWDOKaC0zFKWWUQ,"Awful, you cannot read messages if you don't pay, total waste of time",1,0,4.26.3,2022-03-02 19:59:10,"Hi Camilo, unfortunately most often the good things in life don't come for free... Why not sign up for our trial membership, and find out for yourself if this dating app is the right match for you! ;-)
",2022-03-05 10:20:02,False
1f95d6fa-f2fe-4b01-b9af-405ca460425c,Googled Up,https://play-lh.googleusercontent.com/a-/ALV-UjW3twRRfMTdqaUYYZRM7d8Wppjp00m6oxHhdXV99LynsrPg-6w,"Update March 2022. Would give it a second chance. But of course it just says 'being reviewed'. No profile yet. And then I read the reviews on here. Not sure this is a genuine dating app at all? July 2021: I gave up waiting so deleted all 9 photos as I don't want them to use my photos. (Deleted all text too). I'm a woman, live in one of UK's largest citys. Biggest regret is that I registered via LinkedIn, big regret. I'll try out Happn now.",2,9,4.26.3,2022-03-02 09:37:43,Hi Googled Up! Why not email us at support@theinnercircle.co for quick support with your account. :-),2022-03-05 10:17:30,False
318c28ff-dcd9-4da7-a5d1-0be00d6a0352,Ray Durbin,https://play-lh.googleusercontent.com/a-/ALV-UjXMvgQUfGTSg88K5m35Gl4d_wEJEtn4LJT4kLhxJ9D7WYfWwYv2,"My profile has been ""being reviewed"" for well over two years. Maybe others have had luck with this app, but I've literally been in limbo for a comically long time to even get a chance to see what this app can offer",1,4,4.26,2022-02-25 05:36:01,"Hi Ray! We'd be happy to take a look into this for you, please contact us at support@theinnercircle.co. Thank you.",2022-03-02 06:39:58,False
20df4e16-8695-419d-984c-79955fd65178,Amy Wallace,https://play-lh.googleusercontent.com/a-/ALV-UjU4ahLjqvhUY4w-BD8tkFshvTOA3LV4ahWu37lPfZ6RsPiDdBA,"I thought this app was actually all right until I discovered the only way to read any messages sent to you is to pay £40 A MONTH for it! Uh, no thanks. That's extortionate for any app let alone one that hasn't proven to be worth it yet.",1,11,4.26,2022-02-24 21:52:10,"Hi Amy! With our dating app, you know that you will get a quality dating app experience with only serious and respectful members in return.. why settle for less? ;-) You should sign up for our trail membership and see if Inner Circle is right for you.
",2022-03-02 06:36:15,False
04772681-403c-4148-a237-cf9aedf2d4d4,Andre Andriole,https://play-lh.googleusercontent.com/a/ACg8ocIOlY7vu_t9gG7gLxacKSD-FSlgz-GPijYroMtUTVenkjpF0A=mo,"notifications, u need them on for messages but the app uses it to annoy u with advertising.",1,1,4.25.2,2022-02-21 21:19:46,Hi Andre! Thanks for reaching out. You are able to adjust your notifications under Preferences. You are able to find more info on this in our FAQ's or please email us at support@theinnercircle.co and we can help you ;-),2022-03-01 17:56:08,False
f1903692-c411-426f-a29a-a0f5c8dfb5d1,Mathew Jones,https://play-lh.googleusercontent.com/a/ACg8ocKMcfg9uTosYaq4yW9koLhWpIBI4FclHoLkWqDUwPyujnxFfg=mo,Created account 3 weeks ago and still waiting for profile reviewing so have uninstalled ..,1,1,,2022-02-20 00:52:51,"Hi Mathew, we'd love to help you. Please write to support@theinnercircle.co and our team will help resolve your issue quickly.",2022-03-01 17:36:03,False
e08a479a-d330-483e-ae16-d2cf62a6b46d,Jean Michel,https://play-lh.googleusercontent.com/a/ACg8ocIBGtclEBrAnuWLShQTdSYpwQM_gEtnafti8kyhdFSuctPu_C4=mo,"They have deleted my review. People who like me dont show up, unlike other apps. I should pay a lot of money to see who liked me. It is frustrating. Bad app.",1,4,4.25.2,2022-02-20 00:19:12,Hi J Michel! We never delete reviews ;-) Why not sign up for our trial membership? Email us at support@theinnercircle.co and we can help you!,2022-03-01 17:35:43,True
92db9772-05c1-4eef-93c9-1d73db5c0aeb,Jeremy Dignan,https://play-lh.googleusercontent.com/a/ACg8ocLZHqpHDgSyIcKorKByQnFJj4ftH5LHBlYF5Iz_-cynYVFT6g=mo,Stupid cant even get out of my own profile,1,1,4.25.2,2022-02-19 01:02:52,Hi Jeremy! We are here to help you! Please do let us know at support@theinnercircle.co :-),2022-02-22 18:00:29,False
b0554815-1bb9-4ac7-99de-8949471b436f,ruirui xu,https://play-lh.googleusercontent.com/a-/ALV-UjXmTxzk31ETtKLX8gFHCyNzdaLalrBDX0xrfmOotcHnNoNmA0M,"This is the most speechless software I have ever used, I don't know why the long wait is for, If the efficiency of the review takes such a long time, it makes me question the quality of this app,",1,2,4.24,2022-02-18 19:09:52,"Hi Xuejing, Please contact us at support@theinnercircle.co and we will look into it ;-)
",2022-02-22 17:59:12,False
f6efa744-6bd5-4b49-a917-064a2594d237,Jaab Abed2,https://play-lh.googleusercontent.com/a-/ALV-UjV1Dglicg4aUmJ-45uHLUAyCprKFSxS6irFztjTeHv-42cTFO__,My old phone broke so I got a new one. I installed the App and tried to log in again. But now the app is saying that they need to review my profile agien . And I have to wait . I had that before and I waited 2 weeks to get in.why is doing that? What is the point I am already a user.,1,1,,2022-02-18 13:49:01,"Hi Abood Ali, We'd love to help you. Please write to support@theinnercircle.co and our team will help resolve your issue quickly.",2022-02-22 17:57:39,False
59e0e571-e588-4b8c-bbde-37a747d8be9c,Caio,https://play-lh.googleusercontent.com/a/ACg8ocKFzXNRPqGX9dSnD5GzPfgZohKjwdORtQgyLi5pwQnnz6GFskBz=mo,"The app itself is quite good, with several fields to personalize your profile, but you can only read messages if you become a premium user (be it paying or inviting two other people), what difficults communication (and consequently the use of the app) a lot; the nice plus is that you can message other members for free even before a match. It also lacks a field where you can select if you want short or long term dating or hookups, so you can't filter for only people that want the same as you.",3,105,4.25.2,2022-02-18 00:48:44,"Dear Caio, We really appreciate your feedback. We will consider it and improve our app in the new version. If you have any other questions or suggestions please contact us at support@theinnercircle.co :-)",2022-02-22 17:51:22,False
df75f835-b9d8-4161-a15e-4a9c3fd04990,Amit chakraborty,https://play-lh.googleusercontent.com/a-/ALV-UjWPbq2TPf9hloS3VhEYwkWSM8ABCm2sJ1z5XpAmlT4uYlsKyVU99w,Bad experience,1,0,4.25,2022-02-17 20:40:30,Hi Amit! Please share your issue with us at support@theinnercircle.co and we will look into it at the earliest :-),2022-02-21 19:21:45,False
130004a6-2f0a-452d-b661-51e180473323,Neetu Paul,https://play-lh.googleusercontent.com/a/ACg8ocKVcFKdGomQE96imB_2m02mjbDGHsVKDjqZWorFCK32viLBrg=mo,"1.Too long registration. 2.Once you fully register only to result not being able to read messages,reply or see likes .Once to unlock messages the app ask to either purchase monthly or recommend 2x friends to unlock messages ,to message and see likes. Again long winded and I have no friends to register and nor can I afford to pay monthly charges. 3. disappointing . Pros. Decent men and of good career",2,11,4.25.2,2022-02-17 16:57:52,"Hi Neetu! Thanks for sharing your feedback, as we are always looking to improve. We will be sure to pass this along to our product team for future improvements.
",2022-02-21 19:20:55,False
a70aa47f-5fd6-49bf-8a8f-5523c622f93e,Estelle Patrick,https://play-lh.googleusercontent.com/a/ACg8ocIzK_8aAr8lv5-lAVcAnht4SJ4_u9ivxEs-KiOW8fcnS6-OTg=mo,Dreadful! Second time posting a review seems the first was removed... this app does not allow in-app calls meaning you have to give your number to a stranger prior to talking. There is also no remit for safe and responsive dating. Most users who contacted me were crass in their language without being invited to do so. Do not download and be fooled that people on this app are responsible professionals...seems to be no vetting or reporting on individuals.,1,5,4.25.2,2022-02-17 13:52:26,"Hi Estelle! We really hate to hear that you have not had a great experience till now on our dating app. Please send us an email directly at support@theinnercircle.co so we can help to improve this for you :-)
",2022-02-21 19:18:31,False
a4fd3cf6-79f1-451d-a66f-c3eea7b87486,bonita holiday,https://play-lh.googleusercontent.com/a-/ALV-UjULkpB2J3nitks2We1AflKUiW3sZ_WwdCEHlCO_0vwN0dfi4Zg,Useless really. It is a joke,1,1,4.25.2,2022-02-17 13:23:51,"Hey Bonita! We are always open to improving our dating app, so feel free to get in touch with us at support@theinercircle.co and share your thoughts :)",2022-02-21 19:13:38,False
56c4b7f1-5632-4a86-9408-5fa5686077b1,Enzo Foschini,https://play-lh.googleusercontent.com/a-/ALV-UjW89kXn03_wbgnJCyMICFgE8mW0HkgXqYqNWIvAiMCUdEHNlq5S,"It takes toooo long, probably weeks, to verify your profile and let you start using the app, even though I created my account few days ago.",1,1,4.24,2022-02-15 13:53:00,"Hi Enzo, we'd love to help you. Please write to support@theinnercircle.co and our team will help resolve your issue quickly.",2022-02-20 18:50:47,False
79adeb93-c934-447f-9509-e91a678c797e,Peter SOOKRA,https://play-lh.googleusercontent.com/a/ACg8ocIJVYPhIkNl2ibVBTke8XC66vQbhQMe8WfGqA4KUoYet8dLJvab=mo,Worst App ! They never reviewed my account and accepted! Firstly I signed up with Facebook I was waiting nothing so then I removed the app reinstall it and signed up with LinkedIn still waiting I give up Uninstall and removed!,1,0,,2022-02-14 10:36:47,"Hi PS, we'd love to help you. Please write to support@theinnercircle.co and our team will help resolve your issue quickly.",2022-02-20 18:39:14,False
b1bd08b1-15aa-4ba0-a6ed-30797da75b68,Rebecca Salles,https://play-lh.googleusercontent.com/a-/ALV-UjUikXY63g0sY0x8SF_66fXsd60JY40cBlgEJWnurC5wnKAg-4ZAuQ,"O app é bom, mas está com um bug para fazer upload de novas fotos pelo google photos depois de remover uma foto anterior. Da galeria do photos, vai para a página inicial e fica em looping, sem salvar a nova foto adicionada.",4,0,4.25,2022-02-12 04:32:46,"Hi Rebecca, please contact us at support@theinnercircle.co and we will look into it for you :-)
",2022-02-20 18:24:09,False
198222ce-de29-43d4-ad5c-e54c845e20ef,Nicole Elisabeth Smit,https://play-lh.googleusercontent.com/a-/ALV-UjVii2i6yj5hcZ4dptYWUFVSlVAJ6DUQrxc7HVwazKCMJcaBJjH4iw,Best dating app out there 🤙,5,0,4.25,2022-02-10 14:19:47,"Hi Nicole! We are super pleased that you are enjoying our dating app. If there is anything we can do for you, just let us know at support@theinnercircle.co!
Have a wonderful day!",2022-02-20 18:11:17,False
7145f20b-ec4c-4d94-8107-64a04f8e8a08,Nana Boah,https://play-lh.googleusercontent.com/a-/ALV-UjVo4XgEsPPHIYW_o_c3n9FcpKLz70G6_YgQ403oXciu1BH5B169,Best dating app I ever meet in my life,5,0,,2022-02-08 16:43:54,Hi Nana! You make our day! :-D We love that you love our dating app and we hope that you find what you are looking for on Inner Circle.,2022-02-17 18:30:51,False
0e125a4c-3c5c-44f5-b44e-fd40fabca342,Syed Ghazanfer Rabbani,https://play-lh.googleusercontent.com/a-/ALV-UjWrZMLFy2wTozpy_efp3BdfmYfJAv_k33C5r8yrthcXcqLncaSKzg,Does not delete my data even after I remove my account and the app gives a confirmation message saying all user data is permanently deleted. It is illegal to store user data without consent. This app is most likely selling user data and making money off of it. Reporting it now.,1,0,4.13,2022-02-08 04:08:34,"Hi Syed! We never sell any data and are in compliance with GDPR. If you need any help with this, please email us at support@theinnercircle.co and we will be in touch :-)",2022-02-17 17:39:10,True
d0094670-7d4e-4d64-87d1-42e3038e0cd2,Luca Gentile (Cyclorbit),https://play-lh.googleusercontent.com/a-/ALV-UjVxAKXqx-MUzRC0QZEi7kKczT2a1Th_RhRWtwO0NWJUP64qb-YIxQ,"Nobody nearby (in Italy). It also suggests you to send a message before even matching, why should one waste so much time?",2,2,4.24,2022-02-05 07:49:31,"Hi Luca, To help you with this, we would like to know your feedback in detail. Kindly write to us at support@theinnercircle.co. We will help you at the earliest :-)",2022-02-09 15:05:35,False
ff352183-f99f-4f9d-ac90-06cd99da37d2,sammy mont,https://play-lh.googleusercontent.com/a/ACg8ocKPa6JooRwyup0A6JLf6x2cUnFEZ9hNaM6o-jRR8SvbvT3xsQ=mo,i love inner circle you made for dateing,5,0,4.24,2022-02-01 03:02:39,"Hi Sammy! Thanks for your love. If you have any questions, please contact us at support@theinnercircle.co :-)",2022-02-02 10:02:12,False
acab889c-6d51-4d3f-935c-ca98838addcf,David Morris,https://play-lh.googleusercontent.com/a/ACg8ocK7poED6_DmA0jGN92Qpsw5Oowv4Xt7RJg6v8nBuHpMB0U-dw=mo,I downloaded and paid for one month to use the app. It kept crashing. The filters do not work. No matter how you set the filters the algorithm overrides your settings. I had a very bad experience. Avoid it.,1,3,,2022-01-31 19:13:38,"Hi David, We are extremely sorry to hear this. To help, we would like to know your feedback in detail. Kindly write to us at support@theinnercircle.co. We will help you with your account :-)",2022-02-01 06:40:03,False
2a1b0494-4798-4bf4-9824-853465652aca,Ghost,https://play-lh.googleusercontent.com/a-/ALV-UjU4W84k69a04DJwWzhRhEJ3TCeJpJwOUCDHZ36_P0jmL14W5Z5z3Q,"Precisa pagar para ler as mensagens, horrível !",1,0,,2022-01-28 22:38:16,"Hi BrJaguar! Did you know that members can have access to their messages for free simply inviting a couple of their single friends to join? Why not sign up for our trial membership? You can reach us at supportbr@theinnercircle.co and we will be in touch ;-)
",2022-01-30 17:24:34,False
01e35bcc-4550-4882-960f-39bea51e95f4,Luciana S B,https://play-lh.googleusercontent.com/a/ACg8ocJUltAMxt8PJ2vUHmKVqL32xlYIlx2jsf3daV35FchkLJN1dg=mo,Precisei de suporte para alterar o login e tive um bom atendimento da Vitória! Obrigada!,4,0,4.24,2022-01-28 20:39:31,Hi Luciana! We are thrilled to hear that your issue has been resolved! We hope that you will have some super exciting dates ahead :-),2022-01-30 17:34:18,False
32a7a40e-1868-4e84-b395-2bf99d072f55,Ayma Kiya,https://play-lh.googleusercontent.com/a/ACg8ocLsk5fNKXkzVK5njaWPu4P87386EWF6fuQl5wBQs3RlRo_n7A=mo,Very good,5,0,4.24,2022-01-28 04:21:48,"Hi Ayma! Thanks for sharing! We really hope that you continue to enjoy our dating app and have some exciting dates! If you have any feedback or suggestions, please write to us at support@theinnercircle.co. We would love to hear from you!",2022-01-28 07:17:21,False
cd739ccb-979e-4441-beea-ff3c608595af,Blaise Njie,https://play-lh.googleusercontent.com/a-/ALV-UjWQdxzHVVs-2zqvsRrWvI08O_5qDOu9qL7kIRLnpc7m23nJ3Lc9,Well I download this app but if anytime i want to register it just block my account after review it and i have follow your term and condition.,1,1,4.24,2022-01-27 13:59:08,"Hi Blaise, please contact us at support@theinnercircle.co so we can further assist you.",2022-01-27 14:00:35,False
eb55ec97-9232-4fd0-998a-56c2e0d9c334,Dickon Walker,https://play-lh.googleusercontent.com/a-/ALV-UjVLayu7PS39rWF-0AC_UX9nz0n7Gf6jn9OOF05jr884NNmm-aSD,"Plenty of fake profiles, as with all the apps. Also promoting the vaccine cull agenda. Otherwise it works well.",3,1,4.24,2022-01-27 09:12:56,"Hi Dickson! Thanks for sharing your thoughts, we will certainly take your feedback into consideration. If there is anything else that you would like to share, please email us at support@theinnercircle.co :-)",2022-01-27 13:58:22,True
6d39da6c-c899-43b3-a57a-b888c89a23c9,Brian,https://play-lh.googleusercontent.com/a-/ALV-UjUq6_I5P-cIXWISbv4FtfJY6N90HmLUxmt8KYNF9NBJE2jsa4yi,"Been signed up since Jan 5th and so far not been approved. Support recommended me to delete my account, outside of that Ive been told I was on a waiting list, but not how long the wait is, not even an average. Support has since ingored any other messages from me. Recommending me contact support doesnt work if support doesnt respond, or their suggestions are to not use your service... All i wanted to know was the average wait time.",1,18,4.24,2022-01-25 18:58:50,Hi Brian! You are currently on the waiting list and we cannot tell you anything about time-frames at this point unfortunately. As soon as your application has been released you will receive a welcome email ;-) Have a great day,2022-01-27 13:49:29,False
2bd7b893-c0f1-4f47-a36a-16068a369e83,richard,https://play-lh.googleusercontent.com/a/ACg8ocK2cN1HV3-G6Mhe5depzgpSS-SOB7tdHeFi_IlfND435G1BdQ=mo,"One of the better apps, in terms of features offered to narrow down that search.",4,0,4.24,2022-01-24 20:07:43,Hi Richard! Great to hear that you are happy with our search preferences feature! We hope that you will enjoy exploring our dating app and find your best match very soon :-),2022-01-27 13:41:14,False
46c86139-4509-467d-a101-6f6cc2e67e5e,Shamica Spencer,https://play-lh.googleusercontent.com/a-/ALV-UjVKnx_2zwE1ep85C43e3YK-U_F9VQahjV8tZgQBEXOuEefEdvNK,My profile has been in review for over a year. I just updated it again and I'm still in review. I'm going to just delete this app.,1,0,4.24,2022-01-23 21:17:08,"Hi Shamica! If you need help with anything, please do not hesitate to contact us at support@theinnercircle.co and we will check on your registration for you right away ;-)",2022-01-27 13:36:30,False
93b4bcee-a6b0-4429-8770-fbdc57ea792b,Bridget Olivet,https://play-lh.googleusercontent.com/a-/ALV-UjW9mabmIfqQ4-BOMZ4VPKK-E-t68qZgncGcJEpFzyyB14YPdAtB,It takes forever to be varified,5,0,4.24,2022-01-23 19:21:51,Hi Bridget! Please email us at support@theinnercircle.co for help with your registration ;-),2022-01-27 13:35:34,False
82391d9d-1a9b-4d27-839e-fb383271f172,grimmjow13,https://play-lh.googleusercontent.com/a-/ALV-UjV7gdYhSMc3sPnl87XWiZQ2arRoOIBhzuTAjf4F-xL90HAJvFY,"Created my account 1 month ago and it is still ""being reviewed"", so completely useless app so far...",1,1,4.24,2022-01-23 05:57:27,"Hi grimmjow13, We'd love to help you. Please write to support@theinnercircle.co and our team will help resolve your issue quickly :-)",2022-01-27 13:31:52,False
6b6b6a63-87ab-4fc4-bc02-98c6bfb14fcb,Rihanah Remy,https://play-lh.googleusercontent.com/a-/ALV-UjWm9H3XuPF7an1qpaRr4DaMsespxkWCXkuMK1y1Kx9YJ4-Wdi4e,not bad,5,0,4.24,2022-01-21 21:26:23,Hi Rihanah! We are thrilled that you are enjoying your experience on our dating app :-),2022-01-25 13:18:52,False
4a372a16-2a25-4548-8103-cd4f93282412,abdalah alzenati,https://play-lh.googleusercontent.com/a-/ALV-UjV-gqrbw9gaCz7wCvdngkN3WTiHqoFcLTQDOxA9Qstp_xkb2zL0,search should be expanded to include all countries!,3,0,4.24,2022-01-20 16:43:44,"Hi Abdalah! Thanks for sharing your feedback with us. You are actually able to search by country on the app by going to Search Preferences- Preferences: Country. If you need more help with this, please send us an email at support@theinnercircle.co and we can help to walk you through it ;-)",2022-01-25 13:11:00,False
7ba83b54-ea75-4928-b0c7-354534a19869,Roger,https://play-lh.googleusercontent.com/a-/ALV-UjWhShdADJ312NzwxZRQjjCejjsk8RoGtWgQhOk69VJsossAsxencA,The app is a sham. I have canceled my subscription and I am really aware that I chose to stop renewing subscription. Yet after months they have taken money from my credit card and extended my membership for another 6 months without my consent. I demand my money to be returned back to my account.,1,2,4.24,2022-01-20 02:12:05,Hi Roger! This doesn't seem right. We want to take a closer look at this for you. Please send a note to support@theinnercircle.co so we can connect directly :-),2022-01-20 15:43:20,True
598bc200-89b4-4f1c-87fb-d31992c6a012,Amanda Gril,https://play-lh.googleusercontent.com/a-/ALV-UjUeUlMQnuO4cqWB9X40atqVxh9UypJn1d74ntDX8FV8kCkQeuw,"Cool app! Simple, easy to use, interesting people and very responsive customer service. One thing though - there are not enough cities listed in the preferences 'where are you from'. But still, thums up.",5,5,4.24,2022-01-18 14:15:01,"Oi Amanda! No momento, nosso app está oficialmente lançado apenas nas cidades que aparecem nele. Felizmente estamos crescendo rápido e pretendemos abrir em mais cidades em breve. Você pode usar os recursos ""Perto de você"" ou ""Quem topa..."" para encontrar pessoas que estejam na sua área ;-)",2022-01-19 14:24:58,False
aa33c0ba-83f4-49a2-9715-25a5e8fb9ced,Malika Oubilla,https://play-lh.googleusercontent.com/a-/ALV-UjULMJdJxfAe03i7njPgCwwCA4XlBBVn4BECfUGu1fvVzs-fAszy,Totally useless! You can't read messages unless you get premium plan. Why wasn't I noticed before bothering to create the account and all? + No matches.,1,3,4.24,2022-01-14 21:34:30,"Hi Malika! With our dating app, you know that you will get a quality dating app experience with only serious and respectful members in return.. why settle for less? ;-) You should sign up for our trail membership and see if Inner Circle is right for you.
",2022-01-19 14:08:04,False
cc3e0d75-1b59-4358-96b5-fe3f360d3ea8,Michael De Santa,https://play-lh.googleusercontent.com/a-/ALV-UjVADJeFPpYNh8JmSOiYaKI3Tkfz4hlxbnrEv9DliqHJ5xG2_pg,"Terrible! I can't understand why there are ads for the app on various social networks, there are so many that you end up giving in and creating an account. And then after customizing your profile with photos and descriptions, the app simply puts you on hold... I sent an email asking for clarification on how long that would be, and believe it or not, they even suggest deleting your profile if you want... Congratulations on this disastrous project 👏👏👏👏",1,12,4.24,2022-01-11 12:45:19,"Hi Michael! It sounds like you are just on our waiting list ;-) If you need more assistance in regards to your account, please drop us a line at support@theinnercircle.co and we will be in touch.
",2022-01-13 18:42:39,False
05fde329-9105-49e9-9695-64baa4770528,David Rouse,https://play-lh.googleusercontent.com/a/ACg8ocI81BuclDWwEHM0gUlgR_WUsbtUBn0ZsQKU4_WyZTO6ZzXHNg=mo,"I just u installed this app, because I couldn't log back in, and I wanted to skip the inviting my friends, and there is no way to get around it. Terrible app.",1,0,,2022-01-09 19:07:01,Hi David! We are happy to check on the details of this for you. Please message us directly at support@theinnercircle.co :-),2022-01-13 17:06:31,False
5c0cbed3-a232-4d89-b9a8-ad22765490dd,SAM . O A,https://play-lh.googleusercontent.com/a-/ALV-UjUBaoW3QF-ZXFisi419C6rMIzxFpy2lp7S3amBst5ZfaaAvbLFZHA,"No such thing as a perfect dating app, but there are loads of terrible dating apps and Inner Circle is one of them. The developers or whoever is responsible for marketing the app should really be honest and go back to the drawing board. It should never take a few hours to verify or confirm a profile and for that reason I am out. I'd advise you not to waste your time with this one.",1,3,,2022-01-09 18:17:23,"Hi Sam! You are currently on our waiting list ;-) If you would like us to check on it for you, please send us an email directly at support@theinnercircle.co and we will be back in touch.",2022-01-13 17:05:17,False
19f2e237-1718-4cf8-a2be-46e30557e22e,Gabriel Jean Renaud Vitória,https://play-lh.googleusercontent.com/a-/ALV-UjUhre44zbSrCSx3l7ppgxm1GjAKlsByMvn1DmeIsJoUESUFcwDGLA,Sem retorno do review.,1,0,4.24,2022-01-08 02:19:17,Hi Gabriel! We would like to check on this for you :-) Please send us a message at support@theinnercircle.co so we can look into your registration!,2022-01-13 16:21:22,False
a022a24a-bb11-4479-8a30-65d092ae93a5,Cristian Baltazar,https://play-lh.googleusercontent.com/a-/ALV-UjULAPma_HVD7mR_bV4578GIEuxXtj686cHbhTGXkNWThmD9WGmQLw,4 months waiting my profile approval and still waiting...,1,0,4.24,2022-01-06 21:23:30,"Hi Cristian, We'd really love to help you. Please write to support@theinnercircle.co and our team will help you with your registration ;-)",2022-01-13 15:59:08,False
14f0f238-db7e-410f-a6a0-cb44e89180d9,FERGUSON FERGUSON,https://play-lh.googleusercontent.com/a/ACg8ocKLKBZIJn1ocYog2MmPwWR0Dp9ebHZNi24DSPcJxwfqk05qrQ=mo,Nonsense I heat dis app,2,0,,2022-01-06 20:59:49,"Hi Ferguson! Please let us know what we can do to improve. Drop us an email at support@theinnercircle.co and we will definitely try to resolve the issue for you, so you can meet your match ;-)",2022-01-13 15:57:53,False
b15f852d-68c4-4603-876a-18834c644f0d,Nicolas Hiribarne,https://play-lh.googleusercontent.com/a-/ALV-UjUBDI-TcvOCVBeYUHUx4BhNU4OBmnYdVw8KLWzBH3c91s1juvkQ,This app can make the difference that you're waiting for. Stop to lose time and jump!,5,0,4.24,2022-01-05 09:17:52,"Hi Nicolas! We are super thrilled that you enjoyed our dating app. If there is anything we can do for you, just let us know at support@theinnercircle.co! Have a wonderful day! :-)",2022-01-07 18:02:35,False
579448a1-3f6b-4295-ad2e-b67e8778e835,Anderson Thomas,https://play-lh.googleusercontent.com/a/ACg8ocKVEmEk0AEF-3B8esfdTuAKzXlzRGCExxxlGMEG_Tsjsl0xkQ=mo,Crazy App,1,0,4.24,2022-01-05 04:30:19,Hi Anderson! We are really sad to hear this. Can you please share detailed feedback about the app at support@theinnercircle.co. We assure you that we are working really hard to provide you the best of experience when it comes to dating! ;-),2022-01-07 18:01:35,False
