reviewId,userName,userImage,content,score,thumbsUp,appVersion,at,replyContent,repliedAt,scam_related
cd101eeb-2c2f-4a55-96f7-955c89988139,E,https://play-lh.googleusercontent.com/a/ACg8ocKpns03HxGrJ6ynysud_n0uabchwCqwVtmupjd6sv-3o8Cv_g=mo,"You have to pay £40 to see the app full of bots, and you can't even message without paying. There is a strong feeling of bots to indulge you to pay £40 to message someone. But once you pay, you get no more matches and no one replies to you. Also swipped all of London in 2 minutes. Don't waste your money here. It might feel it's worth it, but it's not.",1,15,4.49.2,2023-05-08 14:19:03,"Hi E, We're always open to feedback and improving our dating app. Please feel free to share your thoughts with us at support@theinnercircle.co and we will look into it for you",2023-05-09 10:27:49,True
ab27bb73-79a9-4f6a-9bbe-82e396a5a4f4,San,https://play-lh.googleusercontent.com/a/ACg8ocIQOjSdLdyR2yg16njCF1GCxJPlObf4C-qV-oxTCvN8HWwS9S0=mo,"This app is horrible!! It freezes and crashes frequently. There is no ""Return"" button to end a sentence and jump to a new line in the descriptions. There is no way to add a past trip. No way to enlarge the ""About me"" window to see the whole text (one can only see two lines at a time). And many other glitches. Slow, unsteady. I'd much rather keep the website version, much more functional and reliable.",1,22,4.49.2,2023-05-06 22:40:03,"Hi San, We're always open to feedback and improving our dating app. Please feel free to share your thoughts with us at support@theinnercircle.co and we will look into it for you",2023-05-09 10:21:06,False
0c2e99e9-2cce-42e0-9518-33d3218834c6,Tomas Agustin Podesta,https://play-lh.googleusercontent.com/a/ACg8ocJXQGemzyHtztY9AU2Zih9ROxcHCzxX_mBDDo4O2_Lm3wJPHg=mo,"Doesnt confirm my identity, so its the same as an app not working entirely.",1,0,,2023-05-04 13:04:09,"Hi Tomas, could you please contact us at support@theinnercircle.co and we'll check on this.",2023-05-04 10:01:53,False
790692ca-6bf4-4bba-a6b6-2bdfec380717,Daniel Mauricio Daza Borja,https://play-lh.googleusercontent.com/a-/ALV-UjUI7yyd3PYITfC9-jzE-lLaOhQadUBtyRnPePj3LDZxVMHIP_jBJg,"I don't understand why they have to charge money for everything, for every detail, it's disgusting and boring",1,0,4.49.2,2023-05-04 01:56:54,Hi Daniel! Did you know that members can have access to their messages for free simply inviting a couple of their single friends to join? Why not sign up for our trial membership? You can reach at support@theinnercircle.co and we will be in touch ;-),2023-06-03 16:34:35,True
0564ee99-7e74-4918-8b9b-ab70d9f2358a,Ricardo Lima,https://play-lh.googleusercontent.com/a-/ALV-UjXOwYYpg5Yhq9Pz0Exd0D_xKFeOX8-WtWBt4bbH44hQ-Fyw6FJEjA,to expensive,3,0,4.49.1,2023-05-03 04:19:16,"Obrigada pelo feedback, sabia que se você convidar dois amigos para o app você ganha acesso gratuito e ilimitado às mensagens? Qualquer coisa fico à disposição para te ajudar pelo email supportbr@theinnercircle.com :)",2023-05-05 06:06:27,False
750454bd-1a27-4422-9efe-d01d461a59d3,Ricardo Freitas,https://play-lh.googleusercontent.com/a-/ALV-UjUIj7OwRkKa7bZemgJzqDiY0cP6iLhDcomEYhnroK9-BEP2d80,"I understand that they need to make money but without a subscription you can essentially do nothing (e.g. Read a message). I have already paid for the subscription, even though it was quite pricey but then I noticed how buggy and slow the message section 8s at times.",1,11,4.46.1,2023-04-30 21:40:13,,,True
97b2e25f-cad6-4aa9-aa2e-bcfc2238c6c4,Sam Cobb,https://play-lh.googleusercontent.com/a-/ALV-UjVzXxD6TbAQNA2zxZi-vU3u5NawBS1yz2yyjgptJeVAuehynxIIIw,"Says it will only let you create an account via Facebook or Linked In, when you go onto the app or website there is only Facebook, which I'm not on. I've sent 3 emails to customer services to ask how to create an account, they can't seem to offer any solution. Very disappointing 😞",1,6,4.48,2023-04-27 22:35:56,,,False
52a1a3b1-47af-4b70-9479-7ece66d15e86,sveto snikov,https://play-lh.googleusercontent.com/a/ACg8ocJdNKq0bzvOdmnRgNt9jAEf_5ZEFoCq00u_y09pIVy-0n_ZtQ=mo,The profile verification takes a long while as if they are granting you access to eden.. Rubbish,1,0,,2023-04-24 05:10:48,Hey Sveto! Please send us a message at support@theinnercircle.co so that we can look into this for you.,2023-04-28 10:48:14,False
cc8a6a5d-5452-4ba4-aa5e-11e36f1820c6,Morag Campbell,https://play-lh.googleusercontent.com/a/ACg8ocIJ0r6caxCydFMFVLcZZJH8R5yE5tL5Kw3Z9UwFqh-5Ti50Jw=mo,"There is no option to create an account, you can either log in with Facebook or LinkedIn. I tried logging in using LinkedIn, but it gives me an error message saying ""Sign in with LinkedIn is only available to existing members. Please create an account using a different sign up method"". It doesn't give you any option to create an account, so I have no idea how I'm supposed to do that.",1,2,4.48,2023-04-21 17:10:00,Hey Morag! We're always here to support you :) Please send us a message at support@theinnercircle.co and we will be in touch. You should have an option to create an account through your phone number!,2023-04-28 10:30:42,False
e4f2798d-caeb-46e0-b6a8-5b9a417c208f,Pepeijndhoven,https://play-lh.googleusercontent.com/a-/ALV-UjV_OZs8d3c3-ahb1ADq7mWC3oMAB4l8dJMpuQ9Cs6DUvHoKNynU,My accout is not getting Reviewed,1,0,4.48,2023-04-18 09:51:35,"Hey Pepeijndhove, we are sorry to hear this! Please e-mail us at support@theinnercircle.co and we will look into it for you. :)",2023-04-28 10:17:36,False
1bff352c-428b-4e47-8bf8-67afda49474e,Anggrae ningrum,https://play-lh.googleusercontent.com/a-/ALV-UjX32JP6OfBmB-FoRhQvEDk_o3-NZIeSRjx1pw28GDos35mB1X3kQg,To much term,1,0,,2023-04-11 11:38:23,,,False
2963bdca-cc59-48ef-92b0-378aa88e9e0e,Alisson Faria,https://play-lh.googleusercontent.com/a-/ALV-UjWBuPYmHOg3Wh7o7yJXMWqo0HjjZxZM0VT9xk1L7e0WP5yEP5RY,"This app shouldn't allow users to choose the city they want as their location, they lie about where they live just to get matches from the big cities (all the ones doing that live in the countryside). On top of that, the public using this app is too picky and go after rich people, the app's criteria to accept new members only contributes to that.",3,11,4.48,2023-04-11 03:05:07,"Obrigada pelo feedback e lamento por isso, estamos ainda em expansão no Brasil e em breve estaremos em sua cidade. Qualquer coisa fico à disposição para te ajudar pelo email supportbr@theinnercircle.com :)
",2023-04-14 06:49:53,False
2d205a2f-0372-4f45-aac7-5e0313c969ab,Nikhil Damani,https://play-lh.googleusercontent.com/a-/ALV-UjUxk3SwGKYeVvQdrX3cSN10Bzq7INRAd9qS4QEuSIa4rp6pHm4Wvg,"They won't even sign you up, and there is no support that knows what they are doing. I've emailed multiple times (so don't reply telling me too...) And from the comments I've read, I am not going to be ripped off for no connections. I highly recommend Hinge to everyone, they have gotten it right. And I hope this developer puts greed aside, perhaps they will grow.",1,1,4.48,2023-04-09 07:45:11,,,False
2d732871-0c39-410c-ab4a-1017a1e42e55,张韬武ZhangXNoir,https://play-lh.googleusercontent.com/a-/ALV-UjUwXD3j5Po49YGY8WrSx2Fr50rO-efvNDKLaAJNUt-n8QlRhnP5,8 MONTHS LATER I'M STILL NOT APPROVED. 0/5 stars. Garbage app,1,0,4.48,2023-04-08 11:37:18,Hi there! We are very sorry to keep you waiting! Sounds like your registration is currently on our waiting list. Please shoot us an email at support@theinnercircle.co so we can look up your account and you can get started with going on some great dates! ;-),2022-09-13 15:44:34,False
8bbd6511-2f47-4ff9-b188-175c73b007bd,Sophie Hirschfelder,https://play-lh.googleusercontent.com/a-/ALV-UjUZ9mr2vBE9phIaMd0OBO-KCnwGHoTkDdr2Px52MC7OAVcqG7LtUA,"App is working well, happy with it. Had a problem and they resolved it really quick!",4,1,4.48,2023-04-08 03:39:28,"Hi Sophie, could you please contact us at support@theinnercircle.co and we'll check on this.",2023-04-03 10:01:14,False
d2a97ea5-9114-45de-9acc-309d61ad6bc5,Daniel dans,https://play-lh.googleusercontent.com/a/ACg8ocKme863yIc0GKaQpAnpTGP1xdyBw4vZxL_gcQHhkN55tN4b0Q=mo,Why is it taking so long to get approved Have been waiting for the longest time,1,0,,2023-04-06 07:27:52,"Hi Daniel, Can you please contact us at support@theinnercircle.co and we will look into it :-)",2023-04-26 13:21:01,False
ba0b8946-7188-4969-991a-e3b93874cb32,Mauri Kassick,https://play-lh.googleusercontent.com/a-/ALV-UjXpt9ZCTcCEsbrjns-4m2doys7_qZrqVv78VvPDyVbbUV39Z1mRPg,"The ""Facetec AI"" recognition thing is downright creepy - dating app should NEVER have this. Also, it's quite buggy. Uninstall and save yourself a lot of hassle: who's to say your picture isn't being stored overseas for nefarious purposes?",1,4,4.47.1,2023-04-04 21:33:06,"Por gentileza Mauri, entre em contato conosco pelo e-mail supportbr@theinnercircle.com, assim conseguimos averiguar o ocorrido e te ajudar da melhor forma!
",2023-04-08 00:01:02,False
77c8529d-72b3-4876-a0b5-d00a807895c6,Martin George,https://play-lh.googleusercontent.com/a-/ALV-UjUl8VoZa2ffY68dpWA4NvdofMHiJ_S3-NOwzM1ctTEQWqmrHMo,nice app,5,0,4.48,2023-04-02 20:36:59,Hi Martin! That's great to hear and hopefully you will meet wonderful people on our dating app 😍,2023-04-03 10:00:30,False
76309ecb-f8d6-4215-98d0-b201d872188e,J W,https://play-lh.googleusercontent.com/a-/ALV-UjVt8fae5dNUQdxRIw6mU55LBoQvFQJUJkr7nkL-vty3tpzWQNZH,"Slow and clunky, the slowest and most difficult to use dating app I've tried. So so bad!",1,2,4.48,2023-04-02 15:08:39,"Hi, We're always open to feedback and improving our dating app. Please feel free to share your thoughts with us at support@theinnercircle.co and we will look into it for you.",2023-04-03 10:02:28,False
04c8042a-141b-4ec6-9f57-3e0ba3f048ab,Massoud Rostami,https://play-lh.googleusercontent.com/a/ACg8ocJFzcGK-Wb2FEbl7LoLeDgjE1wk2XqS-GwRZhMAS4JfrvcH07E=mo,"I was just approved to be able to use the app and for the people who download dating apps and say they are all the same,this app app is a must have app for people who are interested in dating apps and use them.",5,0,4.48,2023-04-02 01:08:58,Hi Massoud! We're super happy that you are happy and we hope that you'll soon find your true love on our dating app :),2023-04-03 10:03:14,False
2115626a-d6ad-4c57-bdaa-2d444000803d,douglas mccambridge,https://play-lh.googleusercontent.com/a/ACg8ocIeODQgtJomHXJ8-vcEREyZ83mPTBA-5iqeZOUoOopz46_OqA=mo,"Still waiting for approval, what a joke! Emailed like I was told to but yet magically a waiting list, clearly ur verification system needs improvements Sorry to keep you waiting and I am happy to inform that you have successfully registered and that you are on the waiting-list. Unfortunately, we cannot go in detail for individual applications, but once your application is released you will receive a notification email. However, if you wish to delete your application, you can do",1,8,4.48,2023-03-31 22:56:57,"Hello Douglas, Please contact us at support@theinnercircle.com so that we can locate your profile in our system and resolve the situation for you.",2023-03-31 14:03:35,False
7d38382b-144c-46a5-96f8-f5354c86af95,mijhael castro civiero,https://play-lh.googleusercontent.com/a-/ALV-UjUzM_CL4ATlRAhJltvNYtg9QdUNLM9YkWTjzvG5CbJ_xuSwY4xK,You have to pay for everything and people on this app are looking for Instagram followers,1,0,4.47.1,2023-03-25 01:21:19,"Hi Mijhael, We're sorry to hear this. We are always open to feedback and continuously improving our app so if you have any other suggestions please feel free to send us a message at support@theinnercircle.co.",2023-03-28 13:14:23,False
70b61046-ce5b-42f6-9efb-1983b7b02c75,erley zim,https://play-lh.googleusercontent.com/a-/ALV-UjXxc8UdnIwZVz8K5kVjczu1kykCHtgtPOTFVCskrqxH3MOjpvBj,Nao cheguei a usar,2,0,4.47.1,2023-03-24 08:30:04,,,False
fd7ae8cf-38a1-486d-aa24-3b919136d4e6,T V,https://play-lh.googleusercontent.com/a/ACg8ocKjHpL0i03wjNwa_3zGlRTmfIeyU5ZV_eogz01Xje6qu6t_Iw=mo,They gave me a free 2 month subscription after I complained. It was even worse. I could message extensivley but never got an answer. Women post their instagram so you can message them there. Bad system. And they recall you argued with some crazy girl some three years ago on anotjer app. Socially irresponsible. Thats black and white. And I will likely get punished for this post. 1984!!,1,1,4.40,2023-03-21 20:22:59,Hi V T! Why not email us at support@theinnercircle.co for quick support with your account. :-),2022-12-29 17:08:05,False
04198c1b-4a4c-4d55-b1f3-c91f8e84a092,shaid islam official,https://play-lh.googleusercontent.com/a-/ALV-UjUrV9Xpw-ZD3PS2aIj_qviNQmvML4kB3yfOGLkedp-Tj4a6uCW6,Bangladesh ads pls,5,0,,2023-03-20 15:16:06,,,False
463e7fe3-2a6f-4e5e-b02d-80b7d7e445f1,Elliz,https://play-lh.googleusercontent.com/a/ACg8ocLZSjLRUwUJe7CSiHYwsgGNYNKEIx3lHWDgbr9cx7K_hnbaPw=mo,"They want you to pay 40€ for a month of membership but there are not many profiles. Way too few free options! Its like they want all users to pay, but they forget that most of women don't need to pay to date... still paying just to have access to so little profile it's not worth it! I could consider having a membership if it was less that 5€... like Amazon prime",1,7,,2023-03-19 20:11:43,Hi! We are sorry to hear this. Reach us at support@theinnercircle.co and we can help you with a trial membership and you can see for yourself if our dating app is right for you! Your match may be just around the corner ;-),2023-03-20 14:47:31,False
759fbd17-c44b-4ec2-8ef9-6f4d6ee1f59b,Pablo Gomez,https://play-lh.googleusercontent.com/a/ACg8ocKc978qgT5HEeVCsGoTnqz_BRxEar62C6gpiqJqvnTZ_1LNvg=mo,Dos semanas esperando aprobación de perfil. Un desastre.,1,0,,2023-03-15 00:36:26,"Hola Pablo, ¿por favor puedes escribirnos a support@theinnercircle.co y lo revisamos?",2023-03-20 03:10:28,False
4ff0a233-4247-41da-81e9-9afb3aabebcc,Gabriella Arena,https://play-lh.googleusercontent.com/a-/ALV-UjWTVuHclq0iPkxrQK8nJAVPqp2YdgX7AkWOly50MbqIDK7sfEwZCw,Basically it only works if you pay the subscription which has a really high price also considering the low number of users in my area.,1,3,4.46.1,2023-03-13 07:35:25,"Hi Gabriella, you can sign up for a trial membership at support@theinnercircle.co :-)",2023-03-15 15:11:16,False
82f6e073-18e6-40a4-9d63-6b08a5be7f4d,Marcelo de Andrade,https://play-lh.googleusercontent.com/a-/ALV-UjVvphS_G8_SFVXIderNdkw4JofWEnWGkTldB18VLmoB5foN3xxS,"The new Tinder. This app is full of fake and inactive profiles. Whenever someone replies, it is an invitation to find them on Instagram. Do not waste your time and money.",2,12,4.46.1,2023-03-10 20:08:19,"Hi Marcelo, We're sorry to hear this. We are always open to feedback and continuously improving our app so if you have any other suggestions please feel free to send us a message at support@theinnercircle.co.
",2023-03-15 14:58:27,True
e3d0bd46-6baf-4cfc-bfb2-e4ed4164289f,Carolina Ruiz Montani,https://play-lh.googleusercontent.com/a-/ALV-UjWgMtw_Cchz48tNWXWhG3vLv9f2hab9qu0LKxCVHPNdDZTOdAVO,Good,5,0,4.46.1,2023-03-05 22:52:04,,,False
1b4f701b-bb98-4a73-ab08-397754172fee,Tiffanne May,https://play-lh.googleusercontent.com/a-/ALV-UjUGOHaPW809MmoBcSDoDCEdRinNIWqyJw7i4tF_D26f16b4mEQU,I was only able to see potential matches 1 day and then it went back to saying my profile is being reviewed after several weeks. I think this is why I didn't use it when I initially downloaded it. I thought I would give it a try again now that I'm back to dating and the results are still the same. Don't waste your time.,1,5,4.46.1,2023-03-05 14:44:53,"Hi Tiffanne! We're very sorry to hear this!! We are most certainly always open to feedback and continuously improving our app, so we will definitely take your feedback with us in our next meeting. If you have any other thoughts, please feel free to send us a message at support@theinnercircle.co and we will look into your account for you :)",2023-03-06 10:59:31,False
d26a88b1-f6a2-464f-a891-0416eb014aaa,Luciano Alvarez,https://play-lh.googleusercontent.com/a-/ALV-UjVvM7GAer8mE0LeatQ6LPPtl9bZfbzBi19IMj8CX1vxS1MNtxPA,"You have to pay for basically everything (even to view photos, what's wrong with you?), why you don't you simply make this a paid app?! Don't waste your time downloading this. To answer your reply: the world is not the US, big big FAIL...",1,18,4.46.1,2023-03-04 00:47:41,"Hello Luciano! We know that everyone likes free stuff, but with our app you will get a quality experience and serious members ;-) If you want to sign up for a trial membership, email us at support@theinnercircle.co.",2023-03-03 10:30:01,False
2d3c2761-1268-4b7e-96d6-1708f5b86279,Aim Action,https://play-lh.googleusercontent.com/a/ACg8ocLVUE5H5hqlraRiD0Faej9S-W1TMJwi8mTHhyFopjFt08OCxg=mo,"DISGRACEFIILL ! I BELIEVE THIS APPICATION BLOCKED ME, BUT IS TRYING TO FORCE ME TO DO SJGN UP VIA FACE BOOK. I HATE FACE BOOK. I HAVE DELETED IT, AS I AM GOING TO DELETE THIS APPLICATION. THIS REVIEW IS MY BELIEF ONLY WITHOUT PREJUDICE. RON VEGAN",1,0,4.45,2023-03-03 04:35:48,"Hi Aim Action! If you need more assistance in regards to your account, please drop us a line at support@theinnercircle.co and we will be in touch :)
",2023-03-03 10:28:32,False
b4e627dc-7d62-483e-9459-a67957b76e8f,Weyder Ferreira,https://play-lh.googleusercontent.com/a/ACg8ocLTdIagiwHulUxzxNYW0-MMBCMn0dwyv_B5Iegce30qQ2co3lo=mo,App fraco demais perto dos concorrentes,1,1,4.45,2023-02-25 05:02:25,"Hey Weyder! We are always open to improving our dating app, so feel free to get in touch with us at support@theinercircle.co and share your thoughts :)",2023-03-01 12:47:21,False
7474876f-086d-41da-8a4f-112ec3874bb5,varun diwan,https://play-lh.googleusercontent.com/a-/ALV-UjWzRF0bFO4eCg6klnJzVZBZgmV9hRkXWXfLrMvZYBgtvqX7QoEJ,"Please don't waste your time downloading this app, after linking my LinkedIn account and adding all my data the app takes forever to verify. Should I also add my property papers as well to prove my identity?",1,1,4.45,2023-02-24 09:49:26,"Hi Varun! We apologise for the difficulties you experienced while registering with us. If you would like some assistance or additional information, please contact us via support@theinnercircle.co and we will be happy to help you further.",2023-03-01 12:46:39,False
89bf600c-b84b-4bc1-9e25-4e329b4082c5,Justin Loutsch,https://play-lh.googleusercontent.com/a-/ALV-UjUUbfllO9qOkT8Qy2d0ylrciWwXKwkkwW4dUsOOAmbNENes80m_MA,Great if you want to date people in South America. But to view profiles of people nearby you'll need to pay.,1,1,4.45,2023-02-20 04:15:07,"Hi Justin, We're always open to feedback and improving our dating app. Please feel free to share your thoughts with us at support@theinnercircle.co and we will look into it for you so you can meet members close to you ;-)",2023-02-21 18:14:19,False
bcc0e70c-6964-444a-8fac-3dcc7b353468,Jeraldin Sierra,https://play-lh.googleusercontent.com/a-/ALV-UjXoe2Z0RMWisVmT1ODp7VKIS17PdVGxnx1UoOwPZQyBvU57KAY,I love it,5,0,4.45,2023-02-19 01:44:09,"Hi Tatiana! Thanks for your love. If you need anything, please contact us at support@theinnercircle.co! We hope that you will soon meet your best match :-)",2023-02-21 18:12:09,False
c12e5c5e-dcda-4a08-89d6-64ae80ff03a5,Kevin Kavuu,https://play-lh.googleusercontent.com/a-/ALV-UjVMYaRMlXACuHyohjSoV2sxhY58dabUjF5gnlMmlPJMQWsxwxMk,Amazing and friendly support. responded to all my issues regarding the app,5,0,4.45,2023-02-18 10:44:21,Hi Kevin! We are happy that you have had a great experience! We work really hard to make our members happy! We hope that you will meet many other awesome members and find exactly what you are looking for on Inner Circle! All the best :-),2023-02-21 18:10:57,False
2d507b2b-d02c-43aa-bdaf-6057d7ab78ca,Gisela Macedo,https://play-lh.googleusercontent.com/a-/ALV-UjW0waLQLiezfsl3pvl7ixcaS9DudV1-LDFOnsGzMGtxiwEmwMxi,"The people are ok but the problem is that VERY SINGLE TIME I leave a chat the app suggests that I pin the conversation. I click on ""maybe later"" and then it goes back to the chat and I have to leave it again. It is so bothering and time consuming. If I don't want to pin, just remember my choice and stop asking me!!!!",2,19,4.45,2023-02-12 17:43:17,"Muito obrigada pelo feedback e lamento por isso Gisela, se você precisar podemos te ajudar pelo email supportbr@theinnercircle.com.
",2023-02-17 21:36:37,False
87fe4b97-fdc1-48b6-a6e6-58698b5b0514,Jacob Allgayer,https://play-lh.googleusercontent.com/a-/ALV-UjUyP0o6F0yYEPpy0rxBTpoKG7MOag2KFyeN2S1eN7nnC3vtxCuC9Q,"If you don't live in its small list of locations, don't waste your time. No one will see you ever. Terrible app. Impossible to get a match.",1,0,4.44.1,2023-02-11 00:57:36,"Hi Jacob! At the moment we have only officially launched in the cities displayed. We are growing very fast though and aim to open more cities very soon :) For the moment, you can use the 'Nearby'-feature to search for members in your area or use the 'Who's up for..."" feature.",2023-02-12 14:33:54,False
f57f90bb-b12f-4b78-8cff-fa796f2bcd68,James Poidog,https://play-lh.googleusercontent.com/a-/ALV-UjW-nSXDMYswZM1gUDCWrHdbmf65eOta2Zg3Nn3i2KchzmNXIEr_jQ,"So...how long does it take to verify and review a profile? Been a week already. 🤔 Now its been two weeks and nothing. Thats garbage 2-2-23: So now I had to do my profile all over again, just to be put in review yet AGAIN. Getting sick of this. Going on three weeks now. 2-7-23: got tired of the bs waiting for verification and just deleted my profile. This app is garbage and not worth anyone's time. ""Thanks"" for wasting mine.",1,1,4.44.1,2023-02-08 06:58:11,Hi James! Thanks for sharing your feedback!,2023-02-12 14:33:07,False
bd002486-9cb9-476d-9ad0-426add5ede9c,Todd Tatro,https://play-lh.googleusercontent.com/a/ACg8ocLlHnf1I4sEuwTqpU0jJ-nCAg7vCJzO_WchgvP1hhaIAzBkdA=mo,I install this app because I can't put down where I live in Greer south Carolina,2,0,4.44.1,2023-02-07 04:04:16,"Hi Todd! At the moment we have only officially launched in the cities displayed. We are growing very fast though and aim to open more cities very soon :) For the moment, you can use the 'Nearby'-feature to search for members in your area or use the 'Who's up for..."" feature.",2023-02-12 14:32:32,False
bb5c6646-4a39-47f1-8bec-e3dacb8c49fb,Van Fernandes,https://play-lh.googleusercontent.com/a-/ALV-UjUA6C5xQkZWF9CxxmcNRs8FjJzfo0zhkNdgIC_c6XGEmYKgzm3f3Q,This is just another tindr. Don't waste your time.,1,0,4.44.1,2023-02-06 03:54:15,"Hi Van! We regret that you did not like the app, but thanks for the feedback.",2023-02-08 16:50:14,False
7fca198b-31d1-4efe-9207-2090e70df19c,mugiwara,https://play-lh.googleusercontent.com/a/ACg8ocIvmX4Al30e8cmXlkHmsyDokDHNbOeQyQ5DPNPokTlVVJdYgjk=mo,"Ridículo, faz dois dias que criei meu perfil e ainda está sendo analisado.",1,0,4.44.1,2023-02-03 14:53:11,"Por gentileza, nos envie um e-mail pra supportbr@theinnercircle.com para que possamos averiguar o que houve e te ajudar :)",2023-02-04 02:01:31,False
db15f4e7-e0f9-4cdf-9b8d-557d9fc16364,Fred B.,https://play-lh.googleusercontent.com/a/ACg8ocIc7tUqRrSu_p68cX7e0tAPr7Kn3i5LA2mJxjho_SM-Ca10uw=mo,"What kind of monkeys are filtering the profiles? I'm an expat manager, I've lived in many places, speak languages, keep fit have hobbies. . .all that was conveyed in the profile along with my best pictures. My profile was never approved and meanwhile (I waited months!) I went on dates from Tinder/Bumble. . . Good thing I didn't put any money on this 'cause paying customers seem to be complaining too!",1,1,,2023-02-03 06:04:13,Hi Fred! It sounds like you could be on our waiting list. Please reach us at support@theinnercircle.co for quick support with your account :-),2023-02-04 17:11:22,True
660ad6f5-c6ee-48ef-bf26-b3820c958fc4,Vivek Satam,https://play-lh.googleusercontent.com/a-/ALV-UjXF-IS2GBT-k8U_GckamyZnGltPHMD0op3MKv6vg0mjWDkijQ96,app is slowest. does not respond at times.,1,1,4.44,2023-02-01 16:46:06,"Hi Vivek! We’re sorry for the inconvenience. Please contact our support team at support@theinnercircle.co and share a detailed description of the issue, screenshots, device info and OS version so that we can help you fix it up for you ;-)",2023-02-04 17:06:18,False
3409012d-c15f-4b9d-a29a-d7f46df17462,Amílcar Carranza,https://play-lh.googleusercontent.com/a-/ALV-UjVF8ilP6Qeb5FwxECCToMm3qUOlyjwUUScZx8zvnVNFpIfxKD_T,"More than 24hs for review my profile and I cant use the account, so I'll delete it.",1,1,4.44.1,2023-02-01 14:38:14,"Hi Amilcar, Please contact us at support@theinnercircle.co so we can further assist you :-)",2023-02-04 17:05:30,False
51bf7222-c3cf-4bed-b0f1-6162a785e479,Annamaria Capicchioni,https://play-lh.googleusercontent.com/a-/ALV-UjXdtVQmLHxXbU3hg8C2AUGfhdmOCfoRdqzhtta08Lc2D5zY5hDIeg,non mi ha ancora approvato non capisco perché,3,1,4.44,2023-01-30 16:21:42,"Hi Annamaria! If you need more assistance in regards to your account, please drop us a line at support@theinnercircle.co and we will be in touch :)",2023-01-31 18:06:18,False
dca43d8c-93c9-4098-8a15-c3f2fe3919df,Joyce Kenfack,https://play-lh.googleusercontent.com/a-/ALV-UjUpIMSSdhTw2oESULoGeARxjU_J65SqBIYil1CbbQ-5jWgz7qUg,Very difficult app still waiting for my profile to be approved since 1 week,1,1,4.43,2023-01-25 20:19:51,"Hi Joyce, We'd love to help you with this. Please write to support@theinnercircle.co and our team will help resolve your issue quickly :-)",2023-01-29 15:28:30,False
