reviewId,userName,userImage,content,score,thumbsUp,appVersion,at,replyContent,repliedAt,scam_related
19836d3a-78e6-4a70-a472-32b54ab77c15,Iceville Chiboy,https://play-lh.googleusercontent.com/a/ACg8ocLzKYSABZwOOK_XF8BQZwAAkOEPh3xDwZDrLKlbbJ8EcYICOgVQ=mo,"Why have i not receive notification message since 4days ago? It is taking much time to verify me. What is happening! @Develioer, Ive done what you ask me to do but no changes....this app is just collecting my profile pictures and my account information without getting any result. Uninstall instantly. Thanks for wasting my precious time over 1month waiting!",1,14,4.9,2021-04-29 11:37:54,Hi Iceville! We're always here to help! Email us at support@theinnercircle.co and we will check on your registration for you ;-),2021-04-29 14:55:28,False
dbb18ec9-18b1-48cb-b4e2-2af6dd9faa54,mark schouten,https://play-lh.googleusercontent.com/a-/ALV-UjXw3iku5rRBjIIHq_huSE-2t6_Q1PXPhpOdpZfScRyhwKZN0CI,For over a week i am waiting to be approved. I knew this takes a few days but more than a week?,1,2,4.9,2021-04-27 15:52:13,Hi Mark! Can you please contact us at support@theinnercircle.co so we can further assist you with your account :-),2021-04-28 14:55:59,False
9d6d4369-da68-49f7-8bd0-b817f9ff4449,NOTHING,https://play-lh.googleusercontent.com/a-/ALV-UjWjuJ1R621uss-znZ7-oIdvt3f67K-1qus7-m14hFUW2ILKuS-a,spy tools,1,0,4.9,2021-04-26 23:31:26,"Hi there! We are sorry to hear that you are not satisfied with our dating app. If you are unhappy with any of the features, you can contact us at support@theinnercircle.co and we will hear from you ;-)",2021-04-28 14:15:00,False
6e7fada7-0e22-4986-8950-dafca7d7f2de,Esmerelda Merianaldes,https://play-lh.googleusercontent.com/a/ACg8ocJpzX1j4Gz_h2WkfTAm8lHwL7UoOTI5WIdTg7JRWRpvFCP3NQ=mo,"After six of my pictures weren't recognized, I can only assume that black people with dark skin aren't wanted or accepted by their facial recognition",1,1,,2021-04-26 20:05:09,Hi Esmerelda! We are very sorry to hear this. That doesn't sound right.. Can you please send us a message at support@theinnercircle.co so we can further assist you with this ;-),2021-04-28 14:13:57,False
20b5fbb7-689f-4118-994d-6100428bcae8,Giorgio Ghiotto,https://play-lh.googleusercontent.com/a-/ALV-UjUuPgm21o10CJMOxvb-WAVTujM66LC0RxfeU9t5VjquBj_Dr4c,"being reviewed for days, got tired of a useless app the deleted the account and it.byeee",1,0,,2021-04-26 09:43:01,Hi Giorgio! We'd love to help you. Please write to support@theinnercircle.co and our team will help with your registration directly ;-),2021-04-28 14:07:22,False
f358c888-8885-4e9c-ba13-dd57ea29ace4,Mayumi Nakata,https://play-lh.googleusercontent.com/a-/ALV-UjVaZrdRKLkNCgmRB0kWfCcXP-hK_QqmEg0fGgVg_PIdnXqx8-NO,Wasn't able to login because I don't have Facebook nor LinkedIn accounts,1,1,4.8,2021-04-22 01:39:29,"Hi Mayuni, Sorry for the inconvenience. We will surely consider ways to improve our dating app based on your feedback ;-)",2021-04-22 16:17:21,False
a8309363-6af0-4730-8df9-bffe8743673c,C. M.,https://play-lh.googleusercontent.com/a-/ALV-UjU6WknmghEa_ap11PpTt1WXssyR0KwStkC5LOxWmjzGgTB9jPthng,"Hardly anyone within the age selection, I'm looking for, and looks like barely anyone on there. Save your time and money and either go back to the tired app of tinder and Bumble, or just the good old way through friends introduction? Seriously online dating is overrated. I dare people to strike up conversations IRL, I'm sure you might have more success than big brother controlled dating apps.",1,4,4.9,2021-04-21 12:58:05,"Hi there! We are super sorry to hear that you haven't had any luck yet! If you would like us to look into your account for you, we can help you to make the most of your account ;-) You can reach us at support@theinnercircle.co and we will be in touch.",2021-04-22 16:06:38,True
c160485a-7c4d-424c-b05e-c5e7a81089be,Irina Kozina,https://play-lh.googleusercontent.com/a-/ALV-UjU1lu4pUIABKH8bOHI3zrUeKFWxfvHrqisrynr8OQy7LxsVt6w,Nice app and very helpful customer support,5,1,4.8,2021-04-20 14:19:05,HI Irina! Thanks so much! We are here to help you anytime and can be reached at: support@theinnercircle.co! Enjoy exploring our dating app!,2021-04-22 15:57:20,False
1b4142ab-66b8-451a-a3d2-2d1682594b55,Arthur Barbosa,https://play-lh.googleusercontent.com/a-/ALV-UjWiu5ss_oXB-It4lU-Ah7Q-PWICtNjb35qof-bet_fXT9tfcTy_fA,"Interface bacana, conceito muito interessante, gostei bastante, porém é péssimo o fato de ter limitação de pouquíssimas cidades e além de eu não poder usar minha cidade própria como localização, não possui a função de mostrar pessoas apenas dentro de certo raio de distância, algo que considero essencial, pois da forma como é o app, você acaba sendo obrigado a ver pessoas que não te interessam, por não serem da sua cidade.",3,0,4.8,2021-04-19 01:19:59,"Hi Arthur! Thanks for sharing your feedback! At the moment we have only officially launched in the cities displayed. We are growing very fast though and aim to open more cities very soon :) For the moment, you can use the 'Nearby'-feature to search for members in your area or use the 'Who's up for..."" feature.",2021-04-22 14:21:34,False
e399ded2-51be-4a2f-8085-d024d314026c,Cristóbal Lagos,https://play-lh.googleusercontent.com/a-/ALV-UjW7pB0OA3GxrZmjI2DVIlx0K9fKsj-Kyd-pYSUV7LoSSnSg7hnbBQ,No podes hablar a menos que invites a otras 2 personas o pagues. Es básicamente un esquema ponzi.,1,0,4.8,2021-04-17 20:18:47,"Hi Cristobal! We are sorry to hear this. What our dating app does offer, is to invite your friends and expand our 'inner circle' of fun and likeminded singles ;-) Please drop us a line at support@theinnercircle.co is you have any other queries!",2021-04-21 16:34:03,False
1191a4bc-3c98-469a-84ee-09b226de416b,Hugo Peraza Rodriguez,https://play-lh.googleusercontent.com/a-/ALV-UjWWngMITY3SJ0wj9Xlx-_GEekhOnz7G9BpNybYOcv_7GZqHEpQr,"More personal app, great contrast with all the senseless swiping from other apps.",5,0,4.7,2021-04-15 08:30:51,HI Hugo! Super great to hear! We are here for quality connections with great people! We hope that you will soon meet your best match ;-),2021-04-16 14:41:57,False
7b563c8f-ee4a-4ba7-b04f-42d5c83792c1,Rob,https://play-lh.googleusercontent.com/a-/ALV-UjVstmznUQsAUa_8pQ_hpdlcjrR9iUUpUZybKC1gc6cL1RGEAek,How long does it take to verify my account? I've been waiting for days now. This is ridiculous.,1,3,4.8,2021-04-15 00:31:35,"Hi Rob, We'd love to help you. Please write to support@theinnercircle.co and our team will be in touch with you shortly!",2021-04-15 16:31:14,False
5570c715-e2e1-4fc8-9bff-ca455c82371c,Dan k,https://play-lh.googleusercontent.com/a-/ALV-UjWWPDao45WPOCJaXtj4fuppinTdxk81GNwaiVIZyfSvj9ufFfDH,Received a message but I can't see unless I pay?,1,0,4.8,2021-04-14 19:44:09,"Hi Dan! Have you already signed up for our trial membership? You can find out for yourself if this dating app is the right match for you!
",2021-04-15 16:30:37,False
b988a7b8-127b-44d0-9cd2-7d25cf66c5ec,Gabriel Avena,https://play-lh.googleusercontent.com/a-/ALV-UjW_i4k040tBqiY3U0aRyOFnPG6zqnGhhvaNTfPJN3UvG9C9b-Hx,"Still bad... no messages allowed unless you either pay or invite 2 friends.... not even from matches, other apps are just better, specially now that we aren't supposed to go out that much",2,1,,2021-04-14 04:27:21,"HI Gabriel! We are sorry to hear this. With our dating app, you know that you will get a quality dating app experience with only serious and respectful members in return.. why settle for less? ;-) You should sign up for our trail membership and see if Inner Circle is right for you. Your best match might be just around the corner ;-)
",2021-04-15 16:13:24,False
91f6d030-932d-406b-b808-5ffdf81b8c5b,R Brs,https://play-lh.googleusercontent.com/a-/ALV-UjX8sNM6EHNvV8ZGwb4QHLRl_EU7oeIHOn6-pe08RpV10cTVzw0SdQ,They have an excellent support team in UK. Polite and solved my problem quickly. The dating experience is a bit slow at present because I don't have access to all the features but it's generally a very good mix of people compared to other dating apps!,5,8,4.8,2021-04-12 18:28:26,"Hi El! Thanks for sharing and we are glad to hear that you have had a great experience with our dating app and support team :-) We are always here to help! If there is anything else, please reach us anytime at support@theinnercircle.co",2021-04-13 15:46:57,False
17ac69e9-b191-49a0-a1cd-acb2ee8822f9,Alex Murta,https://play-lh.googleusercontent.com/a-/ALV-UjUHTv9SGIgDRjNivDbTcC-7pWv5qPStbdMu8muTtE8pz2ixvM10,the best dating app,5,0,4.7,2021-04-11 02:48:58,"Hi Alex! We are so pleased that you enjoyed our dating app. If there is anything else that we can do for you, just let us know at support@theinnercircle.co!
Have a wonderful day!",2021-04-13 12:56:18,False
a7f78fdf-eeb9-4a2b-a68b-c5808e113064,Vincent,https://play-lh.googleusercontent.com/a-/ALV-UjXNOPYArWHnq_BHHa8UiFUZRhvZ2w9Bk6JwQSvvshuFGru6_-Eo,"You can only make an account if you have a facebook or linkedin account... kind of weird. So thats a big red flag for me, And also i dont have either, so unfortunately thats a 1 star experience for me.",1,14,4.7,2021-04-09 18:10:21,"Hey Vincent! We are always open to improving our dating app, so thanks for sharing your thoughts. If there is anything else, please email us support@theinercircle.co :-)",2021-04-10 13:09:37,False
8b1da3f9-ad30-4d54-949b-c4e1d77ab405,Pedro Lopes Ribeiro,https://play-lh.googleusercontent.com/a-/ALV-UjX_v5UwWfCX3rWQfILYJkObJJyqwerzCZ3pW6wTgRk0oW7O7YEy,"To find nice and interesting people with an easy and friendly graphic interface, at the end of the day that's what really counts. And InnerCircle delivers it. I have uninstalled all their competitors… Very efficient and empatic customer service that solves the issues very quickly. Still, a few things to improve: shorten the time to accept a new member, location search engine limited to few cities, no available currency other than eur or usd, very limitated access features to non-subscribers. The fifth star is to encourage the development team to carry on and to distinguish the Customer Service!",5,8,4.7,2021-04-07 01:24:38,Hi Pedro! Thank you so much for sharing your thoughts. We are thrilled to hear that you are loving our dating app and we will certainly take your feedback for future improvements into consideration ;-) Enjoy our dating app and we wish you lots of luck in meeting your match.,2021-04-08 13:36:59,False
603b010e-faa6-480b-ba35-540cc38bc532,Aditya Pappu,https://play-lh.googleusercontent.com/a-/ALV-UjW8VxBLvz0G1SbNZZEOqOUaKDjUqYTCw4_oeJKYR8qJw-m8EJKS,"Hi, I've been waiting for 4 weeks and it still says profile being reviewed. Can you kindly look into this? If there is something lacking in the profile it doesnt clearly state what more is required. Thanks!",1,3,4.5.1,2021-04-06 08:55:48,Hi Aditya! We'd love to help you with your registration. Can you please write to support@theinnercircle.co and our team will help resolve your issue quickly.,2021-04-07 16:52:00,False
73e85b6e-539d-45ed-bfa6-65dfe3330085,Tom Moore,https://play-lh.googleusercontent.com/a-/ALV-UjXh9Jpuy2PScEJLdwj7UhN_F3EFEf6uph7ywhGIIRsjfKJ8s55P,"Good app, allows to you chat without matching, 👍",4,0,4.7,2021-04-06 04:14:57,Hi Tom! Thank you for sharing! We are happy to hear that you enjoy this feature of our dating app :-),2021-04-07 16:29:06,False
9781957f-5d1b-480e-b42b-7a5adedbea89,Mathias Lacome,https://play-lh.googleusercontent.com/a/ACg8ocKziOCHhdKp7we1ODOmrh0KS9S7gZpLfTop4KV8zxTQk0sNjw=mo,Great app,5,0,4.7,2021-04-05 11:21:09,"Hi Matt! Thank you, It is really great to hear :-) Don't forget to meet your match!",2021-04-07 15:52:01,False
c798a9c4-2878-43e9-9627-bfce5d942eaa,Olav Grouwstra,https://play-lh.googleusercontent.com/a-/ALV-UjUqGhSlankhbMd25lq1_o2h0pZRE0q9_ONXN_Z9wF-95Ur6gy1c,fine app without issues,5,0,4.7,2021-04-05 09:49:10,HI Olav! Thank you so much for your feedback :-) Enjoy our dating app!,2021-04-07 15:50:17,False
bc3c5a70-c9a6-465a-a0a2-85e135701bf8,Nicole D. Watson,https://play-lh.googleusercontent.com/a-/ALV-UjW-rKTTdbqeZVdTmTdByZNDi-q1eu1Q4roV67GRoLaNnar4l-pRKA,I have been trying to cancel or delete my profile/account for 2 days and NOTHING HAS BEEN DONE...I sent 2 different emails to Support Team and STILL NOTHING ❗,1,1,,2021-04-03 17:20:20,"Hi Nicole, you can easily delete your account on our website. Find more information on this in our FAQ's or contact us at support@theinnercircle.co :)",2021-04-07 14:28:10,False
769775ff-c7a3-4355-8fab-c04bad4551a3,mina jahani,https://play-lh.googleusercontent.com/a-/ALV-UjUOWR7qKulr_VT5ckdrpbYC9bVZKWuR15IScb9DZ_VzAXLDlpxgag,I didn't like it because it's not user-friendly at all and it doesn't work with inviting others,1,2,4.6.1,2021-04-03 14:27:52,Hey Mina! Opps- It looks like your friend accidentally forgot to use your personal invite link upon registration. Please get in touch with us at support@theinnercircle.co and we will look into it for you :),2021-04-07 14:24:59,False
885a1604-e8bd-41ea-af87-2f5611059004,Rishi Dhingra,https://play-lh.googleusercontent.com/a-/ALV-UjXWUjQx7-MmaPULjALG-4Jn-DXKGfdwFOOmcsXh5zUrwo8VDcaqog,nothing is free,2,1,4.7,2021-04-02 21:35:28,"Hi Rishi! Unfortunately most often the good things in life don't come for free... Why not sign up for our trial membership, and find out for yourself if this dating app is the right match for you!",2021-04-03 18:37:24,False
4e39f5bf-92eb-4266-8ce2-720a73f25e8f,Loto Vázquez Simón,https://play-lh.googleusercontent.com/a-/ALV-UjV4SYgecsfYQjW-ycNptgTWo8tDKxXIzOpU-8AFpvR2k4UCU2r6ow,"clean, easy, simple, more mature and higher standard than Tinder and Bumble. appreciate this",5,0,4.7,2021-04-02 18:27:43,"HI Loto! We are really thrilled to hear this, thanks so much for sharing! We are indeed here for creating real quality connections. Don't forget to meet your match ;-)",2021-04-03 18:33:37,False
4154140f-4a7c-4dce-8bb1-bf417962ae9f,Chidi Victory,https://play-lh.googleusercontent.com/a/ACg8ocKhG_RGAM79WI0EHOYLPvUqCSmNPm-pTjC2mOxJIyiY-ELF=mo,good,5,0,4.7,2021-04-01 01:03:30,"Hi Chidi! Thanks so much :-) We really love to hear that you are enjoying our dating app. f you have any feedback or suggestions, please write to us at support@theinnercircle.co. We would love to hear from you!",2021-04-01 15:05:45,False
ca2bbb9b-37c6-4a5e-9e3c-aa750120d35a,VR eSports Brasil,https://play-lh.googleusercontent.com/a-/ALV-UjUAQrrBc28VWArSAcQiutUQUqQmV-S4bAfQl0NLEcIbIfhXFYU,"Mano, de todos os apps de relacionamentos, este é disparado o que mais tem gente feia 😆😆😆😆",1,1,4.6.1,2021-03-31 07:47:08,"Hi there! Oh no, we're very sorry to hear this!! We are most certainly always open to feedback and continuously improving our app, so we will definitely take your feedback with us in our next meeting. If you have any other thoughts, please feel free to send us a message at support@theinnercircle.co and we will look into your account for you :)",2021-03-31 13:13:14,False
2ea52077-ca72-493c-8bea-e9d402a87fd0,Bruna Gomes da Silva,https://play-lh.googleusercontent.com/a-/ALV-UjVEnqku1ZsKZMtIdFZ9Ji1BI89S373QQgC4R13aYDNMZAEKKmfynA,"I've paid $10 dolares 6 days ago to use the app and today I was charged in $40 dolares in my credit card, this is too much in Real (R$). I wasn't notified about this!! It is absurd! Please, cancel it!!!",1,10,4.6.1,2021-03-31 02:07:26,"Hi Bruna! We have stated the subscription fees on the payment page, on the payment confirmation page, in the confirmation email and in the terms & conditions. Please contact us at support@theinnercircle.co and we will look into it for you!
",2021-03-31 13:08:46,False
bf0d1df5-b4e6-4f51-b070-202bec2a7a68,Fabio Vallido,https://play-lh.googleusercontent.com/a/ACg8ocLlKJzc8iSAlCXcdo6HGC8Vvd0Jh85Tq86dQQ3W8awBNP5iGh1m=mo,very good app,5,0,4.7,2021-03-31 01:33:39,HI Fabio! Thank you so much! Enjoy exploring our dating app :-),2021-03-31 13:08:16,False
83fb3b97-97d8-47dd-8024-dfb8a894fd6a,Karen Santos,https://play-lh.googleusercontent.com/a-/ALV-UjXXP9YP4RJGCgzLjSCuCao0uURBSggeujQl_f4COE5Iaa0uLw0,Worst dating app ever.,1,0,,2021-03-20 02:17:36,Hi Karen! We are very sorry to hear that you don't like our dating app. Would you mind telling us what you dislike about it? Please write to us at support@theinnercircle.co. We'll be grateful for your feedback!,2021-03-20 10:18:26,False
1a21536e-d1e5-4813-9250-5235264c48b0,high heels club heels club,https://play-lh.googleusercontent.com/a-/ALV-UjVuEr48w-j0Tml5S9XJZkvpkBWd6l9VfXo9tofcIBwU2THhle0,"Well, you don't always get it right with dating apps, but so far my experience has been pretty smooth and have had no issues. I will definitely give it a go and if something doesn't work out , you always have their outstanding customer service. Everyone has its own experience, mine so far has been great!",5,14,4.6,2021-03-19 15:46:17,"Hi there! We are very pleased that you enjoy our dating app. If there is anything we can do for you, just let us know at support@theinnercircle.co!
Have a wonderful weekend!",2021-03-19 17:17:08,False
4bf67c8f-66ce-473f-99d3-534fdac57703,Binuwick,https://play-lh.googleusercontent.com/a-/ALV-UjW-ra23eol-6_letvWlMcrkVoyg3FRSFpMeZduTXy0EX0P3yBom0w,I paid and used this app for months. Not one fruitful connection. Did not find any serious connect so far. It just wasted my time searching here.,1,7,4.6,2021-03-19 06:12:34,Hi Binuwick! thanks for sharing your feedback as we are always open to improving our dating app. We are more than happy to assist you with some tips & tricks and look into your account if you wish. Please send us a message at support@theinnercircle.co and we will further assist you.,2021-03-19 17:13:53,False
2927343e-4b17-416c-a16e-81f4d2b604b1,Itoro Etefia,https://play-lh.googleusercontent.com/a/ACg8ocIfQBNeuO5bNZXC8cq_H5HUkH7Usue9A5D_3OCQKce3Vr0jqg=mo,"This app keeps blocking me from Login. My account has been blocked twice and the keep telling me """"blocked""",1,4,4.6,2021-03-18 17:40:17,"Hi Itoro, We'd love to help you. Please write to support@theinnercircle.co and our team will help resolve your issue.",2021-03-19 17:06:08,False
0b612c40-5e3f-496c-8258-29f0e02c5933,Ies VonL,https://play-lh.googleusercontent.com/a/ACg8ocKsOhlAlknZai8eByJzRVsKlsKqc6SUICmC3gx3MVfteZ8iBQ=mo,Fun app. nice people at inner circle,5,0,4.5.1,2021-03-14 22:40:24,"HI Ies! Thanks for your love. If you have any questions, please contact us at support@theinnercircle.co :-)",2021-03-17 11:58:13,False
46782ae9-52fd-4115-b3b0-8957d2206ec5,Ridge Colaco,https://play-lh.googleusercontent.com/a-/ALV-UjWnaoZkve9d5vDxPlg_GlStomX1n32jv-1lp_JYJ8C1e8Et7FVe,Verification takes forever.. over 2 weeks waited to get verified.. mail the concern team only to get a generic response.. They need to fasten and improve their verification process.. There is no point in having the app if the user is not going to even get to use the app even after two weeks..Even a 1 star rating is being generous..,1,1,,2021-03-12 04:49:14,"Hi Ridge! It sounds like you are on the waiting list. If you would like an update on your application, reach us at support@theinnercircle.co :-)",2021-03-12 17:28:52,False
3e2d307d-8c7a-4770-ab2e-319ee6a72215,Luciano Testi Paul,https://play-lh.googleusercontent.com/a-/ALV-UjVmkYUdFnhArc9UXbm61V6yrdEVRRIyOxxbROkkAx0EnGwjbGgZ,Been put in a waiting line from the start a month ago. Still waiting. App is useless.,1,3,4.5.1,2021-03-10 03:34:24,Hi Luciano! We'd love to help you. Please write to support@theinnercircle.co and our team will help you with your account.,2021-03-11 16:36:02,False
1294b4ee-beec-4a72-bc0f-862c82c4b2ff,Gel Barbosa,https://play-lh.googleusercontent.com/a-/ALV-UjUs_eLzQIgWsfzmVO9vwX44vAvmtQ72lbFpFTIzBMNqEbl6laY,"Ridiculous app. Days saying that your profile is under review for you to use, never contacted me back, and no option of deleting my account, so I put a naughty profile photo, not of myself of course, to see if they will delete my profile.",1,0,,2021-03-09 11:18:09,"Hi Gel, you can easily delete your account on our website. Find more information on this in our FAQ's or contact us at support@theinnercircle.co :)",2021-03-09 13:57:45,False
fe1952de-933e-459a-b4c1-eb37a9a10e09,Ora,https://play-lh.googleusercontent.com/a-/ALV-UjUeeNMFwWlX-bKbr9WSru5NlR4Wl7TRsN9l-xp3Jpf8W6NqW8J1,1- No notification for messages (everyone keeps asking to switch immediately to an other app because the issue is on everyone) 2- no user-friendly messages system (i have to enter every person's profile first!),1,7,4.5,2021-03-08 01:44:37,"Hi Hala! You can control Notifications in your Settings on the app. If you need more help with your account, we are happy to look into it for you. Please email us at support@theinnercircle.co :-)",2021-03-08 12:19:59,False
94cab011-b42a-46dc-af83-8f0e38fda10d,Beryl van Hoek,https://play-lh.googleusercontent.com/a/ACg8ocLPmSRLxbjoqDEH0aorvtd16sLTtmsRYL6iH_yM7Fug4q2trg=mo,Friends told me about this app and they had great experiences and were very positive about the people they met!,4,0,4.4.4,2021-03-01 23:00:55,Hi Beryl! Thank you so much for your review and we really hope that you will enjoy exploring our dating app :-),2021-03-02 15:33:13,False
aea7b85e-9006-4005-8fa9-ffcc4c36c9df,Christian Lennon,https://play-lh.googleusercontent.com/a-/ALV-UjUHAaTEyMzWkWCtRGZu4WMsIN4hJ1mB1dpQYrC1n5ngmaQjNt93qw,"Great App, nice straight forward design with lots of options. Very good support as well.",5,1,4.4.4,2021-03-01 18:35:25,"We Christian! We are pleased that you enjoy our dating app. If there is anything more that we can do for you, just let us know at support@theinnercircle.co!
Have a wonderful day!",2021-03-02 15:32:30,False
6be29bbe-85ec-4405-bf9e-49a2444dfc62,Brian Heffernan,https://play-lh.googleusercontent.com/a/ACg8ocI_iuWMx3dpGBsTBViTnlMjg2G2JtMHEHzWq5e_LuPh1kdTqzE=mo,"Just joined the app and it says I'm a waiting list, I've been on a waiting list for 2 weeks now, what's going on? Need to get cracking here, I'll give a better review once someone gives assistance, until then one star from me.",1,4,4.5,2021-03-01 13:58:20,"Hi Brian, We'd love to help you. Please write to support@theinnercircle.co and our team will assist you :-)",2021-03-02 15:31:20,False
6db678e5-a235-4842-a779-e48441087f87,Jorrit Dorman,https://play-lh.googleusercontent.com/a-/ALV-UjXF0Wvp3AofF-bEGuefu2tpZ-P6kkgy8CgWUHXLP4wn_xbx0Xgq,"Buggy, can't finish account creation",3,0,4.4.4,2021-02-28 09:29:08,"Hi Jorrit! If you need help with anything, please do not hesitate to contact us at support@theinnercircle.co and we can help you with your application :-)",2021-02-28 18:24:09,False
d8cce9d3-3520-4f9f-bbe2-ecb00a3c2caa,METRILHA,https://play-lh.googleusercontent.com/a-/ALV-UjUXyOzfB0sYvRySbp9tX_wXw9vN6vp2P_8tig7kz8_C4h1HyIMw,"Awesome but needs to be better. The price of $40 dolars for brazilians gets up to $200 in their currency, whats makes impossible to pay for it when Tinder and Happen cost just $5 dolars to get your membership.",2,7,4.4.4,2021-02-26 14:28:52,"Hi Metrilha! We're very sorry to hear this!! We are most certainly always open to feedback and continuously improving our app, so we will definitely take your feedback with us in our next meeting. If you have any other thoughts, please feel free to send us a message at support@theinnercircle.co and we will look into your account for you :)
",2021-02-28 18:08:15,False
dafde28b-c037-4a2c-8004-47708b19cbf0,Euan Corrall,https://play-lh.googleusercontent.com/a-/ALV-UjU8k5L_kzbTKlagQ-9navIxNE-ykL2gEhqyGxPQbWjRR3X1EZx5,Sensational app... a cut above the rest and excellent service provided is called for.,5,0,3.18,2021-02-25 18:09:17,"Hi Euan, thank you very much for your feedback. We are very happy to hear that you are happy and we hope that you will enjoy exploring Inner Circle :-)",2021-02-28 17:59:17,False
a90d609c-8c4e-42bb-b2e2-7b4d2fb783fe,Shivam Kumar,https://play-lh.googleusercontent.com/a/ACg8ocIeNxmdKWvZyiOa0KHSSngarO-xROjIwlZdAXxcNMwV10Xx1w=mo,Time waste app,1,0,4.4.4,2021-02-23 23:22:01,"Hi Shivam! This dating app tends to save time, not waste time. If there is anything useless in particular, feel free to send us feedback at support@theinnercircle.co",2021-02-24 16:56:47,False
48587388-e145-45c2-ab1f-d374b519415f,houkmellah taha,https://play-lh.googleusercontent.com/a-/ALV-UjWOSRZbx3yUt9Q-lD9TkngmaTyUQn5lsTR225U882fMzNQr7VVAUA,C'est ce site est une pure arnaque : on me demander de payer 10 Dollars pour le mois et je me surprend d'un débit de 40 Dollars de plus. Résultat je supprime mon compte,1,0,4.4.3,2021-02-23 11:35:42,"Hi there! Our subscription is an automatic subscription which we have stated on the payment page, on the payment confirmation page, in the confirmation email and in the terms & conditions. Please contact us at support@theinnercircle.co and we will look into it for you!",2021-02-24 16:49:38,False
84b925a6-6ad9-4e48-b179-1cb2c4cd363f,Sandro Carvalho,https://play-lh.googleusercontent.com/a-/ALV-UjXK60YdRMFlkR1E5wrtfE8VuFndNhg9HDW4pdIyr_vyO7Znt9hwDA,"Inner circle is an amazing dating app! It allows you to choose your better social circle, creating an environment for easy chat with people with much closer social and subject connections. This, differently from other apps, really leverages our potential / chance to date someone for the long time. Love it!",5,2,4.4.4,2021-02-22 20:20:03,Hi Sandro! Thanks so much for sharing! We really do love to hear that our dating app is helping you to make the most of dating. We hope that you will meet tons of awesome members and meet your match very soon :-),2021-02-24 16:44:38,False
