reviewId,userName,userImage,content,score,thumbsUp,appVersion,at,replyContent,repliedAt,scam_related
685af9cd-c049-47a3-af97-f00b1c88ed9a,Kristen Usher,https://play-lh.googleusercontent.com/a/ACg8ocKweG9HwdayztcAJzt92SYuhbo-uFkpGfJoL1TXbuYmg6zYPg=mo,Trying new dating apps for adults and this is the best so far. Love the selection and features.,5,0,1.8.0,2024-09-07 04:29:25,,,False
c4497b03-6255-4e27-8538-029c7d43a596,Jacob Mein,https://play-lh.googleusercontent.com/a/ACg8ocKLlI-FH95ubTelYxkuXrJAaHAgzJenN2Fswvs-YlFPpdw5WQ=mo,Very fake app not a single real person on this app,1,0,1.7.9,2024-09-07 03:58:07,,,False
3566d2a7-3fe4-4cbf-8f1f-658a6c7b31e6,Rahleek Walker,https://play-lh.googleusercontent.com/a-/ALV-UjUFDymG_wwx0OXYSWTn6C2IDp_OAAuQYoTlociW_2CbYhj8gAps,"THIS APP IS A SCAM!! MADE UP OF BOTS TRYONG TO MAKE YOU PAY FOR MESSAGING SENT BY ""PEOPLE"" WHO ARE JUST REALLY BOTS TRYING TO GET YOU TO SPEND MONEY FOR FAKE VIDEOS AND FAKE PHOTOS!! 👎👎 ITS ALL FAKE!! DON'T SPEND A SINGLE CENT ON THIS GARBAGE APP!!! IF I COULD GIVE IT 0 OR NEGATIVE STARS... I WOULD!!!!! 👎👎👎👎👎💩💩💩💩💩",1,0,1.8.0,2024-09-06 23:32:25,,,True
a07bcddc-1f2d-4219-b686-49d759a8a15f,Matthew Holst,https://play-lh.googleusercontent.com/a-/ALV-UjVBFP8Qhs9jaPgxy2N1WOQmeT4ECCNJJD3XeIruH9ji-gE8kHir,It's just bot accounts. Don't bother,1,0,,2024-09-06 21:30:09,,,False
7f075b99-25a3-4df4-9a41-23ae90f017a6,john nduati,https://play-lh.googleusercontent.com/a-/ALV-UjUDziRL6L1Hhj4-N1-2pDTGZXWIlS1xXJ7-UIR9ddkYrEmB0I8,"This is one of the best dating apps for adults, especially if you're looking for curvy dating or local dating options. The app makes it easy to connect with people nearby who share similar interests, and the filters are great for finding exactly what you're looking for. The profile setup is straightforward, and the chat features make conversations flow smoothly.",4,30,1.7.9,2024-09-06 17:30:35,,,False
3fa72116-bfd3-47e2-970f-47ac090fb880,Jorge Avila,https://play-lh.googleusercontent.com/a/ACg8ocLx0inyiFkNRLRtnw5GmRKTnaG1N81m7VzupaVqEXBrZz7tCg=mo,Scam,1,0,1.8.0,2024-09-06 16:56:57,,,True
ee3700a2-e5d0-42a4-b16d-5d4fdcc3291e,Nikolaj BD,https://play-lh.googleusercontent.com/a-/ALV-UjWYc6_J2a31jNaanrExVuUCvSu8yGR-Fu9lAHzZegYFDePaiL70,The whole app is a scam so don't download it,1,0,1.7.9,2024-09-06 13:56:44,,,True
332c027d-2a0c-4b96-a56a-625a73cbec5e,Golden Boy,https://play-lh.googleusercontent.com/a/ACg8ocIkPLvnE11NqyE3fMdcLdJzrV-1ylHhoABXxiK4EQ7ecW0BGw=mo,"As far as dating apps for adults go, this one's okay. Nothing special but it gets the job done. Easy enough to set up a profile and start swiping. If you're just looking to casually date, it's fine. Could use more features though. Highly recommend",5,2,1.8.0,2024-09-06 13:42:01,,,False
c547fb69-fb21-498b-b54d-efb3f8211a35,Danny Khamo,https://play-lh.googleusercontent.com/a/ACg8ocLOfFmqQgFsm640mQEv2dgOcrEEUVcDi6vfQzxQl4ghNlyCbQ=mo,Fake app,1,0,1.7.9,2024-09-06 11:17:57,,,False
f0852f7d-5c68-4fd5-b382-cf7d0f6f7509,Richard Olinger,https://play-lh.googleusercontent.com/a/ACg8ocIoA7QSszmOkgzLjzg4aEArLcKYc57Stl0vTyBX14vnjrFviA=mo,It's a scam,1,0,1.7.9,2024-09-06 09:30:03,,,True
9f765c24-5373-4f16-bc5c-c645a549c60e,Efosa Leslie Asoro,https://play-lh.googleusercontent.com/a-/ALV-UjVn06n1LtGoDFB5VTVIUhG3H48QRgS4nwJ_W_137YsHbvL2lhgP,Awesome 👌,5,0,1.7.9,2024-09-06 04:43:44,,,False
101a886c-0c15-457f-a281-a76236d41067,Michael Weaver,https://play-lh.googleusercontent.com/a-/ALV-UjWn37tElRVVtq4DevL5x9MgKKA_iApsPDj9vBHBV6M4-k7zJQ6l,Lots of scam/spam accounts.,1,0,,2024-09-06 03:36:00,,,True
d2ce2e52-2695-4edd-b6f4-7c439958642c,Tru Knight,https://play-lh.googleusercontent.com/a/ACg8ocL5SxdgJhKeoynRMVbUqUrNGDRo271Lxk_9hb26kSnZvvZyyQ=mo,Just downloaded the app and after 5 minutes deleted my account and the app. Full of spam bots and had no real way of seeing who was near my area and didn't even see a profile talking about the interests of others,1,0,,2024-09-06 03:27:05,,,False
8a92bb36-5449-4e69-af5c-ca091f344fdb,Terrell Bogle,https://play-lh.googleusercontent.com/a-/ALV-UjWlQJEsoxTFIYcxfRBeqDs5Iomh40tSMEtz880mSxt9TDu06_rC,just started but looks fun,5,0,1.7.9,2024-09-06 00:10:51,,,False
d325cacc-c1f4-40db-b476-54a0fa11526b,Chris Linley,https://play-lh.googleusercontent.com/a/ACg8ocJcTQ9G80zyVpOuWYdvSw4SrzJap_u7KxdM8qWLpGusSwMA8H1m=mo,Just like the rest fake app with fake girls,1,0,1.7.9,2024-09-05 23:02:32,,,False
1399f11e-b23a-49ab-8364-c9a826a839b7,Sarah Carpenter,https://play-lh.googleusercontent.com/a/ACg8ocJSc4nlwOkDefd1NLdlLlMrFDL2xjKWsm3aBd6BtLTyoA57Fw=mo,This app is a scam. Seems to be okay at first then forces you into a subscription after a few short conversations in order to continue. Doesn't seem like any matches are real people. It uses bots to get you to pay for pictures and videos that need to be unlocked whenever they are received. No support and no chance of getting a refund if you get tricked into paying. Avoid this app!,1,39,,2024-09-05 20:53:53,,,True
b72e7278-993c-4882-ba90-7bb4011120f4,John Oliver,https://play-lh.googleusercontent.com/a/ACg8ocKAJcRs6lA374YyQCaF3BiSpJh3T4Ky33RtbZU3xW3ScqM_-Q=mo,"""I've been using vibe for a few weeks now,and I'm really enjoying the experience! The app is design is clean and easy to navigate .what sets it apart is the focus on genuine connections rather than just swiping . The vibe check feature is a great way to break the ice and help filter out people already, and the conversations have been more meaningful than on other apps .",5,1,,2024-09-05 16:26:41,,,False
4de02409-ede4-4cb6-a3b0-a5cd1f9b82da,Justin Rizo,https://play-lh.googleusercontent.com/a/ACg8ocLMoe9nmDJJ5v0K5j-Xp-TKkcbhn5eo0vyGm8xMVrkRpjd4DQ=mo,Scam so many bots that will waste your messages so you have to pay....I'm pretty sure the creators stole a bunch of only fans girls profiles they are all fake profiles,1,0,,2024-09-05 15:59:25,,,True
a212b34f-b267-4adf-95a7-8a425b00bfd2,Klevchenko Borskov,https://play-lh.googleusercontent.com/a-/ALV-UjVSzqvIfU_6JOqMR8GllhRF2k1xd-BwQ1jp6bH7NRKhIhi47nU,Exclusively bots. Every one of them. If I could give 0 stars I would.,1,0,,2024-09-05 15:12:10,,,False
4ecf0a35-788e-41c4-adfe-001502836778,Holly Williams,https://play-lh.googleusercontent.com/a-/ALV-UjWtA-fRg_MfOSLfUDfScTfD3RVqHHB06k3_w1VCPLiOCyB-RJKQhA,"is definitely one of the best out there! The app is incredibly user-friendly and offers a variety of features that make connecting with others easy, enjoyable and realistic. I particularly appreciate the quick responses and the fact that it is a real person you are talking to. As someone who values curvy dating, I found the community here to be welcoming and inclusive. Overall, Vibe has exceeded my expectations and I highly recommend it to anyone looking for genuine connections.",5,6,1.7.9,2024-09-05 13:47:33,,,False
c9c965f7-91b8-47d3-ac15-71144df2eb4f,Adrian Varon,https://play-lh.googleusercontent.com/a/ACg8ocLbmj5AoMKy2YTwZcQ1Y96Kl-IERlPXFH8uFsAKQHYIfUp9TA=mo,Full of bots,1,0,1.7.9,2024-09-05 11:38:47,,,False
6930e3dc-a77a-4277-bcc7-2f3dc0c0591a,Ron Leblanc,https://play-lh.googleusercontent.com/a/ACg8ocIUZlVRGQ12dVQq_Ooxdob4lwM32wAmX6GRStzD9CUol7FDyg=mo,great app! deleted my profile and I'm looking to make a new one but it won't let me and I'm sad about it,4,0,1.7.9,2024-09-05 08:07:48,,,False
f275f1db-90b9-4f50-a667-8de185ebbf98,Rick Hentz,https://play-lh.googleusercontent.com/a/ACg8ocJ141qXnZ4xkBX66QqCG-NT56LIzYbeHGTNOkOEZp7DbuypQQ=mo,DO NOT DOWNLOAD... BOT CITY AND WASTE OF TIME!!! YOU INSTANTLY GET MESSAGES FROM HOT GIRLS BUT THEN MUST PAY TO RESPOND!,1,0,1.7.9,2024-09-05 06:31:41,,,False
32cefea2-10c5-43b1-810c-ffd67a319952,cgdeath itselff,https://play-lh.googleusercontent.com/a-/ALV-UjUMbz1V2wnrKHYuiIYxwp8H6ioZJ-z_RP79sEbSSOW-OmApZfoB,"Don't download this. Stayed on for 5 minutes and was bombarded with a paywall, and then everyone started messaging (bots) afterwards. Don't do it, unless you gonna pay the paywall, and that's just to message. To see photos, you have to pay for that. Rather go to pornhub etc to see all that and it's free.",1,15,1.7.9,2024-09-05 04:07:38,,,False
d4f4aa0f-0456-491c-a90e-dfdc4be7535c,1,https://play-lh.googleusercontent.com/a/ACg8ocIfnpro5n2RFGXsLIW4u6s-fAfLHaIGEb0xo9LcdBg9_lWX=mo,Full of fake profiles and bots. You sign up and you start swiping seems to good to be true when you almost instantly match turns out it was,1,5,1.7.8,2024-09-05 03:05:11,,,True
e3c8663d-6772-42b8-ada8-a3fc35c22de9,Farhad Hossini,https://play-lh.googleusercontent.com/a-/ALV-UjV3qrOOIOXZ0syu3mIaP1CqGxGslk6jKFAuc1_CLnExMMXNYa8,ok,5,0,1.7.9,2024-09-05 00:48:27,,,False
070d8ef5-a7dc-4d5a-acd3-1134f0ebee9a,Key (Stars Faded),https://play-lh.googleusercontent.com/a-/ALV-UjV3qGExlyqc0L0NTUQ0kOev9nJHqHKERuIS9xY4zH8S2veGG1m8,Installed this just to combat the very obvious fake reviews. I did some digging around so you don't have to. Don't use this it's only designed to steal your information and money. It's a cash grab with 90% bots.,1,2,1.7.9,2024-09-04 18:51:38,,,True
b2ab4a20-de2a-4bab-a01a-bd672af0a868,Azura Elowen Peterson,https://play-lh.googleusercontent.com/a-/ALV-UjUItobRjMuvjK1FQUd0DxiejRPvGd4bFrc7TncY1wWz5UhwTyle,"This is one of the best dating apps for adults I’ve come across. It offers a great experience for curvy dating, with a welcoming community that celebrates all body types. The local dating feature is incredibly useful, making it easy to find and connect with people in your area. Overall, this app provides a fun and genuine way to meet new people!",5,4,1.7.9,2024-09-04 14:20:37,,,False
c5a889ec-1e12-4857-bc28-bb4a9e241892,Eva,https://play-lh.googleusercontent.com/a/ACg8ocKrnXH24mi5ICaSDCJ6X0b5OY6-cG7Gr2GvvPIuz2H9RV53Lw=mo,"This is one of the best dating apps for adults I have tried. It's excellent for curvy dating and finding local matches. One thing about this app is that you can easily connect and meet up with people. The app is very easy to use, and I have met some really nice people nearby. If you are looking for local dating, give this app a try!",5,0,,2024-09-04 12:30:26,,,False
989c7f6e-6599-479f-bf59-f0bb4da5c86f,JohnnyNonny,https://play-lh.googleusercontent.com/a-/ALV-UjXJLM91DqpfpzVAlyBvjLBhFgaDQK9lc3BQC81JyyddJRITnRFz,This is a Chinese pyramid scheme designed to suck you out of your money by making you pay for everything,1,1,1.7.9,2024-09-04 12:25:25,,,True
a13e1c63-3756-4f9c-aba2-d2b6c6cc66d3,Jobi Bindhu,https://play-lh.googleusercontent.com/a-/ALV-UjVrCBcJql_vwUu6QwViSMXhQ3TGT--wdCHeZBpFwKLaiM6eSEkA,"Although some advanced features require payment, I believe the basic features are already outstanding and worth a try. Overall, this is a very excellent dating app, recommended for those who are seriously looking for meaningful relationships.",5,0,1.7.9,2024-09-04 11:44:31,,,False
3af57ab6-b1c7-4f2e-ac5b-07696780ef6f,Mitchell Kean,https://play-lh.googleusercontent.com/a/ACg8ocIpDqzaipuuQzv7Thu0hZ1UtwyfgWBKRi8EdOC5qeKi-Ji_sw=mo,Complete scam app designed to make you purchase a subscription. They immediately send a bot account to try convince you to purchase a subscription to keep talking.,1,4,1.7.9,2024-09-04 11:12:03,,,True
92890269-fe25-4acb-a219-e9b06d736a87,Dorothy Richard,https://play-lh.googleusercontent.com/a/ACg8ocI2z1GTGhvE_6Mav-ToHQ6q9lWWyb4hvl_Ccq4K187mDL-8Kg=mo,"Great Experience I've been using this vibe app for a few weeks now, and it has been a game changer, The interface is easy to navigate, and I love the unique vibe checks that make matches more meaningful. It feels much safer than other dating apps because of the extra verification step. I've already connected with some great people who share my interest. Highly recommended",5,2,,2024-09-04 05:48:47,,,False
ab3d0fc0-83cf-4e70-b961-86c4e6c38226,Glyan14,https://play-lh.googleusercontent.com/a-/ALV-UjU6aBwZ9LkdGOjzVV-E_JEU5jQI0w9cmg34Xx66uE-6krp6MX4U,"Full of bots, and then when you chat, they want you to pay. SCAM!",1,1,,2024-09-04 03:49:53,,,True
63145fdf-4679-4f2c-8fbf-dbee14db1c97,Calvin G,https://play-lh.googleusercontent.com/a-/ALV-UjXoNm-V6U2SwVhcstaFLTZnxCVfajT9AFfoOFrcy68AHmP4DZ90,Bot profiles.,1,0,1.7.9,2024-09-04 03:05:24,,,False
4645b6fd-8749-4d17-b335-86d96af95329,Ostang Vulkahn,https://play-lh.googleusercontent.com/a-/ALV-UjWPnalKoFzFjQlstvZqtPLc3t71loI5qXPrkL6b2jUQpF_vMEc,Got a bot wooo,1,0,,2024-09-03 22:42:11,,,False
8d7e592c-6934-4b8e-9062-37d8d4f755e2,Camren Smith,https://play-lh.googleusercontent.com/a-/ALV-UjXMqvCYdfOhxvGZGlOiUfBaS1T7GyYE9efYZ9qhJQQENtqu7ECj,meeting lots of people some kind caring others just want someone to talk to it's great I love it,4,0,1.7.9,2024-09-03 19:33:10,,,False
5a26cb6b-bb6e-41d4-920e-2fb59a1c0eba,Dionne King,https://play-lh.googleusercontent.com/a/ACg8ocI1bVmKEq5dLID2gafSjshobbJ1fbz4_B4oSHqbS9-qQFrd1g=mo,Do NOT download this app. Every single person that messages you is a bot. Do NOT spend your money to keep talking on here.,1,1,1.7.9,2024-09-03 06:06:33,,,True
6d0b42e0-8e3b-4bcd-800c-1d2d3975d973,Cameron White,https://play-lh.googleusercontent.com/a-/ALV-UjWr_kkA91jDHfcI7_TNUeJJnabCdF1n3dKIsUm3qyCCgGz_XhD8,Fake,1,0,1.7.9,2024-09-03 02:44:32,,,False
6a4f5bbd-eddb-4143-98c6-2259d8e7d101,Justin Ingraham,https://play-lh.googleusercontent.com/a/ACg8ocIFR6MvOp4ZxhS3SdMFNcSXECQFI_wYbPcZRyLA8MbGxBkmYw=mo,Starts as basic free app and shortly changes to paid only.,1,0,,2024-09-02 19:54:24,,,False
b24e5746-19e4-403d-88a2-b9b15d1fa3a7,Brandon Moses,https://play-lh.googleusercontent.com/a/ACg8ocIE4ob8uitHBnAbwsuwFEZNsGyFog0eT0vwRHvQDIKE6-2AXw=mo,This app is a scam. It's all bots. Over 30 wemon and all have been bots.,1,1,1.7.8,2024-09-02 14:24:21,,,True
717a80e6-4b9e-4e31-a59d-d10575135d7e,Ben Haddow,https://play-lh.googleusercontent.com/a/ACg8ocI4mZT-dIJ7Z4X-cxAIAaXgKZN5SozIsXkTt8uBBqnV3klVPw=mo,"Pathetic app, claims to be free but once you get messages from bots it ask you subscribe",1,0,1.7.9,2024-09-02 14:17:28,,,False
3e2aad6e-b714-4d81-819e-0c1a8b122284,Gartee Guar,https://play-lh.googleusercontent.com/a/ACg8ocLsSHbwF-QNUNXT1fvGOWBXYblog_U-n2U6Y84GB9QG7Hy6zw=mo,Seems like a good dating app for adults. People respond quickly and there seems to be lots of beautiful girls on here. Some are local and some visit from other places. It might take dating to the next level.,5,0,1.7.9,2024-09-02 13:25:53,,,False
be0748a0-cea2-44b4-ae2a-1fa5983887db,Jedidiah,https://play-lh.googleusercontent.com/a-/ALV-UjV_CC_ltLaA8qBM5ari7dq8TFtqOCJZtrPSD3OgbgYQ1gU7SbId,boing boing boing,5,0,1.7.8,2024-09-02 08:58:33,,,False
5f7fb044-f8e1-4ca8-beed-4512bad13c58,Jesse Hull,https://play-lh.googleusercontent.com/a/ACg8ocJfPoM3ZQW-nkSHshslwrFG941L-UJRQM55zCNS2OxuZ0nrJw=mo,Complete scam. Nothing is free. They make you pay a sub to chat. The girls are all way out of your league and super responsive. After you become a sub they start sending pics and videos that you have to pay for. None of the girls will meet up. The girls are likely Ai,1,0,,2024-09-02 05:49:23,,,True
429727f2-aa02-4ff5-a3cb-115f67dc4f8a,Tom Simpson,https://play-lh.googleusercontent.com/a-/ALV-UjWiCES_Zdkc9KSO-MnZzqHTdPCKMP0QnTFGpciqxSkccRPH6Ed5,Too short of free period,1,0,1.7.9,2024-09-02 04:29:46,,,False
bc013583-42a3-4f1b-96e9-e83517d0838d,Cameron Marshall,https://play-lh.googleusercontent.com/a/ACg8ocJQM9xivzAFvzdw8f5Rw4LXmLb0z908gfRRXeQqNVin0E9hbw=mo,Have to pay to actually use the app properly. Not worth it when there are multiple free dating apps out there. Also looked like some of the matches where scams.,1,0,,2024-09-02 02:31:57,,,True
79dcc72f-f236-4f84-b8dc-448524eba491,abny luberis,https://play-lh.googleusercontent.com/a/ACg8ocJYl9Iok4i085G8h0Dw-szPbWZUMKlVGgPFPYZLaobDv3Tijw=mo,"Fake. Everyone is a bot. I live in the middle of nowhere. I know who lives around here, and I've never seen any of these girls around here",1,0,1.7.9,2024-09-02 00:02:09,,,False
d56c4222-5029-409b-8718-9077b2d8e85c,Mathew Muldrow,https://play-lh.googleusercontent.com/a-/ALV-UjWOuQ3PuIpO9LH7UXP7FsiXXmC3-tNB9P3ysVck1xHTCfr2hhCU,Bots...,1,0,1.7.8,2024-09-01 18:49:13,,,False
a38f0efc-6ff3-4712-a2eb-72f656f57f1e,Gerardo Aguilar,https://play-lh.googleusercontent.com/a-/ALV-UjWxdrSInAvjzpxqNtgRwbGsJQC_gaB9MUD4iMRx4VD_IMsBMhiy,All bots photo views cost money video view cost money all the bots want you to buy more views just a plain scam,1,0,1.7.9,2024-09-01 14:43:02,,,True
3a73cb1c-929b-4328-9136-b6b2b91fa116,Steve Ayala,https://play-lh.googleusercontent.com/a/ACg8ocKaoxMA8v_ioNt96vwyUvDbd3dA2va-WEzKCeTZAWMfL0t53Q=mo,Ew,1,0,,2024-09-01 11:53:50,,,False
a94c578a-9961-4414-8743-558d5bd878ec,I am Bodybuilding YT,https://play-lh.googleusercontent.com/a-/ALV-UjVZ8hOd6I-kxzZuvI_uHTwUpdw7LiFEEwnMpJykk6sIwNhb7Mo,This app is just bots just filled with bots not 1 real person don't waster ur time,1,1,,2024-09-01 07:23:23,,,False
76ba4cbf-c94b-4b6a-b08f-d7cd7e3f1f6e,Judge R,https://play-lh.googleusercontent.com/a/ACg8ocLWeu_INDV1DgnsfZQhwIRaercvUgaH9cncf-0cR0Ca9y887g=mo,Would give it 0 if I could. Get 5 messages then pay stupid amount of money afterwards total scam.,1,0,,2024-09-01 06:11:23,,,True
04e6f9c9-7a0c-4b8d-b774-82b43cb01040,marc,https://play-lh.googleusercontent.com/a-/ALV-UjWmTRZ8kmtZg6QkRTTZLwhkxu0tdCFcp4xpup24KwpuT5ah-hSI,"Nothing but bots don't bother with the app, it's a waste of time",1,0,,2024-09-01 03:44:57,,,False
537637c8-5f4c-4750-b156-c7c014781c70,Dale Greer,https://play-lh.googleusercontent.com/a-/ALV-UjVvLbIPLPcr7Kop0qRbyK2rspzcislMcZjRx2YFNv5IPwQGcY4,"You are immediately bombarded by all these fake bots that are talking all kinds of mad stuff, until you gotta pay lol. So crazy",1,0,,2024-09-01 01:59:53,,,False
f72f2ae9-b5fe-41ef-9a7f-dd105ae59562,Melissa DeRose,https://play-lh.googleusercontent.com/a/ACg8ocLqBv7DqHTLtpXse4OS6_qjV61FIvsCZ8yVMXEB9bzqqGiykA=mo,cool app,5,0,1.7.9,2024-09-01 01:01:11,,,False
8f9f04fb-f8ed-4226-9683-3059efaed848,slayerlongsword gaming,https://play-lh.googleusercontent.com/a-/ALV-UjVQfqjpRHznrOwmRoKyuPL6hZI7arkYZSXRB2HLdd87mcuSgDqj,Bots,1,0,1.7.8,2024-08-31 19:53:42,,,False
d3f7e85a-4d98-4f7c-bb6c-7cc145d25f2c,SIN SERIOUS,https://play-lh.googleusercontent.com/a-/ALV-UjV5R6mURXPvYhGDV0i-P0nu-9x8p5b5N8ZMLzHnUL33_Uv2l4SDeg,This app is not free do not download you will be disappointed.,1,0,1.7.8,2024-08-31 19:00:50,,,False
3f29c715-44d7-4888-b8ee-a20fe097bbed,Jeremy Wendt,https://play-lh.googleusercontent.com/a/ACg8ocL2cmNRAz9M1qGj00PpnQsBV9nlrhJwXVbGXEfYOLlQPwVJjw=mo,Great so far,5,0,1.7.8,2024-08-31 17:59:26,,,False
a96398c3-c966-453e-91b0-7ccdb247e2d3,Tal,https://play-lh.googleusercontent.com/a-/ALV-UjUOO8jgkuTmWFg4HZvp2k3Ngo4sXfFIV9p2n_MgwX4EBO_54vhZ,"Fake app designed to prey on lonely individuals, full of bots and asks you to pay after only a few messages",1,0,,2024-08-31 17:40:56,,,False
9b32d94d-48c6-414f-8cbc-804f8ae25c25,L Hill,https://play-lh.googleusercontent.com/a/ACg8ocI27GYiCv6OYelY38herLgqfyBuIzEV0kRIZ1yM_WUB8GZE_g=mo,"Full of bots, not a single real woman, and have to pay to see pics and videos they send you.",1,0,,2024-08-31 16:27:47,,,False
11bec4ed-270c-42d6-bb09-6242464ac547,Jonathan Perry,https://play-lh.googleusercontent.com/a-/ALV-UjXesVOjf2P4l8VtfApqpj7zvjnfO1cB0MFNJCRnr-DF8jf_gKl7,"Was like by a bot, the conversation lasted long enough to run out the free messages and then encouraged to purchase a premium subscription. I held a completely nonsense conversation where all the things said, like turtle turds taste terrible was my message, and the response was I like talking to you. Want to talk irl? The app is marketed as completely free and then to trick people with bots to run out the free aspect to force a purchase is lame and bad business. Do not buy and do not download.",1,13,1.7.8,2024-08-31 13:43:23,,,False
dee592c7-91ac-4e5c-b2d3-5426ec087908,Hanan Eafergan,https://play-lh.googleusercontent.com/a-/ALV-UjWuyA4Yxjc9gUtggkh5B1-vgoievTEnmAXsP-ePUoqh_sA8bfBq,"Doesn't seem legit, 100% fake users and bots. Saved you the time ;)",1,0,1.7.8,2024-08-31 13:32:16,,,False
6ff5b8bd-055e-4d13-8fb0-b26cb950bf51,Benton Ashby,https://play-lh.googleusercontent.com/a/ACg8ocKa_2k-x08XxVFwM3gVmgmc0pk03MdNHX496RYtH-u08o2Vyw=mo,massive scam avoid,1,0,1.7.8,2024-08-31 11:30:51,,,True
f39851b5-d047-4bdc-adf4-51d4e5b73a4e,Mr Snuggles,https://play-lh.googleusercontent.com/a/ACg8ocKh5DW4MzkrvS_Ke6rKWnhbMcCJr0NeRqwN5U9bN5NTJ2JggA=mo,"With in 5 minutes i had 6 bots messaging me, it was actually comical",1,1,1.7.8,2024-08-31 10:13:40,,,False
1a57e41f-4627-4684-8b72-a2d02dc704db,hardXMR,https://play-lh.googleusercontent.com/a/ACg8ocJAyo3Fda5GHzN8HuYh5f-Ax74Jho7zI5hhqCVBYuiHN7CYeA=mo,this is the best app,5,0,1.7.8,2024-08-31 07:16:04,,,False
621e9104-1cbb-48d5-9932-9602b421ccf7,Hard Headed,https://play-lh.googleusercontent.com/a/ACg8ocKuiDtgP22HoT95WLx7Pl8MX-GquZYtRTPoilV0S3qu86coAKmB=mo,IMMEDIATELY swamped by bots. All supermodels. AI we straight sexual and graphic. Then the paywall.,1,0,1.7.8,2024-08-31 04:30:23,,,False
215d6520-e8d5-4d1e-ba88-671e58ec35a0,julian disla,https://play-lh.googleusercontent.com/a-/ALV-UjVHGY2Ce1A541JlPnLQ40_kcMYEGPNuIGobTKgfl5kegYGqbxr_Bw,Great app,5,0,1.7.8,2024-08-31 01:02:37,,,False
8994e7c8-9f93-4714-84aa-db9c7f699615,Dilly Hay,https://play-lh.googleusercontent.com/a-/ALV-UjX3tZ9A00Kz8fM2raJhnK0LzL4Tb1VTJohmKNXjVDzc64CESK5o,THIS APP IS A SCAM LOL ALL BOTS TRYONG TO GET YOYR MONEY DO NOT DOWNLOAD,1,0,,2024-08-30 15:10:59,,,True
b044c8d5-9dca-43fc-b664-483766ffaaa3,Mahsa Salmani,https://play-lh.googleusercontent.com/a/ACg8ocKRoYd2o-YeUyFAtnrIu6qS5wZ8hz8GnubISMDOvgznM9ftFA=mo,good,5,0,1.7.8,2024-08-30 11:27:51,,,False
d15d01b5-673d-4c80-a59b-8fb9de8faf51,Brandon Schnur,https://play-lh.googleusercontent.com/a-/ALV-UjW8nzL7Nr4NuP_Rzpwk6MIjALEKBbX_gwMEK8je8DTg_mI5IPo,This is the closest thing to spamware you can get in an app. Pure garbage and fake.,1,0,,2024-08-30 04:29:20,,,False
69989353-8569-4006-9a1f-774a0e4cee80,Nik E,https://play-lh.googleusercontent.com/a-/ALV-UjWRD1GiRTtfLm-FY5rp_nFYd9hV7BEOcbJFnl43-5xtw6CYcIoZ,"It's definitely a money grab app. There's a few different paywalls and each one tells you it gives you everything. Every message is clearly ai, and I've had famous cosplayers and even porn stars hit me up. They just got chat gpt trying to grind you for buying picture and photo unlocks of stolen images",1,6,1.7.8,2024-08-30 03:03:19,,,True
00d6d5df-ca9c-42e8-a426-88fbbee94f86,Kyle Iorn,https://play-lh.googleusercontent.com/a-/ALV-UjVqnLslELSQkAO6xzAFbQv8-tLAg8E6FX6-SqHflnT3Ccd4S8S8,👍,5,0,1.7.8,2024-08-30 02:10:03,,,False
e220b165-925b-447f-b3fb-ad6c39544aa7,Moses Graham,https://play-lh.googleusercontent.com/a/ACg8ocLQTAa8jri01bqAMCbeHRyl1C8DbdsLViY1-CyGLKSkfjswCA=mo,Scam with the thickest paywall ever,1,0,,2024-08-29 20:19:35,,,True
ef9ff27e-5e82-4894-967e-d7d64e4f02cc,Keith Weidner,https://play-lh.googleusercontent.com/a-/ALV-UjW80rcmYaqP_IGoXxiLaUoRUYvSb1qyALs4ononB6CbIy04dQCt,"AI bots, and not even good ones, disguised as a dating app. You'll match anyone you like, their messages don't even really acknowledge yours. One asked for a selfie and I sent a cat pic and it was like ""oh you're hot, you packin?????"" After s few minutes the ap locks behind a pay wall. Can't do anything without a payment. Deleted without paying because it's clearly fake.",1,0,,2024-08-29 14:41:12,,,False
c5acd980-d849-4294-ab98-f319e168bbde,Sean White,https://play-lh.googleusercontent.com/a-/ALV-UjW2SkiY3It7XLzcXVCaAbI2z7enjHAXotqakpp0Qsdxm76mWUbO,awesome experience,5,0,1.7.8,2024-08-29 08:15:32,,,False
0eb4cf01-c9a0-499f-acaa-267d8cd27efa,Noah Pollock,https://play-lh.googleusercontent.com/a/ACg8ocKfkCtjb09hooiyXCB-yY7Kjj42qJXjjppjSGfMe40o4K7z6Q=mo,Chatted with bots and then it required payment to continue,2,0,,2024-08-29 06:24:36,,,False
3caf2854-0eda-4e13-b9f0-d89e9d1a1103,Roberto Solis Rodriguez,https://play-lh.googleusercontent.com/a-/ALV-UjXJ0prr49enkUEF9JMyKL1c58TF_pJGDGRTa3Vq3TPS7vf6_IbqIQ,THIS APP IS A SCAM!!! It uses a bot to send you messages and a close location near you. In order to activate you newly created account you need to pay. You don't even get to experience the app and it's features at all. REPORT THIS APP!!!,1,20,1.7.8,2024-08-29 06:21:28,,,True
9e3332df-89db-42a7-b388-ee9d9c2a17a2,erik olsen,https://play-lh.googleusercontent.com/a-/ALV-UjU-ogNKWGVtB9blHIRtrvZk9kilY_d9JnFOtEu6TkXbqUU9r6Y,This is. One hundred percent a scam Is there all ai.,1,0,1.7.8,2024-08-29 06:15:01,,,True
f12a22e1-f971-4666-bc0e-f1b1156638fc,Ronald Coker,https://play-lh.googleusercontent.com/a-/ALV-UjXx-c-0N1iKx4RzlOgLJzkqhdcD2A7xLIDSqJvor8oSZ5vo_5Ol,"This app is stupid, send 3 messages for free then they want you to pay. It's nothing but fake profiles.",1,1,1.7.8,2024-08-29 05:49:02,,,True
0b609f4f-f4d0-4db4-a71e-1dd6f3bf5da0,xsmokenmirrorsx,https://play-lh.googleusercontent.com/a-/ALV-UjUg-lgzKnMJT4ydCYuM6WklR4A-W5_xd66wE9daDxpFvWPUXBED,Bots from the go then want you to buy premium after like 3 mins,1,0,1.7.8,2024-08-29 04:53:58,,,False
b7f13270-5456-4669-b464-cdb38e34d720,Danny Mitchener,https://play-lh.googleusercontent.com/a-/ALV-UjUHRvcdGJUunzyi3anUeRMEzMZ74x-DqHmE-BsHH_UAa_fe6EXn,good app,5,0,1.7.8,2024-08-29 02:56:11,,,False
bdf953f0-9198-47cc-ade0-63de5922d6d9,Homer Simpson,https://play-lh.googleusercontent.com/a/ACg8ocLLpSBKUKH0_Y6FpX7AjcQcr6CMOaoBbOQS1eAU9XWk5A6qRA=mo,Spam upon spam upon spam. 🙄,1,0,1.7.8,2024-08-29 00:40:42,,,False
bd68a5a7-8ef6-4742-b803-36ff0aa50345,Guillaume Cartier,https://play-lh.googleusercontent.com/a-/ALV-UjWVI9524E7RA-wcnqBCcjtbtPl2x7czH6Y-y6bAMllS0xuUxCdz,"Definetly a scam, got a match and conversation almost immediately and the ""person"" (most definetly a bot or catfish) was insistent to meet right away. Right when they siggested to videocall, a paywall popped up and you cant do anything unless you pay (i suppose, cause I didn't pay) I hope people read this before getting caught.",1,0,,2024-08-28 23:52:56,,,True
