reviewId,userName,userImage,content,score,thumbsUp,appVersion,at,replyContent,repliedAt,scam_related
bb4b11ce-599b-4de4-8643-830a13257e41,nolliD redinS,https://play-lh.googleusercontent.com/a/ACg8ocKNQMT3Xd_odqf8-r-nPckw38CYpIm82d5vizVwWlJ6gIEzcg=mo,"Full of bots and have to pay after the first few messages. Sent about 10 messages messing with a bot and I can't send messages unless I buy a subscription. Getting constantly bombarded by bots hitting me up with the usual ""I'm close wanna hook up"" type stuff. Don't download.",1,4,1.8.2,2024-10-16 04:23:46,,,False
f10343de-9718-4d91-8da3-701459c9f2d9,Bryan Arce,https://play-lh.googleusercontent.com/a/ACg8ocLBSMWiaRclimsnnycbTl4fHi25r4R4N0yOsj0iGDNKXT00Kw=mo,Pay to play. You can't even chat to anyone after like 5 message,1,1,1.8.2,2024-10-16 03:18:05,,,False
3470805e-ff64-4c5b-9af9-67a9041efbc4,Farah Jami,https://play-lh.googleusercontent.com/a-/ALV-UjXZeTfBUuod0xSeAJFzi0paW4g9E4aUe2sBmKZUlc_UAIgs0OWsAA,It's fake,1,0,,2024-10-16 03:17:00,,,False
6a7d3713-47f3-49ea-9bd4-f7df9dabaea9,David Attenborough,https://play-lh.googleusercontent.com/a-/ALV-UjXKfoT-qwOHzE17eGY9t7-YyUq42Q4LqysznbV_fomJY-TAii0,"Within minutes of downloading the app, before I even had my profile set up, I was already getting ""matches"" from bots. Deleted it within 5 minutes of downloading",1,0,,2024-10-16 02:40:45,,,False
361e6d26-3373-4ed4-9cc6-77797098a37a,Troy Sr,https://play-lh.googleusercontent.com/a-/ALV-UjWrAeED_-LdDaaoO_j6I_WMRBDMEyFyG0h1ciQo_QG8IpfCqxYK,this better be free or deleting the app,5,0,1.8.2,2024-10-15 23:24:54,,,False
05cd9652-c991-45dd-91c3-fc459a0d0fcd,Ian Knutz,https://play-lh.googleusercontent.com/a/ACg8ocKjqL1AUs1CyN4IY1l3W3ZQ3kiIwJUTDVTEuoqhJNUTxXNpmA=mo,This app is trash. I bought 3 months of premium and i cant do anything with anything of there rhen have to buy premium again and again none the fact that they dont even check there email for peopl eqho need help,1,2,1.8.2,2024-10-15 22:20:32,,,False
03fb773c-ca45-4c9b-bf29-1820ef6e2d46,Nathan Banks,https://play-lh.googleusercontent.com/a/ACg8ocLAn7F0NFvexbMOkklyFyN0O4k3o8foLUlq3Juo36_lsWODKQ=mo,"This app is a scam. Fraud, in fact. Paying for premium unlocks zero premium features",1,1,1.8.2,2024-10-15 14:59:52,,,True
bd132454-74fb-4ca3-872b-2c9e04ea58ed,Daniel Kareem,https://play-lh.googleusercontent.com/a/ACg8ocIucFwNqjdYrU2ziSWCrg0dHvDTAUwV-Z487_RYOwqCg1m-2g=mo,This app is not useful at all never use it,1,1,1.8.2,2024-10-15 10:51:51,,,False
83c287d1-9777-4757-830e-71caf12ef474,Ziggy Francisco,https://play-lh.googleusercontent.com/a-/ALV-UjWko9ZFOag586x_GxFUOHJc-Bbm60r0OHxG1mkZ7C5VpxLf9T6C,"I was immediately flooded with bots in my dms, I messaged one a few times just to make sure it was a bot because it was claiming to be in my city and asking me to meet up somewhere kinda close (which is horrifying) and then I wasted all my free messages. I doubt there are real users here.",1,2,1.8.2,2024-10-15 06:34:13,,,False
d0daee7b-78d2-433b-b604-dd62bf7d698a,Roger Cabell,https://play-lh.googleusercontent.com/a-/ALV-UjVLBN5gqKdQe78M7NdAqc8gJfgSbBYNEAZ3jLIVaFL1N1vnJZbq,Scam nothing but bots,1,0,1.8.2,2024-10-15 02:28:02,,,True
64d33380-b61e-4854-9682-2c6f34a85c1d,Michael Skidmore,https://play-lh.googleusercontent.com/a/ACg8ocKAD1p3ILma99RJiNwEidxusB3InLQ0xzbcDVJdSjJFzxVkEIJ4=mo,just got the ap I will let u know if it's actually free or not,5,0,1.8.2,2024-10-15 01:42:27,,,False
8503c00a-5145-466e-854e-9a02ec8bbb0a,Jacob Majewski,https://play-lh.googleusercontent.com/a-/ALV-UjWAGbMW2a5gomcARTVUaRUNMbvE5RaVWIVEEssjiwLmzpGaWgoc7g,Don't buy this app. It's a waste of time. Every single girl i like was a bot that wanted me to spend money on there naked videos and pictures. If I wanted to do that I would have gone to onlyfans. I would like a refund of my $19.99 cuz this app was worthless.,1,2,1.8.2,2024-10-15 00:45:11,,,True
3428404d-326d-44cb-bada-0b9524f1ee36,Judah V. Pedro Kantor,https://play-lh.googleusercontent.com/a-/ALV-UjWqyCKz71kbWm6PYbN2dZYZXnImAcvNtZO71azbi6EYQ0UdvGLG,Scum,1,0,1.8.2,2024-10-14 22:50:46,,,False
8a46d08c-0f15-4cb0-baa2-895af5f8be93,William Bousman,https://play-lh.googleusercontent.com/a/ACg8ocIKjrorauMcfjCnN0LWgPvfJWnYMvTNbANrxfjlh9cmZkdd6w=mo,Just signed up ! Looks promising!,5,0,1.8.2,2024-10-14 22:07:52,,,False
7f59498a-1b72-49a6-a726-5a968ac14e48,Damilare Oyebamiji,https://play-lh.googleusercontent.com/a/ACg8ocInbkmCMmgygYjgWouT7k_YvawRv0cSE6DAtKecHy4I-sn5Ag=mo,"I've been using Vibe for some time now, and it has truly transformed my dating experience. The app's smooth interface makes navigation easy, and I love the unique vibe checks that help create more meaningful matches. It also feels much safer with the extra verification step, which sets it apart from other apps. I've already connected with incredible people who share my interests. Highly recommended!",5,1,,2024-10-14 17:15:44,,,False
f22a8663-1281-4372-beca-1775dd64d3be,Gabriel,https://play-lh.googleusercontent.com/a/ACg8ocIXOJeievdxdYESheGPsadQutobkhMewnnpdC06lmtgMw-_1Q=mo,"Vibe Dating App is a fantastic dating app for adults! It's perfect for anyone looking for meaningful connections, especially if you're interested in curvy dating. The interface is easy to use, and it helps you find matches locally, making local dating so much easier and more enjoyable. I highly recommend this app for anyone who wants to meet new people and explore different dating options.",5,354,1.8.2,2024-10-14 16:52:45,,,False
5e02686b-ee44-4450-81f6-090fd87af240,Bad Cuervo,https://play-lh.googleusercontent.com/a-/ALV-UjV7T1freIV4w8IHuWhk1HEgNMtaXEtalyqwp0lc02-C6rE0pr-x-A,awesome,5,0,1.8.2,2024-10-14 16:10:15,,,False
4a95c347-dc0e-42a9-8928-4d2a91cc71fa,Mark Powers,https://play-lh.googleusercontent.com/a/ACg8ocIlfGhz-03d9F_UypUCE-v9Va6vV5aas4nQtduQZ-7Wbt-q_w=mo,Flooded with bots and scammers,1,0,1.8.2,2024-10-14 14:08:34,,,True
9dea933a-e909-4cc6-8432-3125ca8ff665,Secure Reivitt,https://play-lh.googleusercontent.com/a-/ALV-UjV6nZ-IgWQmwxbHZxmEm-RQb0N1iYtuD8yiIT5DzKgmfNxXE0kU,great app so far,5,0,1.8.2,2024-10-14 11:03:38,,,False
8aba3330-c44a-4f5b-b2ff-93f4462a6f2a,nathan stewart,https://play-lh.googleusercontent.com/a-/ALV-UjXo6cN8hZGKa_9vxLLop-4044cz7Ci7MI9rTRv4nczukeYtrnA,It's absolutely terrible. I think that everyone is a bot. I think that the site robbed me of my subscription fee and this app is a waste of money and time. I'd love to get my money back and delete it.,1,2,1.8.2,2024-10-14 10:04:46,,,True
fef927fb-2efd-442f-b923-1003721b9a2d,Paul Brown,https://play-lh.googleusercontent.com/a/ACg8ocLcbZ8lqF_ZmibnoHfKdEnPboDEAsTGTYeH2Ch5NpcjPx07Ww=mo,Scamm,1,0,,2024-10-14 09:30:21,,,True
4a810b59-0ce5-4a65-b223-1c156aaa0a97,Cole Tucker,https://play-lh.googleusercontent.com/a-/ALV-UjXw9lPAvP9QQvxU52H0YUS-m9S0I29mrRknwuyxc06QLhIPnXs,It's good if you want to mess with bots lol,1,0,1.8.2,2024-10-14 08:38:25,,,False
762d8b48-a8c2-49fb-b9a6-b1ecc03c12a2,Brandon Fleetwood,https://play-lh.googleusercontent.com/a/ACg8ocJGLObgos9fw2DerbeIKmdBIcD0RbQXCT8epTbuSZBDdqy2rA=mo,What kind of dating app is this I am just trying to talk to women and hopefully trying to build some relationship with someone but all these women I keep speaking to eventually just want to keep showing me pictures and or videos of them being naked I don't know what type of app this is but it's not right I'm starting to think it's just paid The only reason why I'm giving you two stars it's because at least I'm talking to someone I would write a longer review give me the email for me to do that.,2,2,1.8.2,2024-10-14 07:22:58,,,False
e474b9c4-04a5-4937-94ea-5afee862033a,NecroKing,https://play-lh.googleusercontent.com/a-/ALV-UjUuFARdGGEhTILANbO27CytDWuOpYc-SrJ5wjDbTCLDz8hxQ0QC,"Fake, money grab and a scam do not download this app it sucks and full of bots",1,1,1.8.2,2024-10-14 06:24:05,,,True
e53184e1-03d4-4243-9cf9-97f887b1fc4d,James Guider,https://play-lh.googleusercontent.com/a-/ALV-UjWxU_h4HiajqDYLOj_yZ3EDl84gKgNgtkqvmWsCV79eTmRTCH7z,"Very nice, girl wanna FaceTime before we meet. That's wat I'm looking for.",5,0,1.8.2,2024-10-14 06:20:30,,,False
27143965-8c35-43fc-9aed-22eb3498868d,Coretta Gallagher,https://play-lh.googleusercontent.com/a-/ALV-UjW4Wke7qXmUiGgL6bnZEhT8oWrw-nKWzNi-wWHXFkIsYGmSghPw,This app is totally a scam I deleted my account and did another account and got messages from the same exact order with the same exact messages even though I was looking for men no men showed up on this app don't download this,1,2,1.8.2,2024-10-14 06:14:30,,,True
2362c06f-a5bd-4771-942a-5b865c2ab7c2,JOSHaka OGER,https://play-lh.googleusercontent.com/a-/ALV-UjXW5rvk6rFAPX4yGpidVPlw4hpexCHe8FTAf3qYt0W1ez5W1Ab6mg,"This app should get 0 all fakes with 3 pics not even don't making profile 5+ blowing me up sending pics and videos ""wanna see more bs"" then says to meet up .... INSANITY",1,0,1.8.2,2024-10-14 05:37:20,,,False
8b396616-7903-4dc0-8265-39a7dcd8bd2a,Jadin Kellie,https://play-lh.googleusercontent.com/a-/ALV-UjVVXUBPLwobWA_07oMqISZViWEZQ77Q3mpNMxIohoHqJitXD3Gs,So many bots do not download,1,0,,2024-10-14 05:04:04,,,False
06e75f72-ee11-40b8-bd42-4d5692df18f7,Joshua Bennetts,https://play-lh.googleusercontent.com/a/ACg8ocL-NWAyYqv6ObOUPEcLiiRfag2_zJ8oqM4UplExx6SrK6tZDg=mo,"Not only do they charge you a subscription, but they also make you pay extra on top of that to see pictures and videos that ""other users"" send you. And they also only send you 20 people a day of which I'm 99% sure are all bots or scammers",1,3,1.8.2,2024-10-14 03:54:47,,,True
5657f0ea-fa1e-4882-959e-cd1d1e418c75,Dontay Kearney,https://play-lh.googleusercontent.com/a-/ALV-UjUCfePXMqb84TnnvpOkRirMV8jr0mfhjtbQonByz6k0c_2Afhae,App is just bots no real people,1,0,1.8.2,2024-10-14 01:23:57,,,False
5c644305-0816-4463-899a-39973af9ae6b,Cameron Lien,https://play-lh.googleusercontent.com/a-/ALV-UjWa1Qo9HGMGe-sWldsdRQ3ipcToniIfWzq3YaQtr-lma6NU3hQ,GARBAGE!!!!!!! DO NOT DOWNLOAD,1,0,1.8.2,2024-10-14 00:23:58,,,False
8dbea84e-fca0-4198-8d68-25efd8dc5343,Patrick Harris,https://play-lh.googleusercontent.com/a/ACg8ocI2YsiRMFWGCEPmNiFvb7DSw3XW6ZRamsIZjez_8mJGJA9h3A=mo,Trash,1,0,,2024-10-13 22:47:27,,,False
d62baf23-36f9-4e99-b964-294409932fb9,Brian Edwards,https://play-lh.googleusercontent.com/a-/ALV-UjXkdjQnaG1oPPXDS853Of_9bM17vZqW8OXgC_JHRYj38zg2Y0Tm,"Paywall after 5 min and feels full of bits....lots and lots of bits. Or just thirsty catfish. Plus side, self destructive photos",1,0,1.8.2,2024-10-13 22:45:31,,,False
99961711-e7e3-4a29-84bc-176b150284a7,Jony Quinones,https://play-lh.googleusercontent.com/a-/ALV-UjXVJuyqbJ_xw_aIbuTnr64xBVYf4dTNa6yDoKYSoJEpmFHk3BcL,Bot comments for the app reviews and bot users within the app. Don't download the app.,1,1,1.8.2,2024-10-13 19:46:38,,,False
bb777638-1310-4cfd-a0a4-6bb056c9f461,Wayne Olson,https://play-lh.googleusercontent.com/a/ACg8ocI-oWub5Tz57AZVgg4Lr0ykt2KgzPxPZ8xRtjKlC8r_xcnn2w=mo,"Vibe is a breath of fresh air in the world of dating applications for adults. Unlike many other platforms that can feel impersonal and superficial, Vibe fosters a sense of community and genuine connection. The app's focus on curvy dating and body positivity makes it a welcoming space for individuals who may feel overlooked or judged on traditional dating platforms. With its user-friendly interface and intuitive features, Vibe simplifies the process of finding like-minded individuals.",5,0,1.8.2,2024-10-13 17:25:21,,,False
f5a81df4-e239-4445-b7cf-52aab54935bc,Tommy E Rayevich Rayevich,https://play-lh.googleusercontent.com/a/ACg8ocImFU_M4TJjLR9tizzrHsu1B51lJyy0Ud7i9rVBgIgAh-131g=mo,Tommy Rayevich,5,0,1.8.2,2024-10-13 15:40:01,,,False
06bba925-b55a-47b0-b096-404c4d2e72f5,Se Resamgala,https://play-lh.googleusercontent.com/a/ACg8ocITlPIeIuW4KMrha8_CJL-vjNbc4qTUd_QgQmHbuCA0E836yA=mo,lousy.,1,0,1.8.2,2024-10-13 10:01:49,,,False
3e664b7e-88a3-4b2d-88ed-287d334e9c88,Afro 7,https://play-lh.googleusercontent.com/a-/ALV-UjXfhiNcHbfFFns-q0AdyVXFqoK6bltVTiA3KpM3FmOuPEKStE4dwA,Be careful with this app. All of the conversations on this app is generated by AI.,1,1,,2024-10-13 08:42:34,,,False
469533df-fe83-45b0-90ec-07c3cafaa2bc,Jacob Showers,https://play-lh.googleusercontent.com/a-/ALV-UjUWg0rv8yVCxmGglP9S50FKLP8hrHwczeR1gt-ifYXr68l5uu03,"I think everyone is fake? Honestly can't tell, the only thing I could tell you about this app is that it's a massive Cash grab",2,1,1.8.2,2024-10-13 07:08:52,,,False
4773e831-6744-4771-b869-d80223252745,Alex,https://play-lh.googleusercontent.com/a-/ALV-UjU0xBaUWdedM3PfL_XYK_P7UPTp42kRU86QkmSAkXEqfvON7ArnLg,It's a scam. I live in a tiny town and yet all these women live literally a block away. They send pics that you have to pay to view and the responses are typical scripted bot messages.,1,1,,2024-10-13 06:47:54,,,True
a4a2c2d0-40d4-426a-b470-c55a10cada66,victoria Salcido,https://play-lh.googleusercontent.com/a-/ALV-UjXrA_YeJfXJ43Bgz2r4MVt_0DL97u01w9a7aQK7woWzi7Xw2N2v,A little more control on the messages and location.,3,0,1.8.2,2024-10-13 05:42:31,,,False
93bbc6cf-fe5d-405c-8846-3273abf3565f,Timothy Steinmeier,https://play-lh.googleusercontent.com/a/ACg8ocLfHsJ4Mokz2k2CChjzpVRJk5sMAuqh5nWyvR8t-4buFfYjJA=mo,Have to pay to message anyone after the first handful,1,0,1.8.2,2024-10-13 04:34:53,,,False
10cf8134-9ebf-481d-a59e-8259b9736843,Beau Griffith,https://play-lh.googleusercontent.com/a-/ALV-UjXOJnURUhl1XLE5LwE7S_X_YBi3kTnHiwHccxYEWJC637jbyg4F,Nothing but bots waist of time,1,0,1.8.2,2024-10-13 04:06:11,,,False
8c8bc1ac-49fe-43f1-b2c5-b6d3c197c14a,Morgs Taylor,https://play-lh.googleusercontent.com/a-/ALV-UjU_VS-luqhIGRu3-ZH5WJBy59KafHk7KKQV7hm-E908bLZLPocN,Worst app ever.,1,0,1.8.2,2024-10-13 02:58:35,,,False
ad81384f-2f5d-4a17-948b-526a6281dc18,David Madwin,https://play-lh.googleusercontent.com/a-/ALV-UjWY0rUoLia53SXncUpEpK1EWrbo5HWPlbWY4V9wBHOlS7_rz1ri,Just a scam app. It's flooded with fake accounts that you have to pay to see messages from.,1,0,1.8.2,2024-10-13 02:19:01,,,True
f5464d13-a8e8-46d1-a124-5e926e206e55,sam brookover,https://play-lh.googleusercontent.com/a/ACg8ocI699Ur-eXBkblwlZBP9qNDTtVv82cbgIgvfQ9kAalRRJpl6g=mo,idk,5,0,1.8.2,2024-10-12 22:59:58,,,False
6432e733-2240-4be3-8f9f-a8e51a5f9f31,Artur Sarkisian,https://play-lh.googleusercontent.com/a/ACg8ocLX1LTEMfOOt4wUMXCVGXYjR4oFxGSuD4YyNrLquYS8TnpXow=mo,Don't waste your time. Scam app.,1,0,1.8.2,2024-10-12 22:53:40,,,True
fef27fe6-9c92-4bf3-9a5e-2659d4d79612,Aryk Phillips,https://play-lh.googleusercontent.com/a/ACg8ocJFakm7gU_JqF8Jw5CnFTYtFHULYBLwED_44-Pidczlb0zo=mo,"I am not paying to talk to girls, sorry I would like it if I didn't half to do that",2,0,,2024-10-12 21:44:54,,,False
d18c5d40-8f59-44ed-9440-dd5ead7d418c,kiko,https://play-lh.googleusercontent.com/a/ACg8ocLzF8-yUV6zMc2AUGh8h_wY9Vf_5_upbAe3tfhJhm-uLGwHL4k=mo,"I've been using Vibe for a short while now, and i have to say that I'm impressed. It stands out among other dating apps for adults with is user-friendly UI and its engaging features. The community feels genuine, and I'veconnected with some people who share my interests. If you're looking for local dating, Vibe makes it easy to meet new people in your area. I really recommend giving this app a try!!!",5,4,1.8.2,2024-10-12 20:56:43,,,False
3ddcf882-6663-4f34-884a-9cd0a9a262f3,GOD'S GREEN EARTH INHABITANT (Mark G),https://play-lh.googleusercontent.com/a-/ALV-UjWhrrqC3r_X5BF4HG9NPDKOrJ6lweUMJg5Pgyu5CS-DIBGrBSE,I subscribe for 3.99 and you still want more money a rip-off. I cancelled the account.,1,0,1.8.2,2024-10-12 17:24:24,,,True
e08e658c-5cea-4610-b5aa-4d2538120892,Sam Entwisle,https://play-lh.googleusercontent.com/a/ACg8ocL-sQouAIE8biNE66k5M8cYzXa4321yvnuBQB_FJbPetL6o2A=mo,"Terrible app. After a few messages it won't let you send anymore until you upgrade. When you do you can continue to message people, but after a while it starts blocking any pics they send you. also, mainly bots that send you nudes and talk about hooking up. And it's right away, like 3 to 5 messages in and they start sending nudes. Complete waste of time and money.",1,323,1.8.2,2024-10-12 17:17:35,,,True
0c16dbf8-2647-40d4-8cb4-d838f8e631f3,Bryan Beccia,https://play-lh.googleusercontent.com/a-/ALV-UjXSdrbpEb65AtCuSBZN47bzERio5VJOZVmp2PSESlsEkXPbV2Jf,This has got to be the most fraudulent site I have ever seen. In Kentucky it's called theft by deception a Class D felony anyone involved with this app should be charged that That's exactly what they're doing there's not a real person on this site All the profiles are fake and then want to charge you for pictures and videos that you don't even get to keep.. I'm expecting to get a refund a full refund on everything or I will keep pushing it.. overall ratings -5,1,1,,2024-10-12 15:53:38,,,True
582619f1-2246-43ea-89f6-30581f2e51ef,Tim Spatzier,https://play-lh.googleusercontent.com/a-/ALV-UjV1Q12oG3M6OLiW6vi9tFciak4o567PqhXqDZh6vGbp_ODAUK-3,All fake and it ain't free,1,0,,2024-10-12 15:46:04,,,False
c0d755c0-a473-41d8-a47b-801a5ad4dd17,Namit Awasthi,https://play-lh.googleusercontent.com/a-/ALV-UjW1pz1hJQ0NaTR-N2sIGLYcUQoT5v4OGPJWGby1YbmpHiyltC-t,very nice,5,0,1.8.2,2024-10-12 12:11:49,,,False
bcdc531e-3df2-40e3-a1f7-147bf5e13d57,Gloria Isah,https://play-lh.googleusercontent.com/a-/ALV-UjUhFRP-AXdDwu-RXDr-aFNsjDHRQW8KC7jrrYG8jXNlWpHRD8MF,Vibe is that local dating app I've been looking for! Love the ease of navigation and simplicity. I am definitely sharing with my girls! Love eet💯,5,1,1.8.2,2024-10-12 08:55:15,,,False
df73195b-9bff-4d90-a030-5056281ad75d,Pachy Santiago,https://play-lh.googleusercontent.com/a-/ALV-UjXtDKXlgyWHSuAdQAwwlczsQTHf_i9d3VB8jTMfdw3iyms1q2wZ,Bots and bullcrap. Dont waste your time. It's 100% scam. Done.,1,0,1.8.2,2024-10-12 08:40:15,,,True
0187b66d-123e-45c9-820d-9c3ca1c65c5b,Ivan Coleman,https://play-lh.googleusercontent.com/a/ACg8ocJhKMxBJqtwdYg6nJIQFFO6aaNcd2pec8ZfPsf7SNyZPpFB9A=mo,shamless cashgrab takes your money and tones of fake acounts,1,0,1.8.2,2024-10-12 07:08:26,,,True
5b18ec14-f847-429d-bcfd-94f896b29f27,Steven Benavidez,https://play-lh.googleusercontent.com/a-/ALV-UjVRGeYzCoIagW4PLVAlOc0H0m2CPVK6sK7rXEYC57U1az3OYnry,Scam app. First swipe immediately matched and I hadn't even set up a profile beyond a meme as a profile picture. Chat started right away with auto generated answers from the match.,1,0,,2024-10-12 06:19:27,,,True
2b226c61-d6a3-4c77-ab0a-0d952b495a07,Creation Specialist,https://play-lh.googleusercontent.com/a-/ALV-UjU7Cb0_bgnmEKqnUggIXg9LNpWQoqaiOHy5lLAajFUUGjrcMQ,"It is good app great options in women but you have to pay. You only get a few conversations before a pay wall blocks you, no add or. Nothing. It is bad experience if no one can afford it it's to expensive when I can get a fancy meal for the same price as premium option",1,1,,2024-10-12 05:36:28,,,False
06148673-dd30-4933-8534-2d1ca1ea92b4,josh rhine,https://play-lh.googleusercontent.com/a-/ALV-UjWX6x7937TW9YtDI465V4GcK7W9uli_nzHwAG14dy8pxEBJ4vqr,Great app,5,0,1.8.2,2024-10-12 04:19:27,,,False
09004969-447f-4fdf-895f-ba8b181208a1,Chavez Lomeli,https://play-lh.googleusercontent.com/a-/ALV-UjUds0bx2MjUVq9yZDwAESIZHwGdnBCeAEmu1-HMPALPJUCvKExp,I love using this site,3,0,1.8.2,2024-10-12 01:19:29,,,False
ffec6a4b-c2f6-4933-baf1-876a32859f1f,Angus,https://play-lh.googleusercontent.com/a/ACg8ocIRmxgQkY4tZ2KZy5Joa29gSCaWHyvbapE6d5CZrBYovASWzV0V=mo,"App is rubbish, clearly Bots tryna get you to subscribe, to test the theory I made 3 accounts... and all the same people exactly the same conversations.... I'd screen shot it but the app dosnt allow it... wanna know why??? Coz it's just a little for them to rip you off, #halfastar",1,2,1.8.2,2024-10-11 22:34:31,,,False
933e9d1f-0c30-47fe-a107-756bcdf3e4e4,Blunt MOFO,https://play-lh.googleusercontent.com/a/ACg8ocJuhQ56fTIi0TjplbvjljQsgV8_-CwnAoyyQ_OEiuEd88a1Hw=mo,"They took my money 30 bucks for 3 months , and I can't message anyone, asks me to pay again. When I hit pay again. It says I'm already subscribed but can't use any features. No way to email. Sent help ticket on app 24 hrs later, no response. Smh. STAY AWAY",1,5,1.8.2,2024-10-11 21:38:25,,,True
eef71481-c513-4e2d-aeae-5a5e35a82208,Adam McKay,https://play-lh.googleusercontent.com/a-/ALV-UjXNqkXbE8q37OBdQOlOQ-rdHb70M8l2kAm-8fKMymeWI27Ct80,bunch of bots or something else. gotta pay to view self destructing photos and videos on top of subscribing. might be fine if you just want to waste your cash on meaningless chats.,1,2,1.8.2,2024-10-11 21:33:01,,,False
3ac0eca3-1364-4990-8dfd-27d4a6bdf2bb,Aaron Branham,https://play-lh.googleusercontent.com/a/ACg8ocKQibWw0QIUjOhHJSwfgO8bkb9mWFm0I-_k4OlTN9FmPMFK9w=mo,There's no point I'm downloading this app unless your wanting to get premium.,1,0,,2024-10-11 21:24:01,,,False
e3ced281-8734-45bc-ae8d-40f07d2a5393,Will Dom,https://play-lh.googleusercontent.com/a/ACg8ocL9FNYfq8pFM522_wF7TcMu17XZifqYEWDJBEGCnxqdeJadhw=mo,Everyone on this app is an A.I bot. It is garbage and it is dangerous and quite hurtful because the a.i is quick adapting and very well designed. Lost money to it for date prep. Do Not Use This APP!,1,2,1.8.2,2024-10-11 19:47:20,,,True
a765d22f-9b59-4bd0-b2ae-bdd199e66b47,Ava Larry,https://play-lh.googleusercontent.com/a-/ALV-UjVUxzzoD94tAjAVH88cck4g3eviZT8J2Giuejr1XyWYftdNBBs,"Vibe provides a novel take on dating applications by emphasizing activities and interests in common instead of shallow swiping. It's simple to browse profiles and get in touch with possible matches thanks to the intuitive UI. I immediately started receiving local dating hits when I turned up location sharing. The women were amazing, to put it mildly! kind and excellent communicators! Warm! Since I'm a little older, I focused my search on finding ""curvy dating"" girls, and I got results right away",5,0,,2024-10-11 18:57:46,,,False
fecb6ae5-3e06-499c-8791-8115866c9efb,BG S,https://play-lh.googleusercontent.com/a-/ALV-UjUkNuxwkbbXX0JY8HtmzPKFrdtHaOAqtB8dCFMu6YMkU_3Noog,Fake af. Don't download this. Not real. Just trying to scam you for a subscription. Reported this app to google play. I would advise other to do the same.,1,1,,2024-10-11 16:37:14,,,True
cd58b5c7-b2f8-4fb6-ac46-59941856570d,Alberto Cruz,https://play-lh.googleusercontent.com/a-/ALV-UjXkNCIeQwuUuO3qeIaEj_uF49tjuqPrNQq0MstrhIVTl-sYfqTj,good app,5,0,1.8.2,2024-10-11 16:27:16,,,False
55fb52a7-124f-42a4-af9d-bb74995c7d32,Jason Pittman,https://play-lh.googleusercontent.com/a-/ALV-UjX9LvCnyGPvDyjOrHYfSFyLXP08G8zMPjuO-HXQ7LyD9qCK6dIbZQ,very good,5,0,,2024-10-11 12:19:55,,,False
779010ea-2ecb-430a-af6c-f5de41f611cf,Andy,https://play-lh.googleusercontent.com/a/ACg8ocJXu-UhLl0X7uR9RM3UOCMUNKYoV2MequVe86A6c4l9bpr1EA=mo,It is nothing bu a scam to make money and get no results,1,0,1.8.2,2024-10-11 09:06:46,,,True
a727a569-3553-4cb8-b92c-03d09af09b03,Nick Dupuis Lalancette,https://play-lh.googleusercontent.com/a/ACg8ocK9Z-aQ5CKVr7tAZqN6OWQF3VtVahnpAUmixGutj56B6oKNSw=mo,"Fake app with fake people, AI generated",1,0,,2024-10-11 05:40:47,,,False
11928635-bb34-4483-aadc-8f9dcd9924d7,Hajrudin Jadadic,https://play-lh.googleusercontent.com/a/ACg8ocKvCAKiwA9YIFV6GW95hIGN3_jUMyCiWaXYyLxIQuWj5oGpIA=mo,"DO NOT DOWNLOAD THIS PIECE OF GARBAGE AND HERE'S WHY 1. IT'S FULL OF AI I'VE BEEN CHATTING WITH AN AI CALLED Malenia and I start to notice she's typing fast, she sent a pic of her ""peach"" and shared her ""location"" so I ran out of free messages, and I took my 2nd phone and made another account I'm which the same person messaged me with the same exact messages. If you don't believe me then try It yourself, I rated It a 5 so yall see this.!.!.!",5,0,,2024-10-11 05:25:30,,,False
ad38f2a1-3e78-4894-9338-09731e6bb478,Sam,https://play-lh.googleusercontent.com/a-/ALV-UjWPTmJtRfQm7Zhv5Xg4j-MC1fsRkX91ju6gJCDEMSsGYLW7Swjk,Just bots,1,0,1.8.2,2024-10-11 02:29:09,,,False
c46b3ae3-402f-48ae-9394-a6eac7e889f8,Jeremie Hetz,https://play-lh.googleusercontent.com/a-/ALV-UjW6Hld9N6r6z1vjwLmb27XZCE8WcbJuAOQTipsTJ0Ov1chlCFwMtQ,Not a single real woman on here. What a joke!!!,1,0,1.8.2,2024-10-11 00:41:19,,,False
21f9ddc4-2b33-4488-84c6-12a32c1a5e7d,Norse Raider,https://play-lh.googleusercontent.com/a-/ALV-UjV6uPscLPNfbg7Fzqfh7c9M0UPDEecR6PFmuLha0fm3-H9TZA4,Scam,1,0,1.8.2,2024-10-11 00:36:22,,,True
d0e5a21d-d405-4022-8a32-3060177148e1,Sergei Gaidazevsky,https://play-lh.googleusercontent.com/a-/ALV-UjXnyFu_qWqDMKM2000u6RycnTfZlshK4lCGl_1w752DqNx3Zc8K,"All users looks like bots, pay for membership, then for each video,picture pay more... fake app and no refund",1,0,1.8.2,2024-10-10 18:50:19,,,False
37d80f41-247b-415f-af41-e0d9b7ef891f,Saqlain ali,https://play-lh.googleusercontent.com/a/ACg8ocIEeGX7UsPA3vAATsZid2BqJAmLpJF3J8P1QL_udhbsoa49kA=mo,good,5,0,1.8.2,2024-10-10 18:36:33,,,False
c6820ef6-7e4a-4f41-ab46-a7f4a4301856,Cornelia Anyango,https://play-lh.googleusercontent.com/a/ACg8ocIoCJexfiIdoDe9lMcns0KU4oEKUFfgMVgrXygRSfSEXVoa-w=mo,"Using Vibe has been a refreshing change in my dating journey. The app’s intuitive design makes it easy to use, but what sets it apart are the vibe checks, which add depth and make each connection feel more genuine. The extra verification step gives me peace of mind, and I’ve met some amazing, like-minded people. Definitely recommend it!",5,0,1.8.2,2024-10-10 16:42:21,,,False
1234fd7b-d6d5-4619-a5ad-a4ff45880448,Leslie Dixon,https://play-lh.googleusercontent.com/a-/ALV-UjUPVWUXa3NTBtZXM4-W7i8BGiiC82caGQW_1Qby3Ujp71N87ivg,"Full of scams. Within 3 mins of having the app downloaded, my inbox had 10 people in it asking for 🍆 pics.",1,0,1.8.2,2024-10-10 16:25:35,,,True
1b5baf1d-1887-4efd-9fc7-ae6b79665b44,Ryan Kirby,https://play-lh.googleusercontent.com/a-/ALV-UjWHNNtGCXy7ufA7ksDabwq8WAMJsEw1YEPl8Kk67BIpqckEpqzj,100% scam it's just all bots,1,0,1.8.2,2024-10-10 13:39:29,,,True
69bdce7a-a2ab-4ef0-bbf6-9d0b24a1e147,Vanel Cazeau,https://play-lh.googleusercontent.com/a-/ALV-UjWm0MqM_8P-PHgV81odg1q0bk2753e8T0AtBgYgNb0CuH_HJ5Ou,awesome 😎,5,0,1.8.2,2024-10-10 13:00:36,,,False
