reviewId,userName,userImage,content,score,thumbsUp,appVersion,at,replyContent,repliedAt,scam_related
c2e3dfc4-d8a5-45e9-af32-539f25e20bf3,Fatefulcoma,https://play-lh.googleusercontent.com/a-/ALV-UjVCkblN6KT_pNTw082Ho06D6aQ3w7myiJYAKzy1ZbAjP_LHg3bk,Fake app and its full of AI,2,1,1.7.5,2024-07-30 18:28:59,,,False
e8467abd-3699-4f9f-a00d-5e32a08e9999,keiran taylor,https://play-lh.googleusercontent.com/a-/ALV-UjX1r_MsOkCzvASP9WFy-ODHwjIzx90ahI-eO0MTR40WiuNn3s8,just full of robots,1,1,,2024-07-30 15:24:08,,,False
c3727cab-fdae-43fc-89b4-009997378466,Dalton Devillers,https://play-lh.googleusercontent.com/a-/ALV-UjVWl0bL5C7Eqdznv3RaX11oApBm8dEt2psv_0aQshKHJS_nmcc,women are beautiful,5,0,1.7.5,2024-07-30 13:09:59,,,False
f07efdb2-ef20-40d7-a8bd-be446c542600,Shoaib Ali,https://play-lh.googleusercontent.com/a/ACg8ocLm2MuZMTY8XPGLQ2pH_HEygot3uUtjtl7ylYg6Bf3ksgzAQA=mo,good,4,0,1.7.5,2024-07-30 09:36:17,,,False
9404403d-3660-43e8-9e96-82c4178787b8,CastielAngel22,https://play-lh.googleusercontent.com/a/ACg8ocJasj5Me4RfkqRlhHlUdrdTX8vBNOwuhmnYpoYnmQwqs-PgHQ=mo,Paywall and bots not even worth the hassle constantly asking for money,1,1,,2024-07-30 08:45:37,,,True
4bb76d0c-057c-4825-96b0-318ebf633480,Rob Hardenburg,https://play-lh.googleusercontent.com/a-/ALV-UjXLyUq2TlXwWjCvDAO297ddjZdKTY8k7v9WDKlwMrXH07dhYBub,"real users, real people.",5,0,1.7.5,2024-07-30 02:26:16,,,False
262f949f-d965-4eae-bf62-2897256292d9,CrownlessKing,https://play-lh.googleusercontent.com/a-/ALV-UjU8nY9pE4iETCgLyr04EDkv7uR8rBRuaYjSnMkR1onF-f4-HC2r,Bots everywhere,1,1,1.7.5,2024-07-30 01:58:55,,,False
cd0fbeb5-369d-4f1f-9aa3-c33649217fe3,Conor Martin,https://play-lh.googleusercontent.com/a/ACg8ocKALxX-37h5Dm5e4079dhmWGrJ7zYVb9CJwjhR_ctSkvuKuXg=mo,Awful all just full of bots and scams. I want a full refund for everything. DO NOT INSTALL THIS APP IT IS A FRAUD,1,1,,2024-07-29 23:51:00,,,True
b71accb4-3f24-469b-b545-43648e9fd210,James Matthew,https://play-lh.googleusercontent.com/a-/ALV-UjUpiAjDxKKuwUS_ixSHUP_9p9G5MJP-lYj-cRAxNENokdo5fQc,I was just seeing what this app was about and now I can't delete my profile because it's full of bots. I didn't even have a picture up and was getting messages saying I'm sexy lol now there is a paywall in order to even get into your profile. This is not a good app. As of 7/29 I've emailed them and no reply. I'll be reporting this to the better buisb3ss bureau. Do not download this app,1,39,1.7.5,2024-07-29 22:05:05,,,False
8fa64895-28cb-426f-a7ef-c75bef3ae2ac,Mr.X,https://play-lh.googleusercontent.com/a-/ALV-UjVy7Nv-3xeUJS8k9vXCZ_m58M4uqVFhGMiUwNQ0EfTY8VMEtTrNNg,awesome,5,0,1.7.5,2024-07-29 18:23:42,,,False
3aa78786-60f3-4a7d-82b9-8a056c5e8419,Florence Nyarotso,https://play-lh.googleusercontent.com/a-/ALV-UjWXl1hchSt6DVFrO9kp_OWZRgmUkywcvdpWCCbJ2ZhL4aqZT9HC,"I've been using the Vibe Dating App for a few days now, and I have to say it's one of the best dating apps for adults out there. The app's user interface is sleek and intuitive, making it easy to navigate and connect with local singles. One feature I particularly appreciate is the focus on curvy dating, as it promotes body positivity and inclusivity. The matchmaking algorithm is spot-on, and I've had several meaningful conversations and dates thanks to Vibe. If you're looking for a reliable an",4,2,1.7.5,2024-07-29 17:53:02,,,False
490b5680-f343-4552-bf26-676fdf430120,Soroosh Mosahebfard,https://play-lh.googleusercontent.com/a-/ALV-UjX5A4mjY6QX6ibk7sRy61NF9K5ecE8G3zVzXLabQWjuRigZu35j,Its fake down paaaay,1,1,1.7.5,2024-07-29 16:42:49,,,False
a67314f2-cee1-4a6d-a644-b0bfb9651601,Daniel Daniel,https://play-lh.googleusercontent.com/a/ACg8ocJUunN4F0wgLHiQSd3r8NIicVJkrVG7V6_kvF2If3qZ4sw7dA=mo,Absolutely BS Don't waste your time,1,1,,2024-07-29 13:42:49,,,False
6097dda7-49dc-4f58-9b89-9c34c07e361b,David Martinez,https://play-lh.googleusercontent.com/a/ACg8ocIkw46ZxFiIyWO1y9CIfOr2fY33b_fpjEcWLH8BvdZdzeSpA9g=mo,Your ads fail to mention you have to pay to talk to anyone,1,1,1.7.3,2024-07-29 13:01:26,,,False
2998d333-8f38-4c1a-9f1a-207ef69912ff,Damian,https://play-lh.googleusercontent.com/a/ACg8ocLTVCnujGs6eI2C3NwMPQ4aQbh0iUSXyarCvGPVWZLe1aXo_A=mo,Every profile is fake. Instant match with anyone I swiped on. All trying to hook up then when I started to get pictures and videos it told me I have to pay to use the app. It's a cash grab,1,1,,2024-07-29 04:45:12,,,False
94193dfa-0688-4cbc-96a1-2f8c237ab861,jack lasto,https://play-lh.googleusercontent.com/a/ACg8ocL7zmUdbC3aE1sv323FUMpL7zWIUxiCCdqqoualN1q3Li8ZpA=mo,There was bots and they will try take out money from your account and give your payment options to other sites to try as well even when yourve unsub from them,1,1,,2024-07-29 03:39:46,,,True
2df01c66-f2c9-41a3-9c20-c0bb8c3a6116,Greg Boddy,https://play-lh.googleusercontent.com/a-/ALV-UjWSEfzxoAfyXO9pp-ay8wss6Yu4bImhyRbhsFpUJG-zLKS2jW_x,TOTALLY FAKE. I joined and instantly many messages to all which are immediately sending pics and being dtf. Also all local despite me living in a SMALL town and never ever seen them. Asked for location of one and their home? The local Esso gas station apparently. Skip this junk. Just some fake app trying to scam $ out of you.,1,13,1.7.5,2024-07-29 02:06:44,,,True
63036afd-925e-4e1f-9ba4-a71b17da7f84,Aaron Mywrs,https://play-lh.googleusercontent.com/a-/ALV-UjWTNpGgSv8cY3h-JDcwBX126awAhoQpdK7lrOjIjVh9p7sTlqQm,Bots and BS,1,1,1.7.5,2024-07-29 00:27:48,,,False
c6a2fe88-b0a7-45a0-87f6-f481ebf43c57,Troy Scott,https://play-lh.googleusercontent.com/a-/ALV-UjUn4eeNCmJvvJ9d-vBCGL8FMFTFMexVwKQE_F_eCrztBztFGEem,it fast I love it,5,0,1.7.5,2024-07-29 00:11:14,,,False
fe236d57-56d1-45ba-895b-61bc1a47cbf3,Michael Winne,https://play-lh.googleusercontent.com/a-/ALV-UjWRAMCB-mWSLyLlHsJcl8bj-uPaA-DPHtYkN_fUmH-AkvV4gTT6XA,Very interesting,5,0,1.7.5,2024-07-28 23:22:00,,,False
c7272a47-be73-4e4f-839b-e22d9ef2e41f,Chris Heck,https://play-lh.googleusercontent.com/a/ACg8ocIcyTzQhjoFkJTfQAlSsKpZqmh0H0qogwuBnnMyH2gEEoxeVQ=mo,"Fun site, pretty simple to use.",5,0,1.7.5,2024-07-28 21:13:05,,,False
ad1e5316-0806-4e85-8ce4-340dadca7fea,Robbie J,https://play-lh.googleusercontent.com/a-/ALV-UjVuGrmz7-qoDyWVeB5DYz3yDck8eQvTsc9JNvzGuG4qVrEBNx1v,Just got a quick set up. Then a few messages then went to reply got put straight over to a subscription page and now I can't go back to delete profile until I pay. Not happy,1,8,1.7.5,2024-07-28 12:32:54,,,False
8aeb34b4-2b24-4f7b-bea3-f8b225c9a830,Steven Spalding,https://play-lh.googleusercontent.com/a-/ALV-UjXNAI8lpRygC_5lTngvif_aAptxQuoaUBY4mp7GHPLO_P8DUtxT,"Scam, auto smashed by bots then taken to a payment screen you cannot backout of once the bot sends a video",1,1,1.7.5,2024-07-28 03:27:26,,,True
ce379914-04a4-4c6c-b39d-ca9059e58145,Brian Cannon,https://play-lh.googleusercontent.com/a-/ALV-UjVS4TsYAHXefP5eEQe5ZnYIu-KteTTOqsd5UGKd9OdnY1rydEaa,Fake app full of bots,1,1,1.7.5,2024-07-28 03:17:31,,,False
50eb9128-f934-4cc4-99fe-7d08ee442032,Levi Hahn,https://play-lh.googleusercontent.com/a-/ALV-UjWowbIl9j3v56zwzwvmdUZxM5_8vURmDCpt_hrW84rrhy5G8GU,"Nothing but bots. Then they don't let you use the app till you pay, all while they blast you with 50 bot notifications.",1,1,1.7.5,2024-07-27 23:46:28,,,False
88a43062-dc82-41f2-a26e-472f25b37e7d,jessica Escalera,https://play-lh.googleusercontent.com/a-/ALV-UjW9SIY2Mk2I8-Nh7ZgtC1FYbZs76IjbkJI9AZzXVwCElCBVsNQs,actually nice to talk to someone real,5,0,1.7.5,2024-07-27 19:48:57,,,False
2983fc23-fd3c-48f8-b754-98b07859c9a6,ЯIMIDAlV Surin,https://play-lh.googleusercontent.com/a-/ALV-UjWF81rW-utP_PH9j6Ko5sWFs56wXBjdCfv5hNP7uKYIQtq29g2r,This app is a scam. Don't waste your time. I've downloaded twice just to check. And same bot controlled by the developer sent messages same thing. Even did it to my friend.dont waste your time,1,10,1.7.5,2024-07-27 19:31:04,,,True
d533fe5d-a00c-4431-beca-84a2caccafc1,Jeremy Sedgwick,https://play-lh.googleusercontent.com/a-/ALV-UjU4wQ81zmK4CCQCCV-RVFKGpPxptdhZBPDuLMvOHFo8udrn4I8Xrg,"Vibe is a top choice among dating apps for adults, offering a seamless experience for those seeking meaningful connections. Particularly popular in the curvy dating community, Vibe celebrates all body types and promotes body positivity. Its user-friendly interface and robust local dating features make it easy to find matches nearby. With advanced filters and detailed profiles, Vibe ensures users can connect with others who share similar interests and values.",5,1,1.7.5,2024-07-27 18:55:21,,,False
e569a572-c06c-49ca-a93f-33ba14f0e44b,Amdewis Chali Muwile,https://play-lh.googleusercontent.com/a/ACg8ocL6Q-FCXzdkRlKToiH9A0k4W0XRmhKtzFANQ-BUCI2NPp2XZw=mo,perfect,5,0,1.7.5,2024-07-27 13:15:26,,,False
c79102df-1fbe-44aa-a26d-b16a0c969b30,Shai List,https://play-lh.googleusercontent.com/a/ACg8ocKkyGF7vCH1FH5o6fDA2VjKPtfr1EC23r8sQSlQShdAzQNgzQ=mo,Didn't even take 5 seconds from setting up an account to being assaulted by a bot,1,1,1.7.5,2024-07-27 12:18:58,,,False
64574237-a1f3-4732-8f8b-02fd9a2dab70,Cole3050,https://play-lh.googleusercontent.com/a-/ALV-UjX-isAEHlfjb9TjyYnwrGJqOzpupvX-wM7TTccu9MXU6AZOvrl9,DO NOT INSTALL. Nothing but bots and they instantly will try to bait you into paying for access to this garbage app. The second I opened it 7+ bots started messaging me. This app should be deleted from the store,1,11,1.7.5,2024-07-27 06:44:27,,,False
d3adb414-a914-41cd-9913-85f79441cc7f,anthony douglas,https://play-lh.googleusercontent.com/a-/ALV-UjVFVPN3LltHhL89pers5qSZE06sEr-Nj2F1XpR8EGBOK3D6RjU,I am locked in a paywall and can't leave it to go back to not being a premium user don't download this app,1,2,1.7.5,2024-07-27 05:18:55,,,False
f0fc338c-db09-4826-bb65-fcec9e4c6117,Kasper,https://play-lh.googleusercontent.com/a-/ALV-UjVI3hkLd_HmWRsIHO2uC7qtIrEZV2kR2HFuDqWkpVgmxf1oiZTB,"Flase advertisement, says its free to use but obviously not, you get blown up by bots before you can make a profile then it wont let you use the app without payment, everyone reading this should open a lawsuit and sue. Yes its legal to sue and the info to do so is in the about section.",1,3,1.7.5,2024-07-27 01:38:18,,,False
aa5a263d-fb4b-460d-ae27-5357679a3db1,LazzurusMan,https://play-lh.googleusercontent.com/a/ACg8ocLciMUgbdY3CUm1GXHfYcJBo53TCIkkqMhWaWvgSfD8fJHjFA=mo,"Don't know what I expected really. Was inundated within minutes with likes and messages, all pretty much in the same place, all asking to meet immediately. All bots.",1,6,1.7.5,2024-07-27 01:18:23,,,False
6f8836b5-6501-4705-9401-96c270d755ac,Glen Briggs,https://play-lh.googleusercontent.com/a/ACg8ocK6FDQlpdeb2CW-aNzTuYGT1y5d5mz28jl452EhvowZf0cwpA=mo,Fake as fake gets. Dozens and dozens of women who all show up as being with 0.5 miles of me all fake. The moment my profile went live I had nearly a dozen likes from women. Fake app fake people. Obviously a money grab scam. Reported to Google,1,1,,2024-07-26 23:26:56,,,True
7afe5bc9-eaf4-4b02-80d8-93a45174e7e6,Billy Steer,https://play-lh.googleusercontent.com/a-/ALV-UjVmv5ZF5XVn_VcV6KAwA84qNxAAaJvi-8yorFUI6dbYi7QUZOY,scam,1,1,1.7.5,2024-07-26 21:10:44,,,True
f5e1c36f-0347-43ab-8e70-796a6d05fde8,Crazy Eddie,https://play-lh.googleusercontent.com/a/ACg8ocL8kXJAeGLf1tTZFvRlaLqABxd-pt2o1__3yHc3iYAX0OU_Qw=mo,Beware very Froudulant dating app they trap you with a phony person's profile and then right away they want you to pay for a subscription 🤔 the person I was talking to said she was from the area where I was from but she was actually in Boston what a freaking SCAM...,1,1,,2024-07-26 20:34:06,,,True
948e7a26-d474-458c-a4f9-1295392f43bc,Md Ariful Islam,https://play-lh.googleusercontent.com/a-/ALV-UjUBfAMy9-RWetdxelYv0aXgu0H8ZyMk6eWD_YSzKefEzCaQWlQ,perfect,5,0,1.7.5,2024-07-26 19:38:14,,,False
2c691a05-2977-4d50-b1ef-6ab096473ae8,Alex “muTe” Pappas,https://play-lh.googleusercontent.com/a-/ALV-UjXt2MtdtgUPaq4QrukCQs02SxPoLRDsUS4_cuY0ADyobzukoY7i,Full of bots that auto match and spam links,1,1,,2024-07-26 19:00:06,,,False
fed96f0a-ceca-429f-b432-e6bc4e6bacac,Kiki D,https://play-lh.googleusercontent.com/a-/ALV-UjWMkOyKqOHei9SeeqojZheQwjKIHZFpHs3h__ECOeUAkt7KAe7ALw,"Money pit and maybe not even real people. You could spend alot of money on the app alone. You have to spend soon after logging on because you can't go further then limited chats, very limiting and annoying",1,9,1.7.5,2024-07-26 18:57:07,,,True
3ec9357c-43a5-4128-9e5f-bcd8a4ca95dd,Von Cotentin (James),https://play-lh.googleusercontent.com/a-/ALV-UjXjhxCrLSQ8xG-oKdxySKFTEo1amEpASCh7cEI4jiVlYq1OUtU,Nothing but bots 😒,1,1,1.7.5,2024-07-26 16:58:26,,,False
dea60bec-3916-407c-b23f-a6aba9e539e2,Joe,https://play-lh.googleusercontent.com/a-/ALV-UjWC586ptr9JvyZVO86I7xn0h7oE9VKPk95iucNeCFHWdOr1VS4WAQ,Scam dating app. Bot interactions then won't let you chat until you subscribe.,1,1,,2024-07-26 16:50:31,,,True
23cbd24f-082f-4f39-b24d-3f0b3138d080,tim z,https://play-lh.googleusercontent.com/a-/ALV-UjXkDKJHP6FNnhA2HjuMp5fbjiCOy8xkyoeUVz8nErgwze__0ViQ,"Scam app, charges to activate accr, charges to message, data of app shows it uses auto reply chat bots, script of app hides real profiles to incurage fake profiles scam",1,4,,2024-07-26 14:48:05,,,True
93fe49e6-443c-4e14-9a91-683363865cf6,Daviddo Ekr,https://play-lh.googleusercontent.com/a/ACg8ocIoAoZWel0bs0MRYwL7iZJlAB0vlht0u9ga8IVLN7o0ll22WQ=mo,"I've had a fantastic experience with the Vibe Dating App! As someone exploring different dating apps for adults, Vibe stands out with its intuitive interface and engaging features. It's refreshing to see a platform that supports curvy dating and promotes inclusivity. The local dating aspect is also a huge plus, as it allows me to connect with people nearby. The app's filters and match suggestions are spot on, making the search for meaningful connections much easier.",5,3,1.7.5,2024-07-26 14:10:08,,,False
6983f289-5d3a-4963-9dbe-fe85a32d641c,Clark Senrget,https://play-lh.googleusercontent.com/a/ACg8ocKVjlrdGIx079HweAmF6MGUtetSs-ToRfqscyDLkGa9aq5MtQ=mo,"I've had a fantastic experience with Vibe Dating App! It's one of the best dating apps for adults I've come across. The app's design is user-friendly, and the matching algorithm is impressive. I particularly love the focus on curvy dating, which is refreshing and inclusive. It’s also great for local dating, making it easy to connect with people nearby. The variety of profiles and the vibrant community keep things exciting and engaging.",5,8,1.7.5,2024-07-26 14:01:22,,,False
5989b1eb-6ae7-4970-88ef-a64211d512b0,Benjamin Goldstein,https://play-lh.googleusercontent.com/a/ACg8ocLe3RJ-H37dDumuYFoHuAwSAuCieibWs1NiLy_BacK9jj3AKw=mo,A bunch of fake profiles,1,1,1.7.5,2024-07-26 13:43:21,,,True
b74e2ec5-3cb0-471f-aabe-c04c9c01414b,Sion Hohn (Zion),https://play-lh.googleusercontent.com/a-/ALV-UjXKu7ehctAgTt3PyUzw641bMTaRUfkbXa1pHxOADBV0ZXcpbwTO,It's a cash grab. Would avoid the app. It's like everyone wants to sell you photos and videos.,1,3,1.7.5,2024-07-26 13:38:57,,,False
2f0ada1c-cb58-4aba-8eda-9f1bb04bc19f,Kenneth Anderson aka. Mr. KC (MR.KC),https://play-lh.googleusercontent.com/a-/ALV-UjULieD4EYtTHoWiVQD2dDv1la4c-OGbSZifuvL7Vd39yPIy3EUW,Just started give me time,4,1,,2024-07-26 05:23:49,,,False
d4be5421-f12b-4dfa-ab5a-634326b9c1f0,M,https://play-lh.googleusercontent.com/a/ACg8ocKprSg8rEAB22KvdGOlDVZwbaW9T_7k2Xm-gV6EQGlu1kM3Q18=mo,"Think of a pay to win game. The more you pay, the more scammy women you get matched with. Dont bother",1,1,1.7.5,2024-07-26 05:19:40,,,True
890d2a1b-d140-440a-9d34-4ca68249a228,Jose Reyes,https://play-lh.googleusercontent.com/a/ACg8ocI9NkczAt-fMWPuCkJutlVRFXe2Au_GBA59YgpM_QptKfZSdA=mo,"Do not waste your money on this, they are all bots",1,1,1.7.5,2024-07-26 03:01:26,,,True
67c09939-1df1-4b9c-8e79-4d26da9c6f70,Thiegrim Reaper,https://play-lh.googleusercontent.com/a-/ALV-UjU_lPkocLlRTXvGJzU_qErFeE9Prf_3vR4XRu2MUOkxL5mTpgI,This is a bs app.. please report... it's just bots designed to make you go premium,1,1,1.7.5,2024-07-26 00:11:54,,,False
30f2aba1-a64a-4d94-aed8-3046c9623262,John Boulder,https://play-lh.googleusercontent.com/a/ACg8ocKeOZe-bwBpLjsKhg98EjCI91QE8rwLcUGMtOTxKQy2SAFNWg=mo,so far ok,5,0,1.7.5,2024-07-25 23:06:12,,,False
3108001b-a95d-4516-8a93-cee290a4ed37,Timmehboi97,https://play-lh.googleusercontent.com/a-/ALV-UjUgkAx_8y3feU5LEuaAlHzRDIkD8sBSs86g4PBiuqqdn734l4fK,Bot central worst app ever,1,1,1.7.5,2024-07-25 22:39:41,,,False
3d7ac819-bf41-4dbb-887d-8836b6b50a6e,Mackenzie Matthews,https://play-lh.googleusercontent.com/a/ACg8ocLVXS15bfvUfERurDOxts9_JxQsvPRXnfQ5ZSGx5ERrihIaww=mo,99% bots and a paywall 👎,1,1,,2024-07-25 22:22:27,,,False
8c70ad60-a9a6-4576-920c-6937a6645cee,Kevin G,https://play-lh.googleusercontent.com/a/ACg8ocIIq4c_sE9sppNlQKBpymecw8KELjHcayg2WJJvJzOgItSJlg=mo,Paid for the upgrade once I paid for it I couldn't get back into the site,1,1,1.7.5,2024-07-25 20:27:29,,,False
cdfbf3bb-0f66-485c-8525-422f2f583c5d,Joshua Tabor,https://play-lh.googleusercontent.com/a-/ALV-UjXQU_gZS23PcOLPZ6H6BeuB7vjoEvpmpjNenLe4dUwuRykrdk0KgA,"APP IS TRASH!!! Start talking to a fake profile then suddenly a Pay wall. I paid once already, somehow deleted, reinstalled and forced to pay again. Then wants you to pay again 2 minutes after to continue to chat and see photos. Truley a rip off app to steal folks money talking to fake profiles. Those wanting to date beware. This is a fake dating app with fake profiles just to steal your $!",1,41,1.7.5,2024-07-25 20:11:41,,,True
036f151e-8791-4496-a437-fec6a9d9c0dc,David Albrecht,https://play-lh.googleusercontent.com/a/ACg8ocJuFtuRzK5c4OQd2vfdc1sYFXa9sQ6vYLEY-Re5qO0xfUn5CQ=mo,don't know yet,4,0,1.7.5,2024-07-25 17:16:59,,,False
1fc5611f-c3f9-4809-bf73-96afc3524a85,TJ LAYNE,https://play-lh.googleusercontent.com/a/ACg8ocL9dYCZQCBr8OTatM4EhUMnuVK2cJHKjAil7xlwuU7_GMPHp-fc=mo,this app has me hard from the get go.,5,0,1.7.5,2024-07-25 15:12:00,,,False
960216f3-070a-418b-9688-4169c34af1ea,Maureen Rucathi,https://play-lh.googleusercontent.com/a/ACg8ocJyd2TCgthtTBqZHVatypgYh_Q_qQCMRyTHttw1aazkmrhiAQ=mo,"Vibe app has completely changed the game for me in the world of dating apps. It's not just another platform; it's become my go-to for genuine connections filled with passion. The interface is smooth and easy to use, but what truly sets vibe apart is the emphasis on real interactions. Whether I'm looking for an adult flirt match or simply want to engage in online chatting with guys, Vibe provides the perfect space for that.",5,2,1.7.5,2024-07-25 15:09:02,,,False
9bde2e8d-f9d7-4940-80b7-c57ec2f6e349,Aaron Williams,https://play-lh.googleusercontent.com/a-/ALV-UjVUyh2UvVgBDln1tIE0ge5v0zwmdMSNDYEAg93tOK91ODmV274G,Chat bot that gets locked into purchase screen. No option to delete account now,1,1,1.7.5,2024-07-25 13:22:16,,,False
63a4de71-a9c3-4a92-bf4d-6bf31eb9c52f,William Vaughan,https://play-lh.googleusercontent.com/a-/ALV-UjU_1v4J-6qwRWDpv8CFkbhgfOhoVxMfF8Ryb-tm3QOj3pzq8yE,Didnt even get my profile set up. No pictures uploaded or anything. Already had 40 bots messaging me telling me how handsome I am. Immediately uninstalled,1,1,,2024-07-25 11:49:03,,,False
18d1e000-ea23-454b-b686-631a82b8c5fe,Dathan Bowen,https://play-lh.googleusercontent.com/a/ACg8ocI-3i0iqvzF8M35tPGVuZhyNJHL_vi22A2oxnmxkedlzkrwc0yk=mo,"Nothing but AI chatbots, never spoke with one lady. Worst app ever",1,1,,2024-07-25 10:23:37,,,False
09264cd3-1f40-4ca6-b46a-f46e45c2aa55,Chad Hatten,https://play-lh.googleusercontent.com/a-/ALV-UjV7SSkm6-RgNrgZ8W1ZLQAOs0NOgr5qY9rRqccczVJBHohKgvJd,scam app with bots,1,1,1.7.5,2024-07-25 07:39:23,,,True
3c9d0044-3586-4f55-b105-089e34f240c2,Dale Murphy,https://play-lh.googleusercontent.com/a-/ALV-UjVIiDyszlprX-BHLj-ug3e-pVOjj0QUT8HnoWv7sG-BKx0Qgf3C,Scam scam scam. Completely,1,1,1.7.5,2024-07-25 07:16:05,,,True
4c2e1a13-ab35-4d4f-9029-829a6c9243fa,Cheyne Gilbert,https://play-lh.googleusercontent.com/a-/ALV-UjVCJnrM_YX0yTj7ANdXi6KTdtXPBw4L6j-0Vg8ipO8EwoZwDL17,"Terrible asf I can't get my refund, and they're at least 1-4 bots on there.",1,1,,2024-07-25 07:11:08,,,False
42d7db13-7eef-4cfd-a6ee-653439edadaa,Blake Pablo - Jerome,https://play-lh.googleusercontent.com/a-/ALV-UjW8bnHbmruLEKxzh0aR46EPTjEI3HdeaP8YmHBGiDR8h1kLfo8,This app is a scam with fake profiles.,1,1,1.7.5,2024-07-25 06:28:08,,,True
a23848ec-cf17-4e52-90c0-cfc14080605a,Adiel Salgado Cruz,https://play-lh.googleusercontent.com/a/ACg8ocI1NACnTW_vRE9lZ5Z5eghGGYDjnzM0GJWR8esMwlek2rifbA=mo,"Fake, full of bots, asks for a subscription after a couple minutes.",1,1,,2024-07-25 04:26:15,,,False
e6a13c1c-9e53-473b-a044-a9ed71c0de52,VEGETA XP,https://play-lh.googleusercontent.com/a-/ALV-UjWLQnWqcLCrtS9b0uyyZMDksApjSceTCYDgtdYxgbLNsh1VMzU,It steals your money,1,1,1.7.5,2024-07-25 03:50:54,,,True
d2155afa-50f5-4c15-b941-c25d03e17bb5,Brandon Jukosky,https://play-lh.googleusercontent.com/a-/ALV-UjVWmYDopIopu3v6Upue4EPmBRU2Tltwo1W7YP5o1hLLjkRqyBW9,Scam. Don't use,1,1,1.7.5,2024-07-25 03:18:04,,,True
7cfdc13b-8ff1-46dc-93f0-1df1f9b1be7d,Michael Hingley,https://play-lh.googleusercontent.com/a-/ALV-UjUun3r23XDt6cgGMo1SRYYRPxABc_Jrfnbzw91sz4mbMX-NhpClHg,Minus 5 stsrs if i coukd give it. Mis leading app. Add said free to chat. 2 minute in asking for payment to continue when you pay. You get to see messages. To answer you need to pay more. I wish there actually was a true dating app. Costs upfront before you sign up. Don't waste your money,1,18,1.7.5,2024-07-25 02:59:51,,,True
aa4ffb04-f80e-46b0-a15d-209cd4c6a0e1,Johnny Elie,https://play-lh.googleusercontent.com/a-/ALV-UjVPQnnIpEXNki-PCO5BGL5nx-rT-eAagnoHPYA8kfdHmC-zieew,Straight bots and itll try to make you pay to message just for you to not be able to message cause you need to pay to be a member to message bots.,1,1,1.7.5,2024-07-25 02:46:20,,,False
b0f51f59-0bfe-43ba-a351-fd597a0c5fde,Mark Bates,https://play-lh.googleusercontent.com/a-/ALV-UjVEztxqHHEkCz22LeSIx1zX-u7xO2BGRL5sXL_OcJWJi6y-dCxQ,This app will PAYWALL you after only 7 texts on its site DO NOT USE,1,1,,2024-07-25 00:06:39,,,False
01243dc7-109b-4cde-a5e7-3981b9fc68b3,Tokin Bud,https://play-lh.googleusercontent.com/a-/ALV-UjX4D80LCkvtRmPH1IM5hMGGuTbnp3c02sHfirhdgN8FY2EG22av,"Huge scam, girls throw themselves at you for a video scam.",1,1,1.7.5,2024-07-24 22:24:00,,,True
04bc4f37-5410-4512-b09e-430b8346199f,Carlos Rivera,https://play-lh.googleusercontent.com/a/ACg8ocJrjfjFn0gdy8SS9KVeheO_6BSjkQcJIqFuN8nzI4zNlrInLw=mo,is an app that baits u into buying in. I just paid 4 bucks to continue to chat. that's what I thought but no they want u to pay for a subscription in order to keep chatting. a scam if u ask me.,1,6,1.7.5,2024-07-24 20:32:03,,,True
15ec2e56-d2e8-420f-b757-96d98fd7aa1a,Jon Coopington,https://play-lh.googleusercontent.com/a-/ALV-UjUV17z1z2m5xIeXEfG6Zkt6KWjJ5sxr9WpIKImqbgKXulERVhU,"Awful and predatory monetization, full of Bots proposition you for meets that you suddenly can't view until you buy the Pro version of the App, and then they charge you again to reply. Shady, slimy, greedy little app. Avoid like the plague",1,13,1.7.5,2024-07-24 18:41:08,,,False
eec8540f-bf5e-4252-936e-a87778c2ae18,Cameron Ricksecker,https://play-lh.googleusercontent.com/a-/ALV-UjXCXp5gs-vJBvTOThCrQ_vi6HBDoDeHPgLitGFuC2e00t7bj8P7,"Hmm, as soon as someone said ""hey, let's video call to verify each other"" I suddenly have the issue of the app requiring money for me to even use it. You wouldn't happen to by any chance be... idk... fake and just wanting to scam people out of money or something are you? Nahhh, that'd be crazyyy, nobody would ever do that 😑",1,7,1.7.5,2024-07-24 18:01:51,,,True
801ace45-4a05-49e8-9b76-b285d1ae8234,Jeff Buckley,https://play-lh.googleusercontent.com/a-/ALV-UjVLhnvZeoDRsw3g-kjzXclouLYdsMjLogZTBNCKio11TFpb6xNY,On it less than 10 minutes and every account so far is a bit repeating the same messages,1,1,1.7.5,2024-07-24 17:33:05,,,False
a59b2a82-89d8-4997-9aba-27eab4210002,Gomolemo Mabonela,https://play-lh.googleusercontent.com/a/ACg8ocID-qEYNgKdQn8A-ds8Lr1cHFJvdBvpuoI7NMeBwdIfu9Md8A=mo,Great!,5,0,1.7.5,2024-07-24 15:07:59,,,False
20d8500c-5407-4f50-8c12-c4d5dba9802b,Sebastian Gale,https://play-lh.googleusercontent.com/a-/ALV-UjVRKJR5iMUCYuOEQEJpQS_bYCwnUmCINEKIyJ6hvAQ4RrVYi1sj,"Girl didn't understand that I'm transgender ftm and hadn't started testosterone, and they keep spamming me, and the app made u pay for it just to talk to girl. Plus, I'm fing gay I like men",1,1,,2024-07-24 14:38:57,,,False
9df6465f-1c14-4b99-8553-bbbb87a0161b,John Smith,https://play-lh.googleusercontent.com/a/ACg8ocJU2wbJXd4BnLbN4W1Sbt_P6HxBb9JyUPww2neadQS596GiLw=mo,A dating app that makes you pay to message? Screw that 🤣. At least MeetMe let's you talk to people and that app is even worse,1,1,,2024-07-24 11:19:07,,,False
e92921a7-1602-465b-92b9-b678725e678f,John Sullivan,https://play-lh.googleusercontent.com/a-/ALV-UjW-2ziClHxnzytmJgrhWrvI_HUcTZApy-pMUK_o_0dV9ybscr2i,Complete bs all bots cant even close payment page,1,1,1.7.5,2024-07-24 06:53:53,,,False
f0207768-3df1-4709-af9e-6bd23dae4b63,Juan Mims,https://play-lh.googleusercontent.com/a/ACg8ocJU5GzDpNdLphi2a_MR_P4K3UdquHCRReCbyx_q-Afcnz2bDYw=mo,beautiful forward girls who know what they want,5,0,1.7.5,2024-07-24 03:50:45,,,False
7973cdc5-b588-43b9-83ba-7e4aa204c696,Crimmy Z,https://play-lh.googleusercontent.com/a-/ALV-UjXjNdgV6uEfq8D27sjBOFVDwXi9HZuxHWyiY2h3i57Ds9_Fe7p1,Trash,1,1,1.7.5,2024-07-24 03:26:17,,,False
4572ffed-feeb-4699-870e-e5ecc750370d,ChastityMatrix,https://play-lh.googleusercontent.com/a-/ALV-UjW4HUC4iHHGbGMZuErX2n3vEZgjMOSKJF6y7aO53V6Sxy3y9lIk,"You get 5 messages before you're forced to pay to ""activate account"" and then forced to pay again to continue messaging. And if you get the ""activate account"" pay wall, it blocks you from doing ANYTHING on the app until you do pay. Small amount to pay to see what happens and then slapped with a $20+ one immediately after.",1,168,1.7.5,2024-07-24 02:49:03,,,False
